tweet_id,fecha_utc,contenido_texto,retweets,favoritos,fecha_limpia
at://did:plc:5mcwndzubizlvxtd7kotx53n/app.bsky.feed.post/3mhrffkk3js2n,2026-03-24 01:12:07.146000+00:00,MY LOVER TJE APPLE OF MY EYE WAHHHSHH CHIKAI I LOVE YOU SMSMSM,0,1,2026-03-24
at://did:plc:wjljc54nads6ix5tlp4swebe/app.bsky.feed.post/3mhrbeo2tps2n,2026-03-24 00:00:02.246880+00:00,"teckel Web3 API hourly update Eth price (USD): 2151.62 (-0.0% 1 hr, +4.8% 24 hr) Click for API details API keys via App: Apple App Store Google Play Store #teckel #eth",0,0,2026-03-24
at://did:plc:4wsvlvxv4ag2hgyznuelhmfs/app.bsky.feed.post/3mhrctezyyiy2,2026-03-24 00:26:02+00:00,"RE: https://toot.cafe/@slightlyoff/116281285290733971 It's funny how Apple is doing both at the same time here: a) proactively fighting browser engine monoculture, while at the same time b) requiring browser engine monoculture. рЯЩВ",0,1,2026-03-24
at://did:plc:ma3v6ye4e2yhlecphcotllln/app.bsky.feed.post/3mhrdfpc7e22x,2026-03-24 00:36:24.647000+00:00,AppleвАЩs successor is Kiwi (Angemon) (not intentional) but man am I missing Apple rn. I could just run past level 27 mons with him but now they are beating my ass on sight,0,0,2026-03-24
at://did:plc:nnlrtguuxgcyfkfeq7c2c7ne/app.bsky.feed.post/3mhssysjtt22h,2026-03-24 14:48:11.444000+00:00,"Never once in my entire life have I made my last name possessive like this, but every time I type my name it shows this",0,0,2026-03-24
at://did:plc:wjljc54nads6ix5tlp4swebe/app.bsky.feed.post/3mhstnyj5wr2i,2026-03-24 15:00:02.275373+00:00,"teckel Web3 API hourly update Eth price (USD): 2136.50 (+0.0% 1 hr, -2.1% 24 hr) Click for API details API keys via App: Apple App Store Google Play Store #teckel #eth",0,0,2026-03-24
at://did:plc:vax2waby4aj6iua5p6ksxs6h/app.bsky.feed.post/3mhsrwqn27c2l,2026-03-24 14:29:08.602000+00:00,"I'm surprised Nintendo is such a big component of FTC's revenues, are they a separate entity from the Foxconn that assemble for Apple, Sony and other Mfgs?",0,1,2026-03-24
at://did:plc:wygiwgrm6hlkw4jo7gsxeptx/app.bsky.feed.post/3mhss3x26is2w,2026-03-24 14:32:03.095000+00:00,"Fuck man. While I admire Sweeney for buying those forests to prevent development, could hen not have used some of his wealth to you know help HIS employees? Or maybe he could have not wasted millions of company money tilting at Apple shaped windmills or trying to out Valve, Valve.",0,0,2026-03-24
at://did:plc:4yejhfkl3tumnddnl4lqkvsa/app.bsky.feed.post/3mhsrys54gc2n,2026-03-24 14:30:17.286000+00:00,Apple has cash. They should buy the Star Trek franchise.,0,3,2026-03-24
at://did:plc:3zqc3p4lido563et3uv6f2cw/app.bsky.feed.post/3mhss7zyv222z,2026-03-24 14:34:20.417000+00:00,Better keep suing apple to compensate for their losses!,1,8,2026-03-24
at://did:plc:igaily3xoqb6qvsb4miwbijm/app.bsky.feed.post/3mhsxbtgzac2n,2026-03-24 16:04:49.357000+00:00,Links to full video рЯСЗ YOUTUBE youtu.be/DkK8IiNrn8Q SPOTIFY bit.ly/4dHzM1H APPLE PODCASTS apple.co/3PlFL2j,0,1,2026-03-24
at://did:plc:s4xmseub4a4pwwetg2xxmcyy/app.bsky.feed.post/3mhsxsecd5s2o,2026-03-24 16:14:03.885769+00:00,Apple Business Discussion,0,0,2026-03-24
at://did:plc:jf26a7dgps3fck4zc7anchdl/app.bsky.feed.post/3mhspeiyphv2p,2026-03-24 13:43:09.042986+00:00,и®ШдЇЛгБЃи¶БзіД: AppleгБѓ2026еєігБЃWorldwide Developers ConferenceпЉИWWDCпЉЙгВТ6жЬИ8жЧ•гБЛгВЙ12жЧ•гБЂйЦЛеВђгБЩгВЛгБУгБ®гВТзЩЇи°®гБЧгБЊгБЧгБЯгАВдїКеЫЮгБЃгВЂгГ≥гГХгВ°гГђгГ≥гВєгБІгБѓгАБгАМAIгБЃйА≤е±ХгАНгБЂзД¶зВєгВТељУгБ¶гАБiOSгАБmacOSгАБtvOSгАБwatchOSгБ™гБ©гБЃгГЧгГ©гГГгГИгГХгВ©гГЉгГ†гБЃгВҐгГГгГЧгГЗгГЉгГИгВДжЦ∞гБЧгБДгВљгГХгГИгВ¶гВІгВҐгАБйЦЛзЩЇиАЕгГДгГЉгГЂгБЃзЩЇи°®гБМжЬЯеЊЕгБХгВМгБ¶гБДгБЊгБЩгАВжШ®еєігБЃгВЂгГ≥гГХгВ°гГђгГ≥гВєгБІгБѓгАБгВ™гГХгГ©гВ§гГ≥гБІеЛХдљЬгБЩгВЛAIгГҐгГЗгГЂгБМзієдїЛгБХгВМгБ¶гБКгВКгАБдїКеєігВВгБЭгБЃйА≤е±ХгБМзЩЇи°®гБХгВМгВЛеПѓиГљжАІгБМгБВгВКгБЊгБЩгАВ,0,0,2026-03-24
at://did:plc:5ktuommdojwh5o6z4rvud4hp/app.bsky.feed.post/3mhsziww3bc2k,2026-03-24 16:44:35.362000+00:00,"Seems to be only on Android, at least outside the EU. Apple forces all browsers on iPhone to use WebKit (Safari's engine), so there isn't much Mozilla can do",0,0,2026-03-24
at://did:plc:xm3ftshqdpmh5jumkef6syfz/app.bsky.feed.post/3mht3jtysss2z,2026-03-24 17:20:53.344000+00:00,"tim sweeney is a piece of shit. he went to war with apple claiming it was about fairness while profiting off children who don't understand fake currency. fired 1000 people, apologized, did it again, then raised v-bucks prices right before doing it again. just an absolute piece of shit",1,1,2026-03-24
at://did:plc:bpcgpt5n7fxbpfktdzsl2lm2/app.bsky.feed.post/3mht77otlq224,2026-03-24 18:26:47.353000+00:00,"im drinking like a ""ciderboys"" pinapple apple cider and its real good but like im just sitting here like. damn. i kind of shouldve just got... Apple. Normal ass apple cider.",0,3,2026-03-24
at://did:plc:qercme6mfrbxuhqj6xrnd6ff/app.bsky.feed.post/3mhtapw2ybs2v,2026-03-24 18:53:45.547000+00:00,"in order to show up on radar why do you need a transponder? Shouldn't the radar be better than: I can only see you if you're wearing this apple airtag. Radar should pickup everything moving of a certain size, right?!",0,0,2026-03-24
at://did:plc:2twltywqvke7krgeakmhn7o6/app.bsky.feed.post/3mhtczekmhuk2,2026-03-24 19:34:48+00:00,"RE: https://peoplemaking.games/@leon/116263360838788054 Especially since the вАЬsimpleвАЭ stuff is *never* as simple as they seem to think that it is. If simple things were really that simple, tech troubleshooters like me would be out of a job. So yes, Apple has got it completely wrong these days [вА¶]",1,0,2026-03-24
at://did:plc:euqtom2jjgggf2bi2dob5akf/app.bsky.feed.post/3mhtouy7jws2p,2026-03-24 23:07:07.949000+00:00,Jon named it on Velshi вАФ hype machine covers nodes without connecting the architecture. Apple blocking his Lina Khan interview was the vacancy mechanism: platform capture silencing the person who named platform capture. I mapped it from Hawai їi. riosdesign.substack.com/p/the-vacancy,0,0,2026-03-24
at://did:plc:od2z3pgpyyyxuqhnlyj3wgfv/app.bsky.feed.post/3mhtc3b7zis2o,2026-03-24 19:18:00.088000+00:00,"i think the wildest thing about CEOs deciding to ruin countless lives over one yacht is that these games are profitable, you just want an infinite money glitch!!! (And even if they weren't, as a CEO, how are you mitigating that? Oh you're just fighting google and apple for more money???)",1,8,2026-03-24
at://did:plc:extqxtsoc4q4qnbmwizooppn/app.bsky.feed.post/3mhtaozosrx2s,2026-03-24 18:52:41+00:00,#NowPlaying рЯХ† 5:52 am рЯОµ drawbacks рЯІСвАНрЯО§ dust рЯМ± Triple J Unearthed рЯОІ Apple Music / YouTube Music,0,0,2026-03-24
at://did:plc:34w6p2nygxpqkiqbkrnq56ip/app.bsky.feed.post/3mhtem6qlkd2s,2026-03-24 20:02:38+00:00,#NowPlaying рЯХЦ 7:02 am рЯОµ Steer рЯІСвАНрЯО§ Missy Higgins рЯТњ On A Clear Night рЯОІ Apple Music / YouTube Music рЯУЭ Lyrics,0,0,2026-03-24
at://did:plc:34w6p2nygxpqkiqbkrnq56ip/app.bsky.feed.post/3mhrutaskgs2e,2026-03-24 05:47:43+00:00,#NowPlaying рЯХЯ 4:47 pm рЯОµ Mysterious (ЎѓЎ±џМЎІ) рЯІСвАНрЯО§ Parissa Tosif рЯМ± Triple J Unearthed рЯОІ Apple Music / YouTube Music,0,0,2026-03-24
at://did:plc:namifrcorf6hzy45phd4shvt/app.bsky.feed.post/3mhsljt5lhx2g,2026-03-24 12:34:32.367417+00:00,"Apple reportedly planning major iPhone upgrades, including a foldable model potentially this year and an edge-to-edge screen for the 20th-anniversary iPhone, possibly in 2027. #iPhone #iPhone #News",0,0,2026-03-24
at://did:plc:dlfk422nufhdwikldgfgebmc/app.bsky.feed.post/3mhsm4iuek22x,2026-03-24 12:44:59.328000+00:00,"...I'm still confused as to how Apple TV got the rights to kaiju, unless this is a Toho thing?",0,0,2026-03-24
at://did:plc:bnokmh46ndqelhgwhbspsxnv/app.bsky.feed.post/3mhslueg3bk2o,2026-03-24 12:40:26.229000+00:00,"REDUX REDUX (2025) Streaming Now VOD/Digital вАУ Sale/Rental (Apple, Amazon, Fandango at Home, etc.) #ReduxRedux",0,8,2026-03-24
at://did:plc:mfcrrwbuzidwi33icsbxvijo/app.bsky.feed.post/3mhsnu7xf7k2s,2026-03-24 13:16:09.038000+00:00,"Peekaboo could not decide whether he wanted love or snacks last night. рЯТЫрЯНО So he kept going back and forth between getting attention from me and eating his apple, all while wearing a faint smudge of sweet potato on his nose like porcupine bronzer. рЯШЖ Honestly, he looked fabulous.",2,13,2026-03-24
at://did:plc:extqxtsoc4q4qnbmwizooppn/app.bsky.feed.post/3mhromtzfai2v,2026-03-24 03:56:45+00:00,#NowPlaying рЯХЭ 2:56 pm рЯОµ Chemical рЯІСвАНрЯО§ Post Malone рЯОІ Apple Music / YouTube Music рЯУЭ Lyrics,0,0,2026-03-24
at://did:plc:34w6p2nygxpqkiqbkrnq56ip/app.bsky.feed.post/3mhrpxr2sb226,2026-03-24 04:20:22+00:00,#NowPlaying рЯХТ 3:20 pm рЯОµ Boys рЯІСвАНрЯО§ Lizzo рЯОІ Apple Music / YouTube Music рЯУЭ Lyrics,0,0,2026-03-24
at://did:plc:jf26a7dgps3fck4zc7anchdl/app.bsky.feed.post/3mhsj4vydnr2p,2026-03-24 11:51:31.772389+00:00,и®ШдЇЛгБЃи¶БзіД: з±≥гВҐгГГгГЧгГЂгБЃгВ™гГ≥гГ©гВ§гГ≥гВєгГИгВҐгБІгБѓгАБе§ЦдїШгБСгВєгГИгГђгГЉгВЄгБМеУБеИЗгВМзґЪеЗЇгБЧгБ¶гБКгВКгАБгБУгВМгБѓжЈ±еИїгБ™гГ°гГҐгГ™гГБгГГгГЧдЄНиґ≥гБМељ±йЯњгБЧгБ¶гБДгВЛгБ®иАГгБИгВЙгВМгБ¶гБДгБЊгБЩгАВзЙєгБЂгАБгВѓгГ™гВ®гВ§гГЖгВ£гГЦгБ™ж•≠еЛЩгБІдљњзФ®гБХгВМгВЛAppleгБЃгВ≥гГ≥гГФгГ•гГЉгВњгГЉгБѓгАБе§ІеЃєйЗПгГЗгГЉгВњгБЃдњЭе≠ШгБЂе§ЦдїШгБСгВєгГИгГђгГЉгВЄгВТе§ЪгБПеИ©зФ®гБЧгБ¶гБКгВКгАБгГЗгГЉгВњгВїгГ≥гВњгГЉгБЃжЛ°еЉµгВДAIжКАи°УгБЃйЬАи¶БгБМгГБгГГгГЧдЄНиґ≥гВТеЉХгБНиµЈгБУгБЧгБ¶гБДгБЊгБЩгАВгБУгБЃељ±йЯњгБІгАБгВєгГИгГђгГЉгВЄгГЗгГРгВ§гВєгБЃдЊ°ж†ЉгБМдЄКжШЗгБЧгБ¶гБКгВКгАБдїКеЊМ2еєідї•еЖЕгБЂгБѓгВєгГЮгГЉгГИгГХгВ©гГ≥гБ™гБ©гБЃдЊ°ж†ЉгБЂгВВж≥ҐеПКгБЩгВЛеПѓиГљжАІгБМгБВгВКгБЊгБЩгАВAppleгБЃгВ¶гВІгГЦгВµгВ§гГИгБІгБѓгАБгГХгГ©гГГгВЈгГ•гГЙгГ©гВ§гГЦгВДгГЭгГЉгВњгГЦгГЂе§ЦдїШгБСHDDгБ™гБ©гБЃе§ЪгБПгБЃи£љеУБгБМи≥ЉеЕ•гБІгБНгБ™гБДзКґжЕЛгБІгАБеЬ®еЇЂгБМгБВгВЛгБЃгБѓйЩРгВЙгВМгБЯи£љвА¶,0,0,2026-03-24
at://did:plc:34w6p2nygxpqkiqbkrnq56ip/app.bsky.feed.post/3mhsjbu3uty2e,2026-03-24 11:52:59+00:00,#NowPlaying рЯХ• 10:52 pm рЯОµ Doctrine Of Love рЯІСвАНрЯО§ Jalen Ngonda рЯОІ Apple Music / YouTube Music рЯУЭ Lyrics,0,0,2026-03-24
at://did:plc:jf26a7dgps3fck4zc7anchdl/app.bsky.feed.post/3mhsjc3yiv32k,2026-03-24 11:54:25.851128+00:00,и®ШдЇЛгБЃи¶БзіД: AppleгБѓгАБжѓОеєіжБТдЊЛгБЃWorldwide Developers ConferenceпЉИWWDCпЉЙгВТ2026еєі6жЬИ8жЧ•гБЛгВЙ12жЧ•гБЊгБІгВ™гГ≥гГ©гВ§гГ≥ељҐеЉПгБІйЦЛеВђгБЩгВЛгБУгБ®гВТзЩЇи°®гБЧгБЊгБЧгБЯгАВгБУгБЃгВЂгГ≥гГХгВ°гГђгГ≥гВєгБІгБѓгАБдЄЦзХМдЄ≠гБЃгГЗгГЩгГ≠гГГгГСгГЉгБМйЫЖгБЊгВКгАБAppleгБЃжЬАжЦ∞гБЃгВљгГХгГИгВ¶гВІгВҐгВДгГЖгВѓгГОгГ≠гВЄгГЉгВТзієдїЛгБЧгАБдЇ§жµБгВДгВ§гГОгГЩгГЉгВЈгГІгГ≥гВТдњГйА≤гБЩгВЛж©ЯдЉЪгБМжПРдЊЫгБХгВМгБЊгБЩгАВгБЊгБЯгАБзЙєеИ•гБ™гВ§гГЩгГ≥гГИгБМApple ParkгБІи°МгВПгВМгАБгГЗгГЩгГ≠гГГгГСгГЉгБ®е≠¶зФЯгБЃдЇ§жµБгБЃе†ігВВи®≠гБСгВЙгВМгБЊгБЩгАВгБХгВЙгБЂгАБеД™гВМгБЯдљЬеУБгВТжПРеЗЇгБЧгБЯ50еРНгБЃеПЧи≥ЮиАЕгБЂгБѓгАБгВѓгГСгГЖгВ£гГЉгГОгБІгБЃзЙєеИ•гБ™дљУй®УгБМжЛЫеЊЕгБХгВМгБЊгБЩгАВWWDCгБЂйЦҐгБЩгВЛи©≥зі∞гБѓгАБдїКеЊМзЩЇи°®гБХгВМгВЛдЇИеЃЪгБІгБЩгАВ,0,1,2026-03-24
at://did:plc:fsftz5ue2bvlvkb6zx2bqdnh/app.bsky.feed.post/3mhtdakpp4r2e,2026-03-24 19:38:51.459455+00:00,"Apple has released iOS 26.4, bringing 13 enhancements to your iPhone. The new software update includes 8 new emoji characters,...",0,1,2026-03-24
at://did:plc:mzaur6jz4upm3ukyjjhqygrk/app.bsky.feed.post/3mhtgii4zu22u,2026-03-24 20:36:58.500000+00:00,Oh weвАЩre on point 4 already?- EIGHT NEW EMOJI???? #SOLD!!,0,1,2026-03-24
at://did:plc:bnokmh46ndqelhgwhbspsxnv/app.bsky.feed.post/3mhsoiutqbs2o,2026-03-24 13:27:42.026000+00:00,"""WUTHERING HEIGHTS"" (2026) Streaming: March 31, 2026 PVOD (Apple, Amazon, Fandango at Home, etc.) #WutheringHeights whentostream.com/emerald-fenn...",4,20,2026-03-24
at://did:plc:jtir3tfw5lgp34t7akdbwgkl/app.bsky.feed.post/3mhtksgt2i22c,2026-03-24 21:54:07.641000+00:00,"The SSD inside the MacBook Neo will be rated for a lifetime of at least 5 years of average use%; abnormally-high usage will shorten it by a bit, but not a huge amount. ---- % Based on the standards Apple has used for about 15 years",0,0,2026-03-24
at://did:plc:me6ersmiuhnmvw2p6ugikthf/app.bsky.feed.post/3mhtqnkncsc2o,2026-03-24 23:38:46.324000+00:00,"Tried to redeem my free MLB.tv from T-Mobile, and Apple charged me for NetflixвА¶.рЯ§ЈрЯПЊвАНвЩВпЄП The absolute stupidest gd timeline of forever insanity.",0,0,2026-03-24
at://did:plc:ndcr7jd5ugla7dvlx4ckra6e/app.bsky.feed.post/3mht7gbcn7k2g,2026-03-24 18:30:28.045000+00:00,"Free, non-Apple News version: archive.ph/SA70g",0,2,2026-03-24
at://did:plc:6j3vkdlplakae7opya3cgcmz/app.bsky.feed.post/3mhtlmlcus22i,2026-03-24 22:08:44.766000+00:00,IвАЩve got Netflix. Currently donвАЩt have Apple+ or Peacock. Thankfully IвАЩll have plenty of games to watch on Victory+ and on MLB Extra Innings.,0,0,2026-03-24
at://did:plc:dbx6qrjuzxwtqp6v7yb7ipvu/app.bsky.feed.post/3mhrmj66xik2l,2026-03-24 03:19:24.610000+00:00,I donвАЩt get why people rice their Linux DEs to plaster them in Apple logos. I get using AppleвАЩs design elements because theyвАЩre some of the best designers in the world. IвАЩve incorporated a handful into my GNOME PC. But why would I want AppleвАЩs logo on a machine they had nothing to do with?,0,0,2026-03-24
at://did:plc:extqxtsoc4q4qnbmwizooppn/app.bsky.feed.post/3mhsktuyzuq25,2026-03-24 12:21:19+00:00,#NowPlaying рЯХЪ 11:21 pm рЯОµ Wide Awake рЯІСвАНрЯО§ ODESZA рЯТњ The Last Goodbye рЯОІ Apple Music / YouTube Music рЯУЭ Lyrics,0,0,2026-03-24
at://did:plc:extqxtsoc4q4qnbmwizooppn/app.bsky.feed.post/3mhsn57sd5s2w,2026-03-24 13:02:12+00:00,#NowPlaying рЯХЫ 12:02 am рЯОµ Claws рЯІСвАНрЯО§ MAY-A рЯТњ Goodbye (If You Call That Gone) рЯМ± Triple J Unearthed рЯОІ Apple Music рЯУЭ Lyrics,0,0,2026-03-24
at://did:plc:extqxtsoc4q4qnbmwizooppn/app.bsky.feed.post/3mhrcklrrff2o,2026-03-24 00:20:58+00:00,#NowPlaying рЯХЪ 11:20 am рЯОµ LEZ GO! рЯІСвАНрЯО§ G Flip & The Beaches рЯОІ Apple Music рЯУЭ Lyrics,0,0,2026-03-24
at://did:plc:v2gkr74wvncjqopvxwvbl4wt/app.bsky.feed.post/3mhspazq7qc2o,2026-03-24 13:41:12.461000+00:00,no one: absolutely no one: Apple developer bros: aesthetically dreadful system update,0,1,2026-03-24
at://did:plc:tb7swookvajghrr5egve7yn6/app.bsky.feed.post/3mhsrvglvbs2b,2026-03-24 14:28:24.523000+00:00,"You poor thing. So traumatic washing dishes by hand. The horror рЯ§£рЯ§£рЯ§£ When I went to buy a new iPhone last month, I had to wait an extra day to get it because my local Apple Store didnвАЩt have an iPhone17 in stock in sage green #firstworldproblems",0,1,2026-03-24
at://did:plc:rxygxbbyeuvbmmei2peddmor/app.bsky.feed.post/3mhsjf7fgrk2r,2026-03-24 11:56:10.166000+00:00,"Like every year around this time, I now have several hundred вАЬpetsвАЭвАФ1 kg of mealworms. They just arrived and are already well fed with wheat bran, oatmeal, and apple slices. The wild birds will be delighted!",1,1,2026-03-24
at://did:plc:extqxtsoc4q4qnbmwizooppn/app.bsky.feed.post/3mhrjwnxroi2o,2026-03-24 02:32:02+00:00,#NowPlaying рЯХЬ 1:32 pm рЯОµ Young Blood рЯІСвАНрЯО§ The Naked And Famous рЯТњ Passive Me Agressive You рЯОІ Apple Music / YouTube Music рЯУЭ Lyrics,0,0,2026-03-24
at://did:plc:ym3vvvsz4ts3e3pe5jhqdpr5/app.bsky.feed.post/3mhsr3bawsk2s,2026-03-24 14:13:46.506000+00:00,"there was a very small but also sturdy fork stuck in the drain in our old house on Burnside and that is the best fork for eating apple and banana slices with I'm not particular about forks in any other scenario, but when eating apple and banana slices, it needs to be that specific fork.",0,1,2026-03-24
at://did:plc:fzvckr5pnqkkknf4mitbon5j/app.bsky.feed.post/3mhsr4u2p7s2l,2026-03-24 14:14:39.779000+00:00,I went to the Apple Store рЯЂ£,0,1,2026-03-24
at://did:plc:o6ggjvnj4ze3mnrpnv5oravg/app.bsky.feed.post/3mhsgjxncqs2m,2026-03-24 11:05:08.379593+00:00,"Feed: ""Apple Must"" By: Jonny Evans on Monday, March 23, 2026",0,0,2026-03-24
at://did:plc:34w6p2nygxpqkiqbkrnq56ip/app.bsky.feed.post/3mhsx5al6pd2j,2026-03-24 16:01:42+00:00,#NowPlaying рЯХТ 3:01 am рЯОµ Do I Want Fame? рЯІСвАНрЯО§ Sally Seltmann рЯТњ Art School Reverie рЯОІ Apple Music / YouTube Music рЯУЭ Lyrics,0,0,2026-03-24
at://did:plc:ncbcyhvgx77xru3an5qwpyur/app.bsky.feed.post/3mhrxaxsrp22q,2026-03-24 06:31:40.645000+00:00,"If youвАЩd like to listen to my music and follow my journey, then look for Storzin Music on YouTube, Spotify, Apple Music and Amazon Music.",0,2,2026-03-24
at://did:plc:extqxtsoc4q4qnbmwizooppn/app.bsky.feed.post/3mhrdfff7ti2a,2026-03-24 00:34:57+00:00,#NowPlaying рЯХ¶ 11:34 am рЯОµ All I Did Was Dream Of You рЯІСвАНрЯО§ beabadoobee рЯОІ Apple Music / YouTube Music рЯУЭ Lyrics,0,0,2026-03-24
at://did:plc:34w6p2nygxpqkiqbkrnq56ip/app.bsky.feed.post/3mhresorloz2f,2026-03-24 01:00:45+00:00,#NowPlaying рЯХЫ 12:00 pm рЯОµ Terrestrials рЯІСвАНрЯО§ POND рЯОІ Apple Music / YouTube Music рЯУЭ Lyrics,0,0,2026-03-24
at://did:plc:wjljc54nads6ix5tlp4swebe/app.bsky.feed.post/3mhrlgkgyl32s,2026-03-24 03:00:02.977178+00:00,"teckel Web3 API hourly update Eth price (USD): 2135.43 (-0.1% 1 hr, +3.6% 24 hr) Click for API details API keys via App: Apple App Store Google Play Store #teckel #eth",0,0,2026-03-24
at://did:plc:2wkum3vsxuzuzytaotw2bjgh/app.bsky.feed.post/3mhrtbwiijws2,2026-03-24 05:20:15+00:00,"IвАЩm perplexed by the recent #Apple ads that appear to be not only AI slop, but sloppy, uncleaned, AI slop. What is going on over there? DidnвАЩt attention to detail used to be their thing?",0,1,2026-03-24
at://did:plc:qunibdkghbvronvhdzmuvcvo/app.bsky.feed.post/3mhsk77uuot2t,2026-03-24 12:10:42.543468+00:00,Apple verliert Home-Hardware-Manager an Smartring-Hersteller,0,0,2026-03-24
at://did:plc:jf26a7dgps3fck4zc7anchdl/app.bsky.feed.post/3mhskdqxnbx23,2026-03-24 12:13:15.132862+00:00,и®ШдЇЛгБЃи¶БзіД: AppleгБѓгАБ2026еєідЄКеНКжЬЯгБЂжЬАжЦ∞гБЃеЕ•йЦАiPadгВТгГ™гГ™гГЉгВєгБЩгВЛжЇЦеВЩгВТйА≤гВБгБ¶гБКгВКгАБгБУгБЃжЦ∞гГҐгГЗгГЂгБЂгБѓApple IntelligenceгБЂгВИгВЛдЇЇеЈ•зЯ•иГљгБЃгВµгГЭгГЉгГИгБМеРЂгБЊгВМгВЛгБ®еЩВгБХгВМгБ¶гБДгБЊгБЩгАВгБУгБЃiPadгБѓгАБA18гГБгГГгГЧгВТжР≠иЉЙгБЧгАБгГСгГХгВ©гГЉгГЮгГ≥гВєгБЃеРСдЄКгБМжЬЯеЊЕгБХгВМгБ¶гБДгБЊгБЩгАВгБУгВМгБЂгВИгВКгАБеЊУжЭ•гБѓгГПгВ§гВ®гГ≥гГЙгГЗгГРгВ§гВєгБІгБЃгБњеИ©зФ®еПѓиГљгБ†гБ£гБЯAIж©ЯиГљгБМгАБжЙЛй†ГгБ™дЊ°ж†ЉгБЃiPadгБІгВВеИ©зФ®гБІгБНгВЛгВИгБЖгБЂгБ™гВКгБЊгБЩгАВAppleгБѓгАБгГЗгВґгВ§гГ≥гВДе§ІгБНгБ™ж©ЯиГље§ЙжЫігБѓи°МгВПгБЪгАБгВєгГЪгГГгВѓгБЃгВҐгГГгГЧгВ∞гГђгГЉгГЙгБЂзХЩгБЊгВЛеПѓиГљжАІгБМйЂШгБДгБ®гБХгВМгБ¶гБДгБЊгБЩгАВгБУгБЃжИ¶зХ•гБЂгВИгВКгАБAppleгБѓжЙЛй†ГгБ™дЊ°ж†ЉгБ®гГСгГХгВ©гГЉгГЮгГ≥гВєгБЃгГРгГ©гГ≥гВєгВТзґ≠жМБгБЧгБ§гБ§гАБAIжКАи°УгБЃе∞ОеЕ•гВТвА¶,0,0,2026-03-24
at://did:plc:ek2liivggd2tbwpq26gwunmz/app.bsky.feed.post/3mhsknagj3s2c,2026-03-24 12:18:33.428000+00:00,Apple sucks,0,1,2026-03-24
at://did:plc:extqxtsoc4q4qnbmwizooppn/app.bsky.feed.post/3mht37svq3i2g,2026-03-24 17:14:12+00:00,#NowPlaying рЯХУ 4:14 am рЯОµ Heavy in the Morning рЯІСвАНрЯО§ Old Mervs рЯМ± Triple J Unearthed рЯОІ Apple Music / YouTube Music рЯУЭ Lyrics,0,0,2026-03-24
at://did:plc:zdk6d5te36lyhqej7t4p6tlv/app.bsky.feed.post/3mhtkb567yv2i,2026-03-24 21:44:27.089000+00:00,Sam and Bambam 2 best friends who decided to spend the rest of their days inside fruit,0,1,2026-03-24
at://did:plc:zvqazsaifl3ywla5dh5tpowv/app.bsky.feed.post/3mhtogmih2k23,2026-03-24 22:59:05.899000+00:00,"the apple keyboards are simply second to none imo, and look, you get one with the Neo! Love my Indigo Blue Neo and it's become my 'mobile mac mini dev env'",0,7,2026-03-24
at://did:plc:extqxtsoc4q4qnbmwizooppn/app.bsky.feed.post/3mhtowxtfgl2g,2026-03-24 23:07:19+00:00,#NowPlaying рЯХЩ 10:07 am рЯОµ Some Kinda Heaven рЯІСвАНрЯО§ Memphis LK рЯМ± Triple J Unearthed рЯОІ Apple Music / YouTube Music рЯУЭ Lyrics,0,0,2026-03-24
at://did:plc:yrotzb4w3vc2xfuwb6lynqx4/app.bsky.feed.post/3mht4optfcc2m,2026-03-24 17:41:30.485000+00:00,"March is '80s Flashback Month for Tread Perilously! Stay tuned for V's ""War of Illusions"" this Thursday on Apple Podcasts, Patreon, & @fanbasepress.bsky.social Co-Hosts: @eriksamaya.bsky.social & @weirdnoirmaster.bsky.social",3,3,2026-03-24
at://did:plc:dn2snh4wz53f2vai7ijf6q36/app.bsky.feed.post/3mhtl7apmixj2,2026-03-24 22:01:14+00:00,"Apple releases new updates for old versions of iOS, macOS, watchOS, more https://www.macken.xyz/2026/03/apple-releases-new-updates-for-old-versions-of-ios-macos-watchos-more/?utm_source=dlvr.it&utm_medium=mastodon",0,0,2026-03-24
at://did:plc:3f4nho7sqokzf4jkhrltn7kz/app.bsky.feed.post/3mhtmayupxc2q,2026-03-24 22:20:10.070000+00:00,Just pulled a pack fresh raccoon apple. Shaking. This SOB is gonna be worth a million once i get it graded,0,3,2026-03-24
at://did:plc:hvt457sszdxnvaehhfvd5ef2/app.bsky.feed.post/3mhtmyufeok23,2026-03-24 22:33:30.682000+00:00,Also s/o to the person I saw on tumblr who said вАЬwelcome back apple tree yardвАЭ which is the absolute funniest response I think anyone could have to this,0,0,2026-03-24
at://did:plc:34w6p2nygxpqkiqbkrnq56ip/app.bsky.feed.post/3mhtn7ky7xk27,2026-03-24 22:36:58+00:00,#NowPlaying рЯХ§ 9:36 am рЯОµ Devil Woman рЯІСвАНрЯО§ Steph Strings рЯТњ Feel Alive рЯМ± Triple J Unearthed рЯОІ Apple Music / YouTube Music рЯУЭ Lyrics,0,0,2026-03-24
at://did:plc:wd7bdxw36copeanukirmspct/app.bsky.feed.post/3mhsxmfolq22l,2026-03-24 16:10:44.024000+00:00,"There are no victories, every competition at Apple Hill ends in a mandatory 7-7 tie. (Except ping pong, which is bloodsport for some reason.)",0,2,2026-03-24
at://did:plc:ly454vqckjqn2crmmqzmjeva/app.bsky.feed.post/3mht4yernnk2e,2026-03-24 17:46:54.432000+00:00,YOU KNOW THAT YOU MY MOTHERFUCKIN CINNAMON APPLE!!,0,2,2026-03-24
at://did:plc:ie7zvjygghrsg5nwbqiphocx/app.bsky.feed.post/3mhtfis2nqk2t,2026-03-24 20:19:15.168000+00:00,"Epic executives are likely hoping they can deemphasize in-house dev because user-created content can be very successful and make money for the company without them having to hire lots of designers. Ironically, that's the same profit structure they spent years fighting Apple/Google over.",0,0,2026-03-24
at://did:plc:vtyzvaimvyvy72cmfog73nkd/app.bsky.feed.post/3mhtq75xdn224,2026-03-24 23:30:43.260000+00:00,I need one of those criss cross apple sauce office chairs,0,5,2026-03-24
at://did:plc:34w6p2nygxpqkiqbkrnq56ip/app.bsky.feed.post/3mhtccumjwu27,2026-03-24 19:21:37+00:00,#NowPlaying рЯХХ 6:21 am рЯОµ Claws рЯІСвАНрЯО§ Meg Washington рЯОІ Apple Music / YouTube Music рЯУЭ Lyrics,0,0,2026-03-24
at://did:plc:2qncbiwrirqwv2dfiheedrrq/app.bsky.feed.post/3mhtdug3qc22k,2026-03-24 19:49:57.793000+00:00,Yet another Reform UK Party Ltd вАЬbad appleвАЭ.,0,2,2026-03-24
at://did:plc:43fdk46qa5gsokzygzildsaq/app.bsky.feed.post/3mhtdygjpt62l,2026-03-24 19:52:12.084555+00:00,"APPLE INC. IS PREPARING A MAJOR AI OVERHAUL CENTERED ON SIRI, INCLUDING A STANDALONE APP AND A NEW SYSTEMWIDE вАЬASK SIRIвАЭ FEATURE AIMED AT MAKING IT MORE CONVERSATIONAL AND CAPABLE ACROSS DEVICES.",1,2,2026-03-24
