ID_Tweet,Fecha_UTC,Contenido_Texto,Retweets,Favoritos
at://did:plc:qopaytvzhyej4kqs73e4rxyf/app.bsky.feed.post/3mcyp7spoc22w,2026-01-22T07:50:31.841Z,Η Apple θα μετατρέψει τη Siri σε πλήρες AI chatbot από το φθινόπωρο του 2026 #CEMedia #Apple #press open.substack.com/pub/contente...,0,0
at://did:plc:dn2snh4wz53f2vai7ijf6q36/app.bsky.feed.post/3mcypzksbo2h2,2026-01-22T08:04:48.000Z,Siri blir chatbot: Apple utmanar ChatGPT i nästa stora uppdatering https://www.macken.xyz/2026/01/siri-blir-chatbot-apple-utmanar-chatgpt-i-nasta-stora-uppdatering/?utm_source=dlvr.it&utm_medium=mastodon,0,0
at://did:plc:fsftz5ue2bvlvkb6zx2bqdnh/app.bsky.feed.post/3mczft3xnhk2x,2026-01-22T14:35:01.295111+00:00,"The home hub device that Apple plans to release as soon as this spring has a ""robotic swiveling base,"" according to The Information's Wayne Ma. Ma mentioned the new detail in a piece outlining Apple's work on an AI pin. Apple is also working on a home product featuring a small display, spe..",0,1
at://did:plc:34w6p2nygxpqkiqbkrnq56ip/app.bsky.feed.post/3mcy5ewge2u2l,2026-01-22T02:30:43.000Z,#NowPlaying 🕜 1:30 pm 🎵 Land Of The Bloody Unknown 🧑‍🎤 The Middle East 💿 I Want That You Are Always Happy 🎧 Apple Music / Spotify / YouTube Music 📝 Lyrics,0,0
at://did:plc:paqzd3clacqrdn66uuy25ps5/app.bsky.feed.post/3mcyecv2sec26,2026-01-22T04:35:23.765Z,"I love apple, she was living in my town for a long while!",5,23
at://did:plc:traxg4jscmm3n3usqi76dsk2/app.bsky.feed.post/3mcyksp7ina2v,2026-01-22T06:31:36.977398+00:00,"Kang, Choi, Lee, Jang, Choi, Kang, Park, Kim, Kim: APPLE: Attribute-Preserving Pseudo-Labeling for Diffusion-Based Face Swapping https://arxiv.org/abs/2601.15288 https://arxiv.org/pdf/2601.15288 https://arxiv.org/html/2601.15288",0,0
at://did:plc:xog6m4iosw4zhlm3iidhv4f4/app.bsky.feed.post/3mcyohee4ls2e,2026-01-22T07:36:51.288Z,"It was called a Winesap, I think? REALLY good flavor and a nice crisp texture; it has the good tart flavor you get from some crisp apples, but its sweetness almost has a pear-like finish! #food",0,3
at://did:plc:pcievrygrnjjg5ni7mjfgctb/app.bsky.feed.post/3mcyr67e5uc2m,2026-01-22T08:25:25.13Z,RansomHub claims alleged breach of Apple partner Luxshare Chinese electronic manufacturer and Apple partner Luxshare Precision Industry has allegedly been breached by affiliates of the RansomHub ransomware-as-a-service outfit. Luxshare is one of the primary assemblers of Ap… #apple #nvidia #samsung,0,1
at://did:plc:wrsf35zye5xmlfaje5zyyega/app.bsky.feed.post/3mczgo6zn6k2p,2026-01-22T14:50:09+00:00,"I think I know what the Apple pin is, and definitely know what it isn’t https://www.europesays.com/us/534771/ Yesterday brought a surprising report about the development of an Apple pin, which The Information likened to the…#us #news #usnews",0,0
at://did:plc:twerjlabpqmvieyx3roydios/app.bsky.feed.post/3mczgxsoytmi2,2026-01-22T14:55:31.000Z,"@miek I dropped Asahi on my 3rd-off-the-production line OG M1 Mini and it has been amazing. Noticeably faster than macOS. Everything ""just worked”. Rly wish Apple wld stop trying to prevent folks from doing this.",1,0
at://did:plc:6y47ewdtafyri5vh5vb3yapd/app.bsky.feed.post/3mczjclywik23,2026-01-22T15:37:22.747Z,"Recently I have been trying to generate diverse/ more realistic body types. Used words like "" apple shape body"" "" heavier in the middle"" “small breasts"" • Sadly not successful in what I intended. I did get in my opinion some Artistically Beautiful Images. Sharing. Comments? #aiart",0,13
at://did:plc:wfc2f24np5dlonfhxo77lit7/app.bsky.feed.post/3md23bch5wc2f,2026-01-22T20:58:46.523Z,Mocha with a stem ginger biscuit . Apple crumble and custard .,0,0
at://did:plc:iw74whybivvcojjmsc7hg2bu/app.bsky.feed.post/3md24toajj223,2026-01-22T21:26:56.614Z,Too late Apple already made the smart pin it’s called “Omnipod”. youtu.be/wOvbfPi7VbM?...,0,0
at://did:plc:6y47ewdtafyri5vh5vb3yapd/app.bsky.feed.post/3mczjmwubg223,2026-01-22T15:43:09.673Z,"Recently I have been trying to generate diverse/ more realistic body types. Used words like "" apple shape body"" ""heavier in the middle"" ""small breasts"" • Sadly not successful in what I intended. I did get in my opinion some Artistically Beautiful Images. Sharing. Comments? #aiart",0,10
at://did:plc:gmsqbvvpcly67l2pgo5gffxo/app.bsky.feed.post/3md2aijzsgk23,2026-01-22T22:32:18.073Z,no apple i didnt mean he'll,0,0
at://did:plc:np7bwf3iglbtc5mkfm6tikdl/app.bsky.feed.post/3md26nuv46s2s,2026-01-22T21:59:29.741Z,"Every few months, apple decides to swap the delete and save buttons on the screenshot feature just to piss me off specifically",0,15
at://did:plc:zgmquhzyd6p76xwysheifhau/app.bsky.feed.post/3md2exmdznk2f,2026-01-22T23:52:18.791Z,Tops Danish charts where? On the Apple App Store and Google Play Store? Even the app to boycott US products is trending on a US product…,1,2
at://did:plc:x6yftinv2ewvbzmg27fpaqxw/app.bsky.feed.post/3md2f5zu5722z,2026-01-22T23:55:54.275Z,"Even if all of those obvious issues did not exist, the Academy was never going to give Best Picture to a movie like this. That nom was a gift for Apple",0,1
at://did:plc:kh7b7mc3in4jhbcl55jejjqw/app.bsky.feed.post/3mczyfsimdk27,2026-01-22T20:07:36.347Z,So… bored… Send me questions and praise or something ngl.link/appledectomy... 🖼️ nekkidzilla.bsky.social,4,15
at://did:plc:dvfuqjzghczvhts6eobjvl2i/app.bsky.feed.post/3md2edofwoc24,2026-01-22T23:41:09.854Z,"I know, Apple Health, stop bullying me! 😭",0,2
at://did:plc:n4v3w2lmcptvczaspsyanfhy/app.bsky.feed.post/3mcyefcw7x22u,2026-01-22T04:36:40.482Z,"another technique i like is starting with a simpler algorithm, then adding detours in the middle of connectors. this is an algorithm based on beneath apple manor. it uses connections with an L shape, also known as ""dogleg"" connections. what i doing here is take that shape, then insert a detour.",0,12
at://did:plc:5m5lxhkf3v2bndtbcqsgn5ig/app.bsky.feed.post/3mczqksnc6c2d,2026-01-22T17:47:14.342Z,"A bit weird to advertise it as working ""on any device"" when it's exclusive to the Apple ecosystem.",0,0
at://did:plc:e6douttata3mqtzcbxx55nck/app.bsky.feed.post/3mcztnnsla22t,2026-01-22T18:42:31.160Z,Big apple ain't gonna know what hit em!! 😉😎,0,0
at://did:plc:nlowgotrtcgpzcuepm63cw2c/app.bsky.feed.post/3md2fbhnwm22e,2026-01-22T23:57:49.416Z,Great to see this but instead of explaining how they get these numbers I’d like to hear about WHY Apple thinks it’s a good thing. It’s silly to be releasing raw model info and not — at the very least — explaining it’s just a model and not a forecast. bsky.app/profile/bart...,0,2
at://did:plc:w2yenz43ofkk752xk3s6i55y/app.bsky.feed.post/3mczsmtqass2u,2026-01-22T18:24:10.080Z,"^phone‘s charging is being manipulated using spyware agents by state sponsored harassers state sponsored terror unit, which either depletes without cause, charges slow or get stuck at particular percentage @ Apple",0,0
at://did:plc:njei7pnsgxjxotyw3annqhfj/app.bsky.feed.post/3mczsov6occ2j,2026-01-22T18:25:18.708Z,"The shareholder voting results at Intuit today continues a trend, handing defeat after defeat to anti-DEI shareholder activists. Last year, shareholders of 31 of 31 corps, including Costco, Apple, Goldman Sachs, collectively valued at > $13 trillion, voted to reject anti-DEI proposals, most by 99%",2,6
at://did:plc:oirkussip6uq5aqh4ojw5gvy/app.bsky.feed.post/3md26xagipgv2,2026-01-22T22:04:41.000Z,"@the_blackwell_ninja I’ll believe this rumor when I see it, I just don’t think it would make sense for Apple (or really anyone) to make a product like this.",0,0
at://did:plc:26szsl4s2ltrijm67jxp65pl/app.bsky.feed.post/3mczmlnudj22x,2026-01-22T16:36:07.915Z,welcome to pledge my apple tv account to the cause,0,2
at://did:plc:lfge6toxaqfv4iwq7exbjapo/app.bsky.feed.post/3md25ddsf7k27,2026-01-22T21:35:42.543Z,Haven't owned and apple in well over a decade. Overpriced junk.,0,0
at://did:plc:p3vjcqevx6sajc3rchsim2dr/app.bsky.feed.post/3md22ehr5vc2w,2026-01-22T20:42:39.025Z,"Apple Iphone tracking tools can show this precise time.. Trumps speech, last sentence, moments before they storm the capital — bird’s eye view of phones moving towards the capital, from the Ellipse.",0,0
at://did:plc:pry6ccmp7uatwcgmc5t74n66/app.bsky.feed.post/3mczxvijw6b24,2026-01-22T12:58:28-07:00,[04:58] J1 HITS - Now Playing: Mrs Green Apple - Bitter Vacation (ビターバカンス) - (71 listeners) listen at j1fm.tokyo,0,0
at://did:plc:zkdjneg7kggym7ujme65drbh/app.bsky.feed.post/3md27nw7oo22p,2026-01-22T22:17:24.881Z,"Tim Apple has generally been an extremely effective CEO, but he's an operations guy: his insight into the fussy fuzzy stuff like UI quality is only as good as the team he's got reporting to him, and unfortunately that team was slowly rotting from the head down.",0,4
at://did:plc:uxr5fx2qvoo3hxywgxbo37ti/app.bsky.feed.post/3mcy52g42bc2o,2026-01-22T02:25:23.489Z,More - THE MIDDLE OF NOWHERE is now also on: Google Play (play.google.com/store/books/...) (with a free sample that is probably being used to train the machines as we speak: books.google.ca/books?id=NRS...) Apple Books (books.apple.com/us/book/the-...) Everand (everand.com/book/9821387...),3,1
at://did:plc:hjnftvy2bqhs7ffh7nwii737/app.bsky.feed.post/3mcznearkdk2h,2026-01-22T16:49:53.052Z,"iPhone 17 Pro prices have dropped in Russia to 94 thousand. At the beginning of January, the smartphone was sold for 117 thousand. Apple is a proud sponsor of war, using documented parallel supply chains to boost their profits.",7,29
at://did:plc:extqxtsoc4q4qnbmwizooppn/app.bsky.feed.post/3mczokhjshv2m,2026-01-22T17:09:19.000Z,#NowPlaying 🕓 4:09 am 🎵 Catching Up 2 U 🧑‍🎤 MAY-A 💿 Goodbye (If You Call That Gone) 🌱 Triple J Unearthed 🎧 Apple Music / Spotify / YouTube Music 📝 Lyrics,0,0
at://did:plc:plqvpe55pgzpqnyed2hcq3y4/app.bsky.feed.post/3md26pe6jus24,2026-01-22T22:00:10.153Z,"Finish things off with beignet bites or a warm apple crisp with vanilla ice cream. For full menu details and Restaurant Week info, hit the Linktree in our bio. 3/3",0,1
at://did:plc:34w6p2nygxpqkiqbkrnq56ip/app.bsky.feed.post/3mcy57kw25a2z,2026-01-22T02:26:18.000Z,#NowPlaying 🕐 1:26 pm 🎵 I WANT YOU 🧑‍🎤 Close Counters 🌱 Triple J Unearthed 🎧 Apple Music / YouTube Music 📝 Lyrics,0,0
at://did:plc:bicrg6hwa3yxij55t6ygvtq3/app.bsky.feed.post/3mcy63iq4h22k,2026-01-22T02:43:53.541Z,"Primary Assets: The Pelosis' wealth is largely held in publicly traded stocks (including Apple, Nvidia, Microsoft, Google, and Amazon), their investment firm Financial Leasing Services Inc., and an estimated $45 million in commercial and residential real estate.",0,0
at://did:plc:pnrhmlt37owewlstkjruilkc/app.bsky.feed.post/3mcyf4mo2jk2i,2026-01-22T04:49:47.415Z,"Star Trek has always put effort into their sets and never had a distraction with lenseflare. It honestly annoyed me. Each ship had a set and to have this huge ship with the bridge of the Apple Store...I just didn't like it. I loved the cast, but yes if the writing is bad...doesn't work.",0,1
at://did:plc:ovfbhwoyhnkmogglv5p5ibdd/app.bsky.feed.post/3mczh3mgom223,2026-01-22T14:57:40.829Z,I'm alright Nobody worry 'bout me Why you got to gimme a fight? Can't you just let it be?,0,1
at://did:plc:mnut7bswvnl54dhflb4qofss/app.bsky.feed.post/3mczh7qb2v22l,2026-01-22T14:59:59.068Z,If you're enjoying Ponies (on Peacock) and the music that's being used … I created a lil Apple Music playlist for y'all music.apple.com/gb/playlist/...,0,0
at://did:plc:h3v76uve6amgzfvqc4kixk4j/app.bsky.feed.post/3mczhaua3vt2e,2026-01-22T15:00:00.000Z,"It’s New 1/22: @themarketinganu.bsky.social dives more into ChatGPT ads pricing, @gregfinn.bsky.social on Apple release schedule for Gemini powered Siri and @mordyoberstein.bsky.social chomps down on Google recipes & there is a new Googlebot for messages www.youtube.com/watch?v=InnE...",1,1
at://did:plc:o7iq3k6tfloupg74fbafdpuo/app.bsky.feed.post/3mczhbzckni2o,2026-01-22T15:01:15.570376+00:00,Apple Revamps Siri: A 40% Smarter AI Chatbot to Rival ChatGPT #AI #ArtificialIntelligence #News https://freecking.com/article/7014,0,0
at://did:plc:l63q2vsfnlq6tavvqmu5znf7/app.bsky.feed.post/3mcytsoiz7c2f,2026-01-22T09:12:39.902Z,It was good. The potatoes were awesome. Plate was wiped. Now I'm in a crackling food coma #cooking,0,6
at://did:plc:qzxagf3cmka4ff4tux4c4ifo/app.bsky.feed.post/3mczcdg5mok2h,2026-01-22T13:32:33.978Z,This is just lovely. Brings a rosy apple glow to one's heart,0,3
at://did:plc:2ldddqzgrab5by6r255zwszf/app.bsky.feed.post/3mczfi523b5m2,2026-01-22T14:28:51.000Z,Intrigued. Apparently you can build your own Google Wallet/Apple Wallet cards to update subscribers to stuff. I'm very intrigued. I wonder if I can vibe code a solution that does this. Or if there is an open source self hosted tool that can do this for me. I know a person who is building out a […],0,0
at://did:plc:3p7m65ikus2al6tiizhbmwqq/app.bsky.feed.post/3mcympdujr22h,2026-01-22T07:05:31.910Z,Changes (2022) Am I too see in the thread for people to see these now? Does nobody care anymore? The description on Apple Music called this album a “shiny pop re-invention” but I don’t really see it. Sounds like other stuff in their catalog. They added a squeeze to the bass. I guess that’s poppy?,0,5
at://did:plc:jf26a7dgps3fck4zc7anchdl/app.bsky.feed.post/3mcz2jrgc6p2j,2026-01-22T11:12:57.107181+00:00,記事の要約: 新しいSiriのチャットボットは、2026年秋に登場するiOS 27に搭載される予定で、Googleの生成AI「Gemini」を使用することが明らかになりました。このため、新しいSiriはAppleのサーバーではなく、Googleのクラウドインフラストラクチャー上で実行される可能性があります。Appleはプライバシー保護のために自社のPrivate Cloud Computeを推奨していますが、Geminiを動作させるにはより高性能なサーバーが必要であり、実用性を重視する新しいSiriの責任者たちは、競争に遅れを取らないためにGoogleとの契約を選択したとされています。App…,0,0
at://did:plc:4ejidfk4toda3bwrqlj65c6d/app.bsky.feed.post/3mcy73mkhns2x,2026-01-22T03:01:51.291Z,giggling that apple tags the photos of my injection site w/blood streaking down my leg under ‘art’ when i was looking for an actual art piece i had on my phone. its learning ☺️,1,16
at://did:plc:wfm4v2cmxhw7kdfypqchbrs6/app.bsky.feed.post/3mczd6vzdpdm2,2026-01-22T13:47:47.000Z,**Silent Pictures** * YouTube * Spotify * Apple Music * Amazon Music * YouTube Music * SoundCloud * iTunes * Invidious,0,0
at://did:plc:nxh242mri5pnhmzmc3snexqw/app.bsky.feed.post/3mczb7klfe22t,2026-01-22T13:12:30.660Z,"Epstein foi Morto na prisão. Disso, poucos duvidam. Lembrem-se: as câmeras deram “defeito”🤔 e ele apareceu enforcado Trump era presidente,à época. Tinha grupo de meninas brasileiras q Epstein também abusou.segundo arquivos Onde assistir: Netflix, Apple TV, Prime Video e Investigation Discovery.",7,6
at://did:plc:fzvwugwhxkw5p3kuumuk2lxg/app.bsky.feed.post/3mcyxdpzfac23,2026-01-22T10:15:53.165Z,"Okay, I like roquefort on other things. But mixing with sweet backfired. Specifically, mixing it with apple slices. Guinness cheddar on the other hand, does quite nicely.",0,2
at://did:plc:34w6p2nygxpqkiqbkrnq56ip/app.bsky.feed.post/3mcyyjxm7nu2z,2026-01-22T10:36:03.000Z,#NowPlaying 🕤 9:36 pm 🎵 Bad Love 🧑‍🎤 RY X 🎧 Apple Music / YouTube Music 📝 Lyrics,0,0
at://did:plc:klhtmrnregub7we7h6jwiljm/app.bsky.feed.post/3mczdb57w5c2r,2026-01-22T13:49:11.250Z,"wow, that’s sad. some of these people think it means “AI wrote this” and real ball knowers know it means “I have an Apple product”",0,7
at://did:plc:3s52uzpjh236okih4cogzcov/app.bsky.feed.post/3mcyi4jiquh22,2026-01-22T05:43:25.315Z,Click here to send a message to the CEOs of Apple and Google demanding they terminate all contracts with ICE and Customs and Border Protection (CBP) and return our right to document and share information about illegal law enforcement activity. SIGN AND SEND click.actionnetwork.org/ss/c/u001.qU...,0,0
at://did:plc:tdjreuyd5turcwxfyx5qgp6n/app.bsky.feed.post/3mcz7rr564k24,2026-01-22T12:46:53.976Z,Another #konbini katastrophe #DiningWithDarryl,0,2
at://did:plc:34w6p2nygxpqkiqbkrnq56ip/app.bsky.feed.post/3mczbzvmt3w2e,2026-01-22T13:26:28.000Z,#NowPlaying 🕛 12:26 am 🎵 Soft Touch 🧑‍🎤 screensaver 💿 Three Lens Approach 🎧 Apple Music / Spotify / YouTube Music 📝 Lyrics,0,0
at://did:plc:xog6m4iosw4zhlm3iidhv4f4/app.bsky.feed.post/3mcy6r25r422k,2026-01-22T02:55:56.450Z,I bought 3 different kinds of fancy apples today and the only thing getting me thru the next 4 hours is My OCs (as usual) and Wondering Which Apple Will Be First when I go home for an after work snack,0,4
at://did:plc:wjljc54nads6ix5tlp4swebe/app.bsky.feed.post/3mcypqtbidq2y,2026-01-22T08:00:02.770613+00:00,"teckel Web3 API hourly update Eth price (USD): 2998.37 (-0.6% 1 hr, +1.1% 24 hr) Click for API details API keys via App: Apple App Store Google Play Store #teckel #eth",0,0
at://did:plc:extqxtsoc4q4qnbmwizooppn/app.bsky.feed.post/3mcz5a5adkv24,2026-01-22T12:00:05.000Z,#NowPlaying 🕚 11:00 pm 🎵 Afterthought 🧑‍🎤 Tame Impala 💿 Deadbeat 🎧 Apple Music / Spotify / YouTube Music,0,0
at://did:plc:34w6p2nygxpqkiqbkrnq56ip/app.bsky.feed.post/3mcz5q7lgym2w,2026-01-22T12:09:37.000Z,#NowPlaying 🕚 11:09 pm 🎵 Talk To Me 🧑‍🎤 Robyn 💿 Sexistential 🎧 Apple Music / Spotify / YouTube Music 📝 Lyrics,0,0
at://did:plc:yjvzv3dy4a26osmijrbm6yup/app.bsky.feed.post/3mcz5dbsfps2g,2026-01-22T12:03:00.708Z,"A habit I started 3 years ago is to sit down every 6 months and take a look at what apps/sites you don't use, and delete them (delete the whole account!) Also, that is a good time to search for alternates to Google/MS/Apple etc. It is very easy to switch in most cases. Do it!",0,1
at://did:plc:3wgb4jg7wvccgw2degwd2ym7/app.bsky.feed.post/3mczgct3vnk2d,2026-01-22T14:43:48.967Z,I'm sure it is! It was on Apple TV I think and even then I couldn't be bothered haha.,0,0
at://did:plc:fdnijx42jxzzxpfngm7nvk7k/app.bsky.feed.post/3mczh22hhsc23,2026-01-22T14:56:48.438Z,Was also surprised then I remembered CODA won best picture. Apple has weird carry,0,0
at://did:plc:35pczu2xumjm7ruw3elv64a7/app.bsky.feed.post/3mcxxdt62cc23,2026-01-22T00:43:16.716Z,"""I once saw a dog knock over a whole jug of apple tango with his erection... I've not genuinely enjoyed a picnic since""",0,15
at://did:plc:dn2snh4wz53f2vai7ijf6q36/app.bsky.feed.post/3mcze6zo5xfy2,2026-01-22T14:04:52.000Z,Apple utvecklar bärbar AI-hårdvara https://www.macken.xyz/2026/01/apple-utvecklar-barbar-ai-hardvara/?utm_source=dlvr.it&utm_medium=mastodon,0,0
at://did:plc:mhqnbglrgmwiuz3kgexbi7uf/app.bsky.feed.post/3mczf47gtls2x,2026-01-22T14:22:13.173266+00:00,#Congress #Democrats #New York #Big Apple 🗽,0,0
at://did:plc:bqtklxgao65o3zzlcjufmgb4/app.bsky.feed.post/3mcyubro7gj2h,2026-01-22T09:21:06.521944+00:00,Alloyed suitors drawn inside an apple or a grape To put forth a cloud of mercury he was run over by a car on a freeway in Los Angeles once the spraying has been done,0,0
at://did:plc:okzlndi46q2u75es376ekyb2/app.bsky.feed.post/3mcyuhidguk2d,2026-01-22T09:24:18.047Z,Letting Apple AI (relax it's just a fucking random image selector) control my device wallpapers is revealing to me the number of places I have no recognition of nor recollection of visiting.,0,2
at://did:plc:25tvphnea54rbcz63j5vhufs/app.bsky.feed.post/3mcyy4layi22p,2026-01-22T10:29:47.032Z,apple looks incredibly yummy,0,1
at://did:plc:qadlgs4xioohnhi2jg54mqds/app.bsky.feed.post/3mcxv7kn3cs2v,2026-01-22T00:05:06.080Z,"Apple cloning Humane, OAI cloning Apple :D",0,0
at://did:plc:v5w75o6fy5k4g7mp47wabsvv/app.bsky.feed.post/3mcxybg67p22o,2026-01-22T00:59:49.662Z,"For those of you wondering what the Hot Wheels and Matchbox situation is like in New York. Normally those pegs are all filled. Nada. Empty shelves, too, in the Big Apple. #HotWheels #Matchbox #Diecast #Toys",0,2
at://did:plc:hua65sacu6j7dk2xr7aehyfs/app.bsky.feed.post/3mcyaepw6a223,2026-01-22T03:24:50.546Z,My grandma always said that it only takes one bad apple to ruin the barrel so ya,0,1
at://did:plc:2pf322m5funoty5awpbjdxry/app.bsky.feed.post/3mcxx5mso3k2q,2026-01-22T00:39:48.735Z,Hey Apple. Maybe reverse this liquid glass shit and make it an option to turn on or off. Not the “new look” for the new update you forced onto my phone. This shit is so ugly.,0,0
at://did:plc:mrtxfddpkyggrh53ovk2p7p7/app.bsky.feed.post/3mcxz6ji3u22p,2026-01-22T01:16:06.269Z,"🥇Award for Going Bonkers: I remember a show from the early '90s, The Open Mind.Naomi Wolf spoke about her new book, 'The Beauty Myth'. Interesting. Thoughtful. I reasoned she'd have a bright future as a cultural critic. Hoo boy I was wrong! Antivax, conspiracy loon, a trajectory no one could see. 🤡",0,1
at://did:plc:gnvkxg5c63er4q2dwbmk27yi/app.bsky.feed.post/3mcxzehxbhz2z,2026-01-22T01:19:25.929007+00:00,Apple prepara una revolución para Siri con IA avanzada,0,0
at://did:plc:34w6p2nygxpqkiqbkrnq56ip/app.bsky.feed.post/3mcy2g5j3322e,2026-01-22T01:36:52.000Z,#NowPlaying 🕜 12:36 pm 🎵 A Telephone Rings 🧑‍🎤 Good Morning 💿 The Accident 🎧 Apple Music / YouTube Music 📝 Lyrics,0,1
at://did:plc:g7oi6woxbqdxxzbnhaqx4mcu/app.bsky.feed.post/3mczrpzk5l22t,2026-01-22T18:08:03.092Z,"What bright spark at Apple decided accessibility doesn't matter anymore? ""Let's make the screens harder to read! They'll love it!""",0,5
at://did:plc:67fsitos53aw4bicoidjeayj/app.bsky.feed.post/3md24jiwej223,2026-01-22T21:21:15.496Z,OH THE APPLE SNICKERS SALAD FUCKS SO HARD,0,2
at://did:plc:7ftlbjmmawm6mxn4hh2zee3f/app.bsky.feed.post/3mczjtjrwoc2q,2026-01-22T15:46:50.853Z,There's anger and frustration aplenty - but loads of great insight too as #wba supporters offload to @goldbergradio.bsky.social in the aftermath of THAT defeat. Listen back now. (Also on Apple). open.spotify.com/episode/7LzJ...,1,0
at://did:plc:ylw7sc4aqy63hqrdjfkqnjeq/app.bsky.feed.post/3mczolrjm2r52,2026-01-22T17:11:07.000Z,"There will be a security-focused developer event on March 5 at Apple Park: featuring sessions on Memory Integrity Enforcement, new tools in Enhanced Security in Xcode, Apple’s defensive security engineering approach, Swift adoption in security-sensitive code, and how to apply all these […]",2,0
at://did:plc:p7oa53h3ubyeth663q6lpvqj/app.bsky.feed.post/3mcyfa2ds2c2x,2026-01-22T04:51:42.422Z,Five concerts you've seen with women lead singers: Sara Bareilles Michelle Branch Garbage Patti Smith Fiona Apple,0,6
at://did:plc:x3vaqxzpv4zgpjqtskkowgtl/app.bsky.feed.post/3mczwblc4q22k,2026-01-22T19:29:27.093Z,"Gotta love how small this lectern makes him look. I know he’s only 4’9” but he looks like Steve Lockjaw’s mini-me, standing on 3 apple crates.",0,0
at://did:plc:k6hyax7boihu4sc3hxdf2yu6/app.bsky.feed.post/3mczwacodxc2g,2026-01-22T19:28:44.484Z,I still have some Sketch Card rewards left on the Evie and the Helsings @kickstarter.com! www.EvieAndTheHelsings.com Here are some of my sketch cards from previous Kickstarters: Jackson Lamb from Slow Horses (Shaken and Stirred Kickstarter) Shape of Water’s creature (Undead or Alive Kickstarter ),3,9
at://did:plc:b543kjwuyc2bdz4b2gtjbbji/app.bsky.feed.post/3mczxlm3wr22x,2026-01-22T19:52:57.228Z,Phil Foden has no goal contributions in his last 9 appearances. The silliness of the fact didn’t get past the Show Bros! New episode out now YT: www.youtube.com/@shadesofblu... Apple: podcasts.apple.com/us/podcast/s... Spotify: open.spotify.com/show/0AS1S9t...,1,2
at://did:plc:o56qmbc5xf5gnrlhm3ozhgpk/app.bsky.feed.post/3mczxlxfruc2r,2026-01-22T19:53:09.079Z,"I've been meaning to figure out how to get some legislation on this topic passed, but haven't managed to do so yet (screenshot via Discord)",0,1
at://did:plc:g7oi6woxbqdxxzbnhaqx4mcu/app.bsky.feed.post/3mczrpzk5l22t,2026-01-22T18:08:03.092Z,"What bright spark at Apple decided accessibility doesn't matter anymore? ""Let's make the screens harder to read! They'll love it!""",0,5
at://did:plc:gnvkxg5c63er4q2dwbmk27yi/app.bsky.feed.post/3mcxzehxbhz2z,2026-01-22T01:19:25.929007+00:00,Apple prepara una revolución para Siri con IA avanzada,0,0
at://did:plc:bqtklxgao65o3zzlcjufmgb4/app.bsky.feed.post/3mcyubro7gj2h,2026-01-22T09:21:06.521944+00:00,Alloyed suitors drawn inside an apple or a grape To put forth a cloud of mercury he was run over by a car on a freeway in Los Angeles once the spraying has been done,0,0
at://did:plc:okzlndi46q2u75es376ekyb2/app.bsky.feed.post/3mcyuhidguk2d,2026-01-22T09:24:18.047Z,Letting Apple AI (relax it's just a fucking random image selector) control my device wallpapers is revealing to me the number of places I have no recognition of nor recollection of visiting.,0,2
at://did:plc:3wgb4jg7wvccgw2degwd2ym7/app.bsky.feed.post/3mczgct3vnk2d,2026-01-22T14:43:48.967Z,I'm sure it is! It was on Apple TV I think and even then I couldn't be bothered haha.,0,0
at://did:plc:fdnijx42jxzzxpfngm7nvk7k/app.bsky.feed.post/3mczh22hhsc23,2026-01-22T14:56:48.438Z,Was also surprised then I remembered CODA won best picture. Apple has weird carry,0,0
at://did:plc:qadlgs4xioohnhi2jg54mqds/app.bsky.feed.post/3mcxv7kn3cs2v,2026-01-22T00:05:06.080Z,"Apple cloning Humane, OAI cloning Apple :D",0,0
at://did:plc:2pf322m5funoty5awpbjdxry/app.bsky.feed.post/3mcxx5mso3k2q,2026-01-22T00:39:48.735Z,Hey Apple. Maybe reverse this liquid glass shit and make it an option to turn on or off. Not the “new look” for the new update you forced onto my phone. This shit is so ugly.,0,0
at://did:plc:n7jvwrvgw4spz5vlpvtb4uxl/app.bsky.feed.post/3mcy5qpusks2c,2026-01-22T02:37:51.928Z,LUPIN?! Is that you?,0,0
