ID_Tweet,Fecha_UTC,Contenido_Texto,Retweets,Favoritos
at://did:plc:4wsvlvxv4ag2hgyznuelhmfs/app.bsky.feed.post/3mcxwjepcr432,2026-01-22T00:28:26.000Z,"We got some Windows tablet w/ a stylus for testing purposes while I was at Apple. ""You have to get them and put them away and you lose them. yuck"". The latter is precisely what happened to that Windows tablet, the stylus got lost at some meeting and was gone forever.",0,0
at://did:plc:7p5tx75nuq3lseacooozdmfk/app.bsky.feed.post/3mczojfqfec2m,2026-01-22T17:10:39.753Z,Remembering the old ways,0,6
at://did:plc:qodosqlyij3cxfboj37tygmc/app.bsky.feed.post/3mcznswe6us2s,2026-01-22T16:58:05.448Z,Automatically saves your work to iCloud if you have apple. It only saves ON THE DRIVE ONLY; meaning you got to BACKUP YOUR ART so you don’t lose it all whenever your iPad dies or overall gets too old. Sadly this happened to me.. I was able to open my iPad again but had to use a 3rd party software to,0,7
at://did:plc:34w6p2nygxpqkiqbkrnq56ip/app.bsky.feed.post/3mcznrhorbk2m,2026-01-22T16:56:36.000Z,#NowPlaying 🕞 3:56 am 🎵 Stockholm Syndrome 🧑‍🎤 Muse 💿 Absolution 🎧 Apple Music / Spotify / YouTube Music 📝 Lyrics,0,0
at://did:plc:2nzike6j4t56expbsb6yb5kl/app.bsky.feed.post/3md27nsice226,2026-01-22T22:17:20.964Z,It you:,0,1
at://did:plc:mvtr7eqbkl4jsocapkixth3h/app.bsky.feed.post/3md2bpqg6mk27,2026-01-22T22:54:13.360Z,"Since Apple doesn't seem to have any plans to release Monarch on blu-ray, I found this Chinese bootleg BD-R set. $20 w/ free shipping on eBay. The packaging is totally pro. Textured, and embossed gated slipcase. Picture, and sound quality are fantastic. 1080p, 5.1 surround. Totally worth it.",0,1
at://did:plc:vorvotpmx47il67kg54nddsw/app.bsky.feed.post/3md2cdyewdk2l,2026-01-22T23:05:32.830Z,"Depends… You will eat the best tomato of your life in the Mediterranean, but you won’t be able to get a decent apple for love nor money…",0,1
at://did:plc:nztbvvo2gl4227zuxjf7gog3/app.bsky.feed.post/3mczfmhzzwc2c,2026-01-22T14:31:19.174Z,It was odd watching a commercial for Apple TV's Formula 1 contract padded out to two and a half hours,1,27
at://did:plc:extqxtsoc4q4qnbmwizooppn/app.bsky.feed.post/3md2ehgrffe2y,2026-01-22T23:40:55.000Z,#NowPlaying 🕥 10:40 am 🎵 Peaches 🧑‍🎤 Young Franco & Charlotte Plank 🎧 Apple Music 📝 Lyrics,0,0
at://did:plc:dpsw2vdevedyqzanf37o6lua/app.bsky.feed.post/3mczkav7jgtl2,2026-01-22T15:52:23.000Z,➕ 804-392-5724 Apple pay - https://techscammersunited.com/t/804-392-5724-apple-pay/38525 - #scammer #scambaiting #scambait,0,0
at://did:plc:qaqjnwdodbkisnoy735vhpah/app.bsky.feed.post/3mczd6xcbnk2y,2026-01-22T13:47:57.921Z,🤓 what kind of fruit is this? #art #oc,9,46
at://did:plc:rfawzs4jt7e7o4cvix2h6zb2/app.bsky.feed.post/3mczbhgo6322r,2026-01-22T13:16:54.991Z,Perfect apple! Commission for @cinnamonbunnydog.bsky.social,3,13
at://did:plc:5rohpjdw4btwam2rm6mp5u7w/app.bsky.feed.post/3mcywlf6tqs2q,2026-01-22T10:02:16.504Z,"hello, son. i have acquired myself the brand new Apple Cellular Device. It even has an application that eliminates my opposition! FIDDLESTICKS!! That's the incorrect application. Nyaha! Cellular Devices are Spectacular!",0,4
at://did:plc:dbx5fob2v5br2fifsc7vy6do/app.bsky.feed.post/3mcxwc27huc2w,2026-01-22T00:24:23.262Z,I hope it is as successful as the Apple Vision Pro.,0,0
at://did:plc:uwxzj3wcos2qxzcwbfrva7xs/app.bsky.feed.post/3mcxxi6mxrk2h,2026-01-22T00:45:38.203Z,"10 80s and 90s ADVENTURE GAMES TO CHECK OUT! 3. Neuromancer (1988) While we wait for the Apple TV series to debut, we still have this adaptation of William Gibson's novel to enjoy, offering a chance to stroll through Chiba City and enter Cyberspace along to some Devo music.",0,1
at://did:plc:extqxtsoc4q4qnbmwizooppn/app.bsky.feed.post/3mcy7ywmo7624,2026-01-22T03:17:20.000Z,#NowPlaying 🕑 2:17 pm 🎵 I Like It Like That 🧑‍🎤 Fcukers 🎧 Apple Music / Spotify / YouTube Music 📝 Lyrics,0,0
at://did:plc:3pmiada4mdkrmuxtflg3iijm/app.bsky.feed.post/3mcybfgdlgk2q,2026-01-22T03:43:07.783Z,,1,6
at://did:plc:diviia67hzdixba4xgtorcax/app.bsky.feed.post/3mcycn4ao5k2p,2026-01-22T04:05:19.397Z,www.wired.com/story/phone-... 👇🏼💯 It is truly awful. WTF were they thinking? Enough to make someone whose devices are all Apple and have been for decades consider changing to another operating system.,0,0
at://did:plc:34w6p2nygxpqkiqbkrnq56ip/app.bsky.feed.post/3mcy5m32o7p2w,2026-01-22T02:34:14.000Z,#NowPlaying 🕜 1:34 pm 🎵 Sea Calls Me Home 🧑‍🎤 Julia Holter 💿 Have You In My Wilderness 🎧 Apple Music / Spotify / YouTube Music 📝 Lyrics,0,0
at://did:plc:6kqacfjrlue2gpukap2v2nnq/app.bsky.feed.post/3mcyt5mwkzc2w,2026-01-22T09:00:53.628Z,"""Surely the apple is the noblest of fruits."" Henry David Thoreau. www.homesyncing.co.uk #decorforthehome #homedecor #homeinspirataion #homestyling #interiordesign #prettygifts #prettythingsforthehome #beautifulhome #houseandhome #fruits #fruitart #appleart #pearart",3,4
at://did:plc:nxflf7baf47qw4p7ihqjbqfh/app.bsky.feed.post/3mczh2eqrv22v,2026-01-22T14:56:59.227Z,"My fellow white people, if you don’t recognize each and every one of the atrocities listed in this thread, please please please—yes, I am begging here—look up and learn about these horrors. What is happening now is as American as apple pie—it just happens to be impacting white people this time.",1,8
at://did:plc:3ykz2nhkt6qvto64omgj7ep2/app.bsky.feed.post/3mcy2b33un32a,2026-01-22T01:35:25.567962+00:00,"arXiv📈🤖 On Analyzing the Conditions for Stability of Opportunistic Supply Chains Under Network Growth By Wadhwa, Sinha",0,0
at://did:plc:ogejnmhy6lt2y4r3d2yrpgcp/app.bsky.feed.post/3mcy5oji2oc25,2026-01-22T02:36:38.115Z,"Sketch of Captain Ake, who I love already (whom? idk how that works), eating one of her spicy apple-looking fruits with the piggies out after her shift ends. #art #wip",0,5
at://did:plc:n2jsfem4xaz7ezan5omwrrcn/app.bsky.feed.post/3mcyep3clqc2h,2026-01-22T04:42:13.006Z,it's wonderful but i will never forgive apple (despite not being an apple user) for replacing the aux cord with an usb-c. why can't we have both,0,2
at://did:plc:3kaoq6bchouibpcdkotkmsdm/app.bsky.feed.post/3mczdmhn6h22t,2026-01-22T13:55:31.269Z,i’m spoon feeding u my apple crumble,0,1
at://did:plc:5njfnoobkm6saqum5o7ujq6y/app.bsky.feed.post/3mcynwg2be227,2026-01-22T07:27:22.822Z,apple update moving the position of secondary characters on the keyboard so now i have to remap years of muscle memory and there’s no way to reverse it im actually about to freak the fuck out,0,2
at://did:plc:ie5bbztcnpdw4bagy524ue27/app.bsky.feed.post/3md27hqjcdc2h,2026-01-22T22:13:57.576Z,"2026 Hey Siri Songs - Day 22 ""Hey Siri. Play I Am The Rich Man by Goldie Boutilier."" #Nite #HomePod #Music #GoldieBoutiler Apple Music: music.apple.com/gb/album/i-a... Spotify: open.spotify.com/track/57VGVk...",0,0
at://did:plc:rfoctmk4guq56gensuermj7q/app.bsky.feed.post/3mczqw6qqu22g,2026-01-22T17:53:36.129Z,"I swear I’m about to start broadcasting Hanoi Hannah style. SUBSTACK DOESN’T CARE ABOUT YOU, NEWSLETTER WRITER. WHILE YOU ARE FIGHTING TO KEEP CONTROL OF YOUR SUBSCRIBER LIST, SUBSTACK IS PROMOTING A TV SHOW WITH CHRIS CILIZZA. GIVE UP, NEWSLETTER WRITER. SUBSTACK DOESN’T CARE IF YOU DIE.",19,81
at://did:plc:zup6yubhse3q6tivyovpw7xs/app.bsky.feed.post/3mcyga7lu5k2r,2026-01-22T05:09:41.651Z,💝🐾🌲 me toooo @guilhernunes.bsky.social,3,28
at://did:plc:jf26a7dgps3fck4zc7anchdl/app.bsky.feed.post/3mcz35tj57k2j,2026-01-22T11:24:10.389217+00:00,「iphone apple 折りたたみ」に関する記事です: https://iphoneislam.com/ja/2026/01/will-the-apple-pencil-work-with-the-iphone-fold/163023,0,0
at://did:plc:6wfoltwegmft35i2zqmpoac4/app.bsky.feed.post/3mczzzddt6s24,2026-01-22T20:36:25.294Z,"First time ever 🤍⌚️ Apple Watch Series 11 in titanium. Not big on accessories—this one’s different. Health, movement, and better sleep. Wellness over flash ✨ #HealthFirst #AppleWatchSeries11 #TitaniumWatch #SleepMatters #WorkoutMotivation",0,0
at://did:plc:34w6p2nygxpqkiqbkrnq56ip/app.bsky.feed.post/3mcyywh3xox2l,2026-01-22T10:43:28.000Z,#NowPlaying 🕤 9:43 pm 🎵 What's Fair 🧑‍🎤 Blondshell 🎧 Apple Music / Spotify / YouTube Music,0,0
at://did:plc:7j3bszinofxweabbxhtjgeb4/app.bsky.feed.post/3mcz2mjtxis2b,2026-01-22T11:14:29.912Z,"we ARE talking about apple picking like, real apples right? the fruit? on trees? i would love to pick apples with a bunch of terrifying, huge and inked guys. we could eat them together after! plus they could reach the apples i can't because they're huge!",0,0
at://did:plc:lao6esrizvfh6fobmyegun6s/app.bsky.feed.post/3mcz7pqhybg2y,2026-01-22T12:45:45.991Z,"Apple targeting 20 million AI wearable pins for 2027. Humane managed fewer than 10,000 sales before collapsing. Two cameras, three mics, AirTag-sized but thicker. The contrast in production expectations is... https://www.implicator.ai/apple-bets-it-can-build-the-wearable-ai-pin-that-humane-couldnt/",0,1
at://did:plc:jmlo7gxfpeafcofthqewskj6/app.bsky.feed.post/3mcz7ezprtc2u,2026-01-22T12:39:46.825Z,Im going to apple today to see if they could do anything if not I will just get a new phone.,1,0
at://did:plc:aouvchjwgyi5c2yp45xgqtrs/app.bsky.feed.post/3mcztadjhgk2g,2026-01-22T10:35:03-08:00,New Podcast Episode: Hands-On Apple: Custom Pages Templates Building Personalized Document Designs with @mikahsargent.com,0,1
at://did:plc:zgsrmiu3wrajqa4kw65fa5rr/app.bsky.feed.post/3mczsbk2u6k2f,2026-01-22T18:17:50.843Z,DONT BUY APPLE. DONT USE AMAZON OR GOOGLE.,0,2
at://did:plc:extqxtsoc4q4qnbmwizooppn/app.bsky.feed.post/3mcypye4xlf23,2026-01-22T08:03:19.000Z,#NowPlaying 🕖 7:03 pm 🎵 Drive 🧑‍🎤 Gretta Ray 💿 Unearthed High Finalists 2016 🌱 Triple J Unearthed 🎧 Apple Music / YouTube Music 📝 Lyrics,0,0
at://did:plc:k2smhhjvm35cjqpdsyw7o7o3/app.bsky.feed.post/3mcyef5f4xc2v,2026-01-22T04:36:39.637Z,Apple lost the thread after Jobs died. Nobody has the heart or vision. They all just want to make photocopies.,0,1
at://did:plc:fbe7p6724c2glp2l4frww5vg/app.bsky.feed.post/3mcysaffri224,2026-01-22T08:44:32.665Z,"Software quality appears to be a fixed constant. As the total amount of software increases, average quality decreases. I do miss the days when Apple had Human Interface Guidelines instead of app store policy.",0,4
at://did:plc:ydgvpyjwkflnc5j4sshmhaoq/app.bsky.feed.post/3mcznsflh3s24,2026-01-22T16:57:47.859Z,She doesn’t remember doing it but we think her weverse account was created with her Apple ID and that is messing things up. I’ve had her sign out and clear cookies and sign back in. We’ve tried different browsers and different devices. Don’t think it’s happening for her. Just me now 😣,0,1
at://did:plc:34w6p2nygxpqkiqbkrnq56ip/app.bsky.feed.post/3mcz2psvhan2e,2026-01-22T11:15:03.000Z,#NowPlaying 🕙 10:15 pm 🎵 Vertigo 🧑‍🎤 Boy & Bear 💿 Tripping Over Time 🎧 Apple Music / YouTube Music 📝 Lyrics,0,0
at://did:plc:w2yenz43ofkk752xk3s6i55y/app.bsky.feed.post/3mcz6pv5ah22u,2026-01-22T12:27:57.380Z,"^phone‘s charging is being manipulated using spyware agents by state sponsored harassers state sponsored terror unit, which either depletes without cause, charges slow or get stuck at particular percentage @Apple",0,0
at://did:plc:76mt56qhvrfpskt45hwgm2iz/app.bsky.feed.post/3mczbw5hyjc2l,2026-01-22T13:25:08.674Z,I mean maaaaybe Basily over at RIM? Of the 2 big mobile computing pushes of the era apple definitely won the long game but for a time the Blackberry crowd were absolutely insufferable. <--BES admin back in The Day,0,0
at://did:plc:kvg4ekamycvs3oj7o2z2gvwa/app.bsky.feed.post/3mczp3msc3s2o,2026-01-22T17:20:51.134Z,"Fuck it, rare Élise face pic",1,27
at://did:plc:lc6hdhnjkgccd6ysi7e23pll/app.bsky.feed.post/3mczu436trc24,2026-01-22T18:50:34.758051+00:00,SECOND BITE OF THE APPLE- Court Dismisses Privacy Claims Stemming from Data Collection on Apple Apps for the Second Time Around ->The National Law Review | #Privacy #Data | More from Lil Dr Glen EcoChat at BigEarthData.ai,0,0
at://did:plc:wd5brhkvb5sy2pfr2pfkkjxj/app.bsky.feed.post/3mczklzskmc2u,2026-01-22T16:00:32.953Z,C’est super cool ! Vous pensez adopter une sorte de street view ? (3D à la Apple maps ou bizarre à la Google maps),0,0
at://did:plc:l2ikc42ed6pdmh56ufjmwv3k/app.bsky.feed.post/3mcy4sos27s2d,2026-01-22T02:21:04.157Z,"27 (Try a new type of exercise) took me a while to get back here, but I continue to tinker with strength workouts in Apple Fitness+ because cardio is not the problem in my life. Now to make it more of a habit and get some use out of my poor dumbbells! No photos in action",0,0
at://did:plc:cnljohli27eawh5rwiywgb3y/app.bsky.feed.post/3mcy4rprlgk2w,2026-01-22T02:20:31.643Z,Five concerts you've seen with woman lead singers Fiona Apple Brody Dalle In This Moment Hooverphonic Ani DiFranco,0,1
at://did:plc:oo2h5qop7kqdpl23trgrl4vj/app.bsky.feed.post/3mcy643csps2x,2026-01-22T02:44:13.027Z,"Green Apple is wonderful. If you have not already gone, it is surrounded by tasty Asian food and some excellent bakeries.",0,1
at://did:plc:ov3ojnr3p2fvtlycud25xgf3/app.bsky.feed.post/3mczdwaonzc2f,2026-01-22T14:00:59.521Z,"Interestingly enough, apple is now playing the role of big brother with data collection.",0,0
at://did:plc:34w6p2nygxpqkiqbkrnq56ip/app.bsky.feed.post/3mczenyfipc2w,2026-01-22T14:11:35.000Z,#NowPlaying 🕐 1:11 am 🎵 delete 🧑‍🎤 DMA'S 💿 DMA's 🎧 Apple Music / YouTube Music 📝 Lyrics,0,0
at://did:plc:mv3hxx5niimlbcwyas67yb2x/app.bsky.feed.post/3mcz255f3d22c,2026-01-22T11:05:53.525Z,Hard to explain why but I feel like this apple would have a pleasantly crisp texture,0,2
at://did:plc:extqxtsoc4q4qnbmwizooppn/app.bsky.feed.post/3mcz2d5pw3b23,2026-01-22T11:08:24.000Z,#NowPlaying 🕙 10:08 pm 🎵 Be Careful 🧑‍🎤 Cardi B 💿 Invasion of Privacy 🎧 Apple Music / Spotify / YouTube Music 📝 Lyrics,0,0
at://did:plc:jf26a7dgps3fck4zc7anchdl/app.bsky.feed.post/3mcz2jqwxxh26,2026-01-22T11:12:56.602979+00:00,「サーバー apple apple google」に関する記事です: https://gigazine.net/news/20260122-new-siri-chatbot-run-google-servers/,0,0
at://did:plc:jf26a7dgps3fck4zc7anchdl/app.bsky.feed.post/3mcz2pns2rr2n,2026-01-22T11:16:14.625333+00:00,記事の要約: KDDIと沖縄セルラーは、auとUQ mobileのiPhoneユーザーを対象に、Appleのフィットネスサービス「Apple Fitness+」を最大3カ月間無料で提供するキャンペーンを開始しました。通常、月額980円の個人プランが無料で利用できるほか、「auウェルネス」を通じてApple Fitness+のサイトを訪れることでアプリ内のコインを獲得できる仕組みも導入される予定です。キャンペーンの終了時期は未定です。,0,0
at://did:plc:x455ws6m7p2bp2vcpygy5buw/app.bsky.feed.post/3mczc4ym56s2o,2026-01-22T13:28:58.447Z,Are you guys no longer on Apple Podcasts?,0,0
at://did:plc:e3vxabntcpydh3smjdiofqh7/app.bsky.feed.post/3mcy6mhpg7k2x,2026-01-22T02:53:22.890Z,Mo said,1,37
at://did:plc:zrtlkovs2c5beqpltihl3miq/app.bsky.feed.post/3mcyoi43ldc2g,2026-01-22T07:37:16.362Z,"Je vote pour l Apple reconditionné J'aime pas trop Apple, mais ça m'a l'air plus simple pour la synchronisation, et ça reste du matériel fiable et durable (enfin je crois) Et dernière raison : je suis pour le reconditionné",0,2
at://did:plc:ngcdsgmszcubrm66yinhhpqz/app.bsky.feed.post/3mcyoo7yb662d,2026-01-22T07:40:41.276Z,Apple might drop an AI‑wearable pin while rivals like OpenAI gear up for a H2 launch. Think tiny hardware that talks back. Curious? Dive into the Davos buzz and Chris Lehane’s take. #AIwearable #AppleAI #OpenAI 🔗 aidailypost.com/news/apple-e...,0,0
at://did:plc:extqxtsoc4q4qnbmwizooppn/app.bsky.feed.post/3mcyk4mb6sd2y,2026-01-22T06:18:15.000Z,#NowPlaying 🕔 5:18 pm 🎵 Racer 🧑‍🎤 Blusher 💿 RACER 🌱 Triple J Unearthed 🎧 Apple Music / Spotify / YouTube Music 📝 Lyrics,0,0
at://did:plc:7dy7tkasxq575se7eq5assda/app.bsky.feed.post/3mcyoyalwye2v,2026-01-22T07:46:16Z,Apple starebbe sviluppando la sua AI Pin per il 2027 #AIPin #Apple #AppleIntelligence #GadgetTech #HumaneAIPin #Indossabili #Leak #RabbitR1 #Rumors #SmartDevice #TechNews #Tecnologia #Wearables www.ceotech.it/apple-stareb...,0,0
at://did:plc:e2fun4xcfwtcrqfdwhfnghxk/app.bsky.feed.post/3mczfdgljjs2c,2026-01-22T14:26:15.659Z,*extremely Sting voice* i want myyyyy behind the bastards APPLE PODCASTS GET YOUR SHIT TOGETHER,0,1
at://did:plc:sqzn75vhdfd5zdgax43yjgak/app.bsky.feed.post/3mczfpn6egc2o,2026-01-22T14:33:05.221Z,"Cuts is so giddy he’s inventing new terms now, like “apple-cidered”.",0,1
at://did:plc:34w6p2nygxpqkiqbkrnq56ip/app.bsky.feed.post/3mcyuc2m7nt27,2026-01-22T09:20:12.000Z,#NowPlaying 🕗 8:20 pm 🎵 Sell You The Sun 🧑‍🎤 BATTS 🌱 Triple J Unearthed 🎧 Apple Music 📝 Lyrics,0,0
at://did:plc:gwad56tzl7f46jv4zpdzqxdc/app.bsky.feed.post/3mcyigdzh622k,2026-01-22T05:48:55.120Z,"As much as Apple are still …Apple. I use iTunes cause if I want a song, I want to pay the artist for that song and it is harder to fuck over an artist when they know I paid $NZ 2.49 or whatever for that song…rather than some dodgy percentage of downloads calculation",0,3
at://did:plc:jf26a7dgps3fck4zc7anchdl/app.bsky.feed.post/3mcz3dyinzz2a,2026-01-22T11:27:36.936183+00:00,記事の要約: Apple Fitness+が日本市場に進出するにあたり、28人のトレーナー全員の声をAIで再現することに特別なこだわりを持っている。この取り組みは、単なる字幕翻訳ではなく、トレーナーの声のトーンや精神を保持するための大規模な技術投資によるものである。Appleのフィットネステクノロジー担当者、ジュールズ・アーニー氏は、トレーナーとの「つながり」を重視し、フィットネスとウェルネスを多くの人々に届けることが最大の使命であると語っている。 また、Apple Fitness+は、シンプルさとパーソナライゼーションを重視し、ユーザーが好みのトレーナーやアクティビティを簡単に見つけられ…,0,0
at://did:plc:ewrea3gipmlunhikrrkv63vq/app.bsky.feed.post/3mczgoscyls2c,2026-01-22T14:50:30.801Z,"Stream BeautyReigns On Apple Music, YouTube, Amazon, Spotify, Deezer #oscarworthysongs #oscarworthymusic",0,0
at://did:plc:pkwvtkq2swj4kfg2am3a4o5h/app.bsky.feed.post/3mcyazhidfc25,2026-01-22T03:36:26.353Z,"Blind test showed that #Gemini was ""best""... #Apple admits that ""Apple Intelligence"" has failed. Apple AI is dead, long live Gemini, our future overlord...😬 www.reuters.com/business/goo...",0,0
at://did:plc:yfnemaellca64lvba3zwsaw6/app.bsky.feed.post/3mcybnnl4622n,2026-01-22T03:47:43.825Z,you may know this but the inside baseball is apple isn't in the school district that serves the vast majority of cupertino.,0,4
at://did:plc:whha2lyoba257ydoep5enjdd/app.bsky.feed.post/3mcycmkcnyc2k,2026-01-22T04:05:00.565Z,ℳ𝒶𝒾𝒹𝑒𝓃 𝒶𝓃𝒹 𝒜𝓅𝓅𝓁𝑒 🍎,1,5
at://did:plc:kkp47l5ftsaeviaft624clyl/app.bsky.feed.post/3mcxwnglwms2o,2026-01-22T00:30:45.352Z,"I subscribed to Apple One with a deal I got from Verizon, I've been pretty happy with it. It definitely helps if you're already firmly in the Apple ecosystem.",0,2
at://did:plc:ilxjbreerinutnzsabm5mhfo/app.bsky.feed.post/3mczjgwii2s26,2026-01-22T15:39:47.967Z,"My trackpad charges off my phone charger, but my phone now charges off the same cable as my headphones, keyboard and my mouse, and sometimes my laptop. So now I have one special cable just for my trackpad. Never change, Apple",0,0
at://did:plc:34w6p2nygxpqkiqbkrnq56ip/app.bsky.feed.post/3mczqz66xlm27,2026-01-22T17:54:30.000Z,#NowPlaying 🕟 4:54 am 🎵 Cold World 🧑‍🎤 Drapht 💿 A Beautiful Day To Be Lonely 🎧 Apple Music / YouTube Music 📝 Lyrics,0,0
at://did:plc:extqxtsoc4q4qnbmwizooppn/app.bsky.feed.post/3mczrkzcqz524,2026-01-22T18:03:55.000Z,#NowPlaying 🕔 5:03 am 🎵 Lobby Calls 🧑‍🎤 The Rions 💿 Everything Every Single Day 🌱 Triple J Unearthed 🎧 Apple Music / Spotify / YouTube Music 📝 Lyrics,0,0
at://did:plc:2yojour2ma5ry4yjsgf4tl2h/app.bsky.feed.post/3md2beliu722j,2026-01-22T22:47:59.138Z,high chair and feed me dino nuggies and apple slices with peanut butter and put me down for a nap in my crib with a dozen plushies and then invite all your friends over to hang out for the evening and then change my diaper in front of everyone against my protests and then put me in a playpen,0,3
at://did:plc:6guakv2f7mbrhgi4h2d3aoje/app.bsky.feed.post/3mcy373odzs2w,2026-01-22T01:52:12.835Z,HI APPLE,0,2
at://did:plc:o5ziqhe3zamtk74c6tmksehc/app.bsky.feed.post/3mczyj5oknqtn,2026-01-22T20:09:28.742Z,"I eventually found it on the App Store, but buried at the bottom of a pile of irrelevant shite. It’s almost as if Apple (US Corp) doesn’t want you to know about it!",0,2
at://did:plc:xgiwmvykueububu2czbxrkvw/app.bsky.feed.post/3mczhs4emo562,2026-01-22T15:08:31.000Z,"The world of talking chatbots just isn’t for me. I doubt it will be for most. Chatbots, Pins, and Other Talking Distractions #Apple #Tech #AI #Chatbots https://warnercrocker.com/2026/01/21/chatbots-pins-and-other-talking-distractions/",3,0
at://did:plc:aouvchjwgyi5c2yp45xgqtrs/app.bsky.feed.post/3mczzwvbqhw2t,2026-01-22T12:35:03-08:00,"New Article: What's Included in Apple Creator Studio—and How Does It Compare to Buying Apps Outright? Discover which top creative apps come with Apple's Creator Studio, plus the pros and cons highlighted on iOS Today.",0,1
at://did:plc:extqxtsoc4q4qnbmwizooppn/app.bsky.feed.post/3mczvuq2itd2m,2026-01-22T19:21:52.000Z,#NowPlaying 🕕 6:21 am 🎵 Why Not 🧑‍🎤 Hilary Duff 💿 Metamorphosis 🎧 Apple Music / YouTube Music 📝 Lyrics,0,1
at://did:plc:34w6p2nygxpqkiqbkrnq56ip/app.bsky.feed.post/3mczwnr3cp624,2026-01-22T19:34:02.000Z,#NowPlaying 🕡 6:34 am 🎵 Left Hand Free 🧑‍🎤 Alt-J 💿 This Is All Yours 🎧 Apple Music / YouTube Music 📝 Lyrics,0,0
at://did:plc:extqxtsoc4q4qnbmwizooppn/app.bsky.feed.post/3mczwt4teub2g,2026-01-22T19:38:41.000Z,#NowPlaying 🕡 6:38 am 🎵 Afterthought 🧑‍🎤 Tame Impala 💿 Deadbeat 🎧 Apple Music / YouTube Music 📝 Lyrics,0,0
at://did:plc:rid257izzs6jnb3th35dkm5k/app.bsky.feed.post/3md2dlnarlc2s,2026-01-22T23:27:43.337Z,i got apple cinnamon herbal tea to have in the evenings and it is soo good i look forward to it every day,0,7
at://did:plc:6o4qo2r77djowplfiy7e5kvg/app.bsky.feed.post/3md2ec55bkc2s,2026-01-22T23:40:18.197Z,"Bro, I just put on a new binder I just bought and my Apple Watch counted it as an exercise minute..",0,6
at://did:plc:pcyel2nuzo4y42334mi6nyui/app.bsky.feed.post/3mczwqoakps2d,2026-01-22T19:37:53.499Z,Teepee Cider started several decades ago with sourcing cider apple trees. Reseach on the internet was a lot harder in those days. However I did find Bill Struthers who ran Nga Rakau nursery in west Auckland. He was very helpful and supplied our key varieties. A real gentleman. #cider #apples,0,5
at://did:plc:z5efhtji4vfiutzqquvx3w7o/app.bsky.feed.post/3mczsftz6xs2m,2026-01-22T18:20:15.492Z,Apple TV... wen?,0,2
at://did:plc:extqxtsoc4q4qnbmwizooppn/app.bsky.feed.post/3mcy2jojti32h,2026-01-22T01:38:41.000Z,#NowPlaying 🕜 12:38 pm 🎵 Are You Gonna Be My Girl 🧑‍🎤 Jet 💿 Get Born 🎧 Apple Music / Spotify / YouTube Music 📝 Lyrics,0,1
at://did:plc:msibbasr2pn5aaw6b447wda4/app.bsky.feed.post/3mcy3nttw5x26,2026-01-22T02:00:26+00:00,Apple is reportedly working on an AirTag-sized AI wearable https://www.europesays.com/uk/711982/ Apple is working on an AI-powered wearable pin with cameras and microphones designed to pick up a user’s…,0,0
at://did:plc:pfcuupdhhpkrnzmyv3np55nr/app.bsky.feed.post/3mcz3iosfps2x,2026-01-22T11:30:14.628Z,"If our faces put you off your egg on toast, we get it. You can listen on Spotify, Apple Podcasts, Amazon Music, Deezer… probably even on some apps we don’t know exist. Find it wherever you get your podcasts 👇 open.spotify.com/episode/5dG6... #WrestlingPodcast #AEW #TNA #ProWrestling",0,4
at://did:plc:wjljc54nads6ix5tlp4swebe/app.bsky.feed.post/3mcywhfgcpq2c,2026-01-22T10:00:02.448108+00:00,"teckel Web3 API hourly update Eth price (USD): 3011.95 (+0.3% 1 hr, +2.1% 24 hr) Click for API details API keys via App: Apple App Store Google Play Store #teckel #eth",0,1
at://did:plc:l56qrg6j6nkcjvxpnt4czbe6/app.bsky.feed.post/3mcyghwikg226,2026-01-22T05:14:00.555Z,"I have been personally attacked Apple cinnamon spiced, come *on*",0,2
at://did:plc:idyrpnqskmnqxe4kpm3lzvgj/app.bsky.feed.post/3mcyag3dqzk27,2026-01-22T03:25:36.084Z,"I found you under an April sky And you feel like City life, apple pie baked just right Home is wherever you are tonight",3,13
at://did:plc:sbbkidbcpmjpbtncikffykn5/app.bsky.feed.post/3mcy5qbh2722d,2026-01-22T02:37:36.792Z,Gonna put in a pinch of apple skol first,0,0
at://did:plc:extqxtsoc4q4qnbmwizooppn/app.bsky.feed.post/3mcybhgnehs2g,2026-01-22T03:43:48.000Z,#NowPlaying 🕝 2:43 pm 🎵 Count The Ways 🧑‍🎤 The Last Dinner Party 💿 From The Pyre 🎧 Apple Music / Spotify / YouTube Music 📝 Lyrics,0,0
at://did:plc:34w6p2nygxpqkiqbkrnq56ip/app.bsky.feed.post/3mcycjg23gy24,2026-01-22T04:01:56.000Z,#NowPlaying 🕒 3:01 pm 🎵 Stay Right 🧑‍🎤 A. Swayze & The Ghosts 🌱 Triple J Unearthed 🎧 Apple Music / YouTube Music 📝 Lyrics,0,0
at://did:plc:34w6p2nygxpqkiqbkrnq56ip/app.bsky.feed.post/3mcypiaym7z2z,2026-01-22T07:54:31.000Z,#NowPlaying 🕡 6:54 pm 🎵 Dandelions 🧑‍🎤 Whitney 💿 Small Talk 🎧 Apple Music / Spotify / YouTube Music 📝 Lyrics,0,0
