ID_Tweet,Fecha_UTC,Contenido_Texto,Retweets,Favoritos
at://did:plc:bb6ala2nflzwyuivatl55w57/app.bsky.feed.post/3mdtj4eebg22f,2026-02-01T23:43:06.608Z,"I need an Apple Music playlist of every single album and song nominated. I imagine it'll take about a week's worth of listening, but it's worth it",0,0
at://did:plc:lcplmuy3gegcnmn2erclqmzu/app.bsky.feed.post/3mdsolfp2dc2v,2026-02-01T15:48:20.294Z,I finally deleted it. It was beyond useless. The Apple weather app has finally gotten good enough to use,0,2
at://did:plc:5vfnmm2d5qqkmc5kduj4ucjf/app.bsky.feed.post/3mdsrrs3ipl2c,2026-02-01T16:45:35.628721+00:00,Apple ID locked on iPad 1st gen mini #Jailbreak #iOS https://www.reddit.com/r/jailbreak/comments/1qt3f8j/apple_id_locked_on_ipad_1st_gen_mini/,0,0
at://did:plc:aizt7s6qn3gudkkfredlsz7o/app.bsky.feed.post/3mdstxgjesk2u,2026-02-01T17:24:32.522Z,Have they had a successful new piece of hardware since the Apple Watch a decade ago?,0,0
at://did:plc:s3eipouz2big47n3rqztrnqv/app.bsky.feed.post/3mdsyujq7yk25,2026-02-01T18:52:23.934Z,Apple not mentioned as a cloud provider in this? Does this suggest it is safe?,0,0
at://did:plc:h6disr7eqpr3ws2eqsd7rnft/app.bsky.feed.post/3mdszgquzjg2r,2026-02-01T19:02:33.989455+00:00,"Apple Iphone 15 (128 GB) — Rosa -- Amazon R$ 3.913,00 Compre aqui ⬇️⬇️",0,0
at://did:plc:3xious22nlonh7vruc46dxxr/app.bsky.feed.post/3mdt4s5tmuc2n,2026-02-01T20:02:39.323Z,Whenever I get sad I read the entry for the newton pippin apple on applerankings.com,0,4
at://did:plc:s7jpfbqt6so7zxffjkxkxxxe/app.bsky.feed.post/3mdtadlogxk2t,2026-02-01T21:06:05.471Z,,0,0
at://did:plc:e3wtuvycahzvn5v43hkiqkz2/app.bsky.feed.post/3mdrg4xt77k2n,2026-02-01T03:44:26.319Z,"Reminder: The saying is, ""One bad apple can spoil the barrel."" Some people just insist on sitting right next to a mushy one.",1,8
at://did:plc:extqxtsoc4q4qnbmwizooppn/app.bsky.feed.post/3mdrhje7wop2g,2026-02-01T04:08:15.000Z,"#NowPlaying 🕒 3:08 pm 🎵 hit me where it hurts x 🧑‍🎤 Skrillex, Dylan Brady & Caroline Polachek 🎧 Apple Music 📝 Lyrics",0,0
at://did:plc:xctsssm4ed2u2ubcpancgdwr/app.bsky.feed.post/3mdslmxqzic2h,2026-02-01T14:55:31.565Z,"Thank you! They really are. The boston creme donuts and the apple fritter are my very favorites, but they're all tasty",0,1
at://did:plc:sbuf5kpg6r7cbl5dzie66hko/app.bsky.feed.post/3mdrcdfckn223,2026-02-01T02:36:26.812Z,Hard to beat a good honeycrisp apple,0,3
at://did:plc:extqxtsoc4q4qnbmwizooppn/app.bsky.feed.post/3mdsmdrt2ow2g,2026-02-01T15:06:43.000Z,#NowPlaying 🕑 2:06 am 🎵 Creatures In Heaven 🧑‍🎤 Glass Animals 🎧 Apple Music / Spotify / YouTube Music 📝 Lyrics,0,0
at://did:plc:extqxtsoc4q4qnbmwizooppn/app.bsky.feed.post/3mdrsedrvpb2r,2026-02-01T07:22:20.000Z,#NowPlaying 🕕 6:22 pm 🎵 Holy Grail 🧑‍🎤 Faith Williams 🎧 Apple Music,0,0
at://did:plc:extqxtsoc4q4qnbmwizooppn/app.bsky.feed.post/3mdskyuy6n52m,2026-02-01T14:43:28.000Z,#NowPlaying 🕜 1:43 am 🎵 Do I Need You Now? 🧑‍🎤 DMA'S 💿 For Now 🎧 Apple Music / YouTube Music 📝 Lyrics,0,0
at://did:plc:ew5xulmnx22hvmhfvdytrh4z/app.bsky.feed.post/3mdstaxf4a223,2026-02-01T17:11:58.456Z,"And be sure to follow and subscribe to Modern Horror Screams on Spotify, Apple Podcasts or the podcast provider of your choice! Spotify: open.spotify.com/show/6Fh38ip... Apple: podcasts.apple.com/gb/podcast/m... #Scream #Horror #Podcast",0,0
at://did:plc:rl5x2gnnfacerzkg6lpm7j5i/app.bsky.feed.post/3mdstd43tm22n,2026-02-01T17:13:10.491Z,"Preorders for my book DITCHING WEIGHT STIGMA AND ANTI FAT BIAS AT SCHOOL begin on February 20! Available where books are sold on March 19. Does your school want to do a book club or PD on size diversity, equity and weight stigma? Message or email me! caitoconnorteach@gmail.com",0,2
at://did:plc:3ndi5eixg4zlyptkpmfdvcrm/app.bsky.feed.post/3mdszvq2pac2r,2026-02-01T19:10:57.870Z,The Mandela Apple,0,1
at://did:plc:extqxtsoc4q4qnbmwizooppn/app.bsky.feed.post/3mdsqqxssep24,2026-02-01T16:25:05.000Z,#NowPlaying 🕒 3:25 am 🎵 LOVE YOU LESS 🧑‍🎤 Joji 💿 Piss In The Wind 🌱 Triple J Unearthed 🎧 Apple Music / Spotify / YouTube Music 📝 Lyrics,0,0
at://did:plc:zjgi7od574a734xixdjo35mo/app.bsky.feed.post/3mdsxpztbgc2p,2026-02-01T18:31:59.302Z,"Heh, the bugs in the apple 9to5mac.com/2026/01/30/b...",0,0
at://did:plc:2azwjoq74hjp77osm3rkhjfu/app.bsky.feed.post/3mdr7kqvj6s22,2026-02-01T01:46:52.623Z,(Good) Apple fritters: worth it 🤤,0,2
at://did:plc:34w6p2nygxpqkiqbkrnq56ip/app.bsky.feed.post/3mdrkwhqgws2w,2026-02-01T05:07:43.000Z,#NowPlaying 🕓 4:07 pm 🎵 Freedom Of The Night 🧑‍🎤 Sophie Ellis-Bextor 🎧 Apple Music / Spotify / YouTube Music 📝 Lyrics,0,0
at://did:plc:extqxtsoc4q4qnbmwizooppn/app.bsky.feed.post/3mdsf6uqx4r2m,2026-02-01T12:59:45.000Z,#NowPlaying 🕦 11:59 pm 🎵 Peaches 🧑‍🎤 Young Franco & Charlotte Plank 🎧 Apple Music 📝 Lyrics,0,0
at://did:plc:wph3dk35vf4j2u556jeqmwn7/app.bsky.feed.post/3mdrc5u25zs2s,2026-02-01T02:33:20.940Z,"Look at me wrong and I’ll throw minced garlic and habanero infused apple butter on it, I will dip it in cayenne infused ranch dressing, this is apple-a-chin as fuck. I want this burger RARE",0,8
at://did:plc:qlwq4sr5hufm5xxd3irdirbh/app.bsky.feed.post/3mdr3v46xl22b,2026-02-01T00:41:05.020Z,Banks cut reliance on OpenAI | Apple buys Israel’s Q.ai | Musk eyes SpaceX–Tesla–xAI merger | OpenAI seeks $100B | SAP stock drops on cloud fears www.linkedin.com/pulse/banks-...,0,0
at://did:plc:w2unycv4ayylq3hxmse5gqnd/app.bsky.feed.post/3mdr3jbruec2z,2026-02-01T00:34:28.205Z,"Almost not at all Snow here. Most likely our Apple trees will die. My Cherry tree died two years ago 😥 Four Season can be Heavy up here. 8 months of Winter, 2 tweeks of Spring, one month of Summer.",0,1
at://did:plc:34w6p2nygxpqkiqbkrnq56ip/app.bsky.feed.post/3mdrahzybja24,2026-02-01T02:00:59.000Z,#NowPlaying 🕐 1:00 pm 🎵 Make It Look Easy 🧑‍🎤 DRAMA 💿 Platonic Romance 🎧 Apple Music / YouTube Music 📝 Lyrics,0,1
at://did:plc:oxbdw3ws7s4bilqc6exyyjly/app.bsky.feed.post/3mdrfu6h2fk2m,2026-02-01T03:39:31.265Z,You've got yourself a little fruit basket! Seems Apple might be a bit of a crabapple,0,0
at://did:plc:uxki3zcze2zu5syia7fgt7k2/app.bsky.feed.post/3mdsakaoxas2x,2026-02-01T11:37:09.112Z,Garmin is de enige. Als ge een Apple koopt sla ik u.,0,1
at://did:plc:34w6p2nygxpqkiqbkrnq56ip/app.bsky.feed.post/3mdrortwxqc2l,2026-02-01T06:18:37.000Z,#NowPlaying 🕔 5:18 pm 🎵 I Will Wait 🧑‍🎤 Mumford & Sons 💿 Babel 🎧 Apple Music / Spotify / YouTube Music 📝 Lyrics,0,0
at://did:plc:msibbasr2pn5aaw6b447wda4/app.bsky.feed.post/3mdrotkn7go2x,2026-02-01T06:20:12+00:00,"watchOS fitness apps need to make better use of the Apple Watch’s incredible user interface https://www.europesays.com/uk/734560/ The Apple Watch may not have changed all that much in the last decade and change, at least…",0,1
at://did:plc:extqxtsoc4q4qnbmwizooppn/app.bsky.feed.post/3mds7evvml624,2026-02-01T11:15:28.000Z,#NowPlaying 🕙 10:15 pm 🎵 I Want You (Fever) 🧑‍🎤 Momma 💿 Welcome To My Blue Sky 🎧 Apple Music / Spotify / YouTube Music 📝 Lyrics,0,1
at://did:plc:tf4r43pbwkgr7mnfduvpahgm/app.bsky.feed.post/3mdsfghthek2v,2026-02-01T13:04:31.091Z,Apple pie. Absolutely mid.,0,2
at://did:plc:ddte56bgot5dhv423qsq6iyk/app.bsky.feed.post/3mdr7v3iofc2w,2026-02-01T01:52:39.281Z,"Mas aí fica difícil, tudo os donos de companhia Americana doaram um monte pro Trump. Google, Amazon, Apple, Microsoft, Meta são as q eu lembro de cabeça. Não quero defender o gipiti não.",0,0
at://did:plc:ezlnyd5brkeropozfv6nyco2/app.bsky.feed.post/3mdrf4bolb22f,2026-02-01T03:26:09.356Z,My Homemade Low Salt Corned Beef with Beets and Cabbage 4 lbs beef brisket 1 low salt beef broth 16 ozs. 2 tablespoons apple cider vinegar 1/4 cup of Kosher salt 1 bulb of sleced or crushed garlic 2 tablespoons of mustard seeds 1 tablespoon of cracked peppercorns 1/,0,2
at://did:plc:mcavslkm5ono5hnvlxxzj5vj/app.bsky.feed.post/3mdriisq4ms2s,2026-02-01T04:26:51.112Z,"Apple buys Israeli startup Q AI, whose tech analyzes biometric/physiological signals, including facial expressions via ""facial skin micro-movements,"" enabling interpretation of whispers or silent mouthing. Read here: www.disclose.tv/id/wo2vfm5fko/ @disclosetv",0,0
at://did:plc:7x4cetq2raex6w6gz34gryxq/app.bsky.feed.post/3mds5ibh7x22t,2026-02-01T10:42:21.573Z,"""Evil is a relay sport When the one who's burned Turns to pass the torch"" (Relay, Fiona Apple) Lichtelijk geobsedeerd door open.spotify.com/album/0fO1Ke...",0,0
at://did:plc:fsftz5ue2bvlvkb6zx2bqdnh/app.bsky.feed.post/3mdrn2h2kpm26,2026-02-01T05:48:17.721945+00:00,"In a recent interview with the tech podcast TBPN, Bloomberg's Mark Gurman revealed that Apple was initially ""going to rebuild Siri around Claude,"" the large language model and chatbot developed by the company Anthropic. In the end, though, Apple announced that it had decided to use Google'..",0,2
at://did:plc:afgjjmxm3ogr7bwgkxpg6rs3/app.bsky.feed.post/3mdrnuwi55k2x,2026-02-01T06:03:06.406Z,"Jus go to Grapphene OS, if you think this matters. Has been there for years. ""Burrough level"" does not matter, if your phone is in 5G or next to some WiFi routers. This is Apple trying to remove telcos from location data budiness, but this is very hard to do so, that it can't be circumvented.",1,2
at://did:plc:extqxtsoc4q4qnbmwizooppn/app.bsky.feed.post/3mdrzkwmsae2c,2026-02-01T09:31:49.000Z,#NowPlaying 🕣 8:31 pm 🎵 Tenderness 🧑‍🎤 General Public 💿 All The Rage 🎧 Apple Music / Spotify / YouTube Music 📝 Lyrics,0,0
at://did:plc:34w6p2nygxpqkiqbkrnq56ip/app.bsky.feed.post/3mdsn6llmva2e,2026-02-01T15:22:39.000Z,#NowPlaying 🕑 2:22 am 🎵 Talk To Me 🧑‍🎤 Robyn 💿 Sexistential 🎧 Apple Music / Spotify / YouTube Music 📝 Lyrics,0,0
at://did:plc:34w6p2nygxpqkiqbkrnq56ip/app.bsky.feed.post/3mdsnopvecq2s,2026-02-01T15:32:00.000Z,#NowPlaying 🕝 2:32 am 🎵 Bounce 🧑‍🎤 Calvin Harris 💿 18 Months 🎧 Apple Music / Spotify / YouTube Music 📝 Lyrics,0,0
at://did:plc:extqxtsoc4q4qnbmwizooppn/app.bsky.feed.post/3mdtgbg6t2g2c,2026-02-01T22:50:33.000Z,#NowPlaying 🕤 9:50 am 🎵 HU4D 🧑‍🎤 X CLUB. & Matthew Dear 🎧 Apple Music,0,0
at://did:plc:dagmrgx3wnvmx4noxgr3d4zy/app.bsky.feed.post/3mdtijrkzws2t,2026-02-01T23:32:42.925Z,apple air tag keychain them if you find them,0,0
at://did:plc:362h4zoazrg6jq7qqzhtdwru/app.bsky.feed.post/3mdthkxtr6c25,2026-02-01T23:15:29.280Z,When @noslamm.bsky.social and I have breakfast together.,4,61
at://did:plc:ay5hm2umsel66s7xvphkj34k/app.bsky.feed.post/3mdsp4u2k3s25,2026-02-01T15:58:05.769Z,Wintry morning colors✌️ #sunrise #bluesky #eastcoast #nj #winter #photography #landscape #nature #photo #art #moma #morning #colors #apple #iphone #iphonephotography #sky,6,52
at://did:plc:ktlfg4hiffptjc2fom7snbok/app.bsky.feed.post/3mdr4mswtms2x,2026-02-01T00:54:20.647Z,"Honestly when I think about it and apple TV's track record, I couldn't think of a better publisher",0,10
at://did:plc:extqxtsoc4q4qnbmwizooppn/app.bsky.feed.post/3mdqztb3xih24,2026-02-01T00:03:04.000Z,#NowPlaying 🕚 11:03 am 🎵 Afterthought 🧑‍🎤 Tame Impala 💿 Deadbeat 🎧 Apple Music / YouTube Music 📝 Lyrics,0,0
at://did:plc:njx4laa4eczn3q4nw7hlqgor/app.bsky.feed.post/3mdr76qs5x22a,2026-02-01T01:40:09.861Z,"Van Houtte and Folgers have some good flavours like Caramel Drizzle, Vanilla Biscotti, Dulce De Leche. Tim Hortons also has some really good flavours under their belt like the Apple Fritter. I take one K cup and brew it twice into one big mug and add 3 Tea Spoons of whitener and sugar. Dash of milk.",0,1
at://did:plc:ysrpowxtyhnwim5y4acq6mmb/app.bsky.feed.post/3mdra2js3wk2b,2026-02-01T01:55:42.042Z,Same. I have been with Apple Music for YEARS. I just wanted to see if anyone thought Spotify was better.,0,1
at://did:plc:si77d3j34kw6agmmm7mfvc5u/app.bsky.feed.post/3mdt7z2mfnc2p,2026-02-01T21:00:12.047Z,Music Review: Organic by Day Dreams | Alternative Album | Stream free | Apple Music | Spotify musicreviews.skunkradiolive.com/2019/08/Musi... #music #streaming #songs #albums #IndependentMusic #SkunkRadioLive #indie #artist #listen #viral #trending,0,1
at://did:plc:j4kiyfmuqbs26sfpm3td2j4h/app.bsky.feed.post/3mdt2j4lbfc23,2026-02-01T19:21:48.518Z,Apple and blackberry crumble for pud tonight. Going in the oven. Overdid the fruit so had to dome the crumble topping to fit it on. Should settle down as the fruit cooks and breaks down. Having it with custard of course #bakesky #foodsky,0,4
at://did:plc:4kbachoi2wqx5a35wd2rlzje/app.bsky.feed.post/3mdtcpeja6224,2026-02-01T21:48:28.113Z,"Watching F1 on apple, great auto racing movies (Days of Thunder, LeMans, Herbie the Love Bug) run about 1:45. Why does this need to be 2:30.",0,1
at://did:plc:34w6p2nygxpqkiqbkrnq56ip/app.bsky.feed.post/3mdtaqg2zbq2y,2026-02-01T21:12:49.000Z,#NowPlaying 🕗 8:12 am 🎵 Bigger 🧑‍🎤 Merpire 💿 MILK POOL 🎧 Apple Music / YouTube Music 📝 Lyrics,0,0
at://did:plc:ib2u7tn2stg42o3q4ipm3ccj/app.bsky.feed.post/3mdtb4zhgic2f,2026-02-01T21:20:18.782Z,"ICE Attacks NOT Accidental “This is no longer just a series of accidents that could have been due to someone being badly trained or being a bad apple. This is a systematic assault on constitutional rights,"" says Walter Olson, a senior fellow with the Cato Institute, a libertarian think tank.",20,32
at://did:plc:nibgsirc4jkdyojyte32wvdd/app.bsky.feed.post/3mdr4amyzlk2e,2026-02-01T00:47:31.774Z,"Can’t read all of it because of the paywall, but what can be read for free is enough really sharingfromisrael.substack.com/p/apple-isra...",0,1
at://did:plc:zk5pjhm2p2t7qyldn4afh2ta/app.bsky.feed.post/3mdrug7ka322e,2026-02-01T08:00:08.788Z,"The buffoon has the backing of Musk, Pichai, Zuckerberg, Bezos, Cook (I mean Tim Apple), and Gates. Not to mention the goonish Thiel. Some reach the top on the shoulders of greats, some on the creepy under-dealings with Oligarchs (I mean devils), and his zombie minion MAGA. 🚬😎",0,1
at://did:plc:rifwvx7xdpbi5vk23uvi7c2k/app.bsky.feed.post/3mdrup7yces2l,2026-02-01T08:05:11.238Z,"It really confounds me that when I plug classic 80s/early 90s punk into Apple Music and let it suggest music as it plays... I am up every five minutes turning Madonna, WHAM, and George Micheal off. They have to be screwing with us.",0,5
at://did:plc:34w6p2nygxpqkiqbkrnq56ip/app.bsky.feed.post/3mdrw2fhclb24,2026-02-01T08:28:32.000Z,#NowPlaying 🕖 7:28 pm 🎵 Are You Gonna Go My Way 🧑‍🎤 Lenny Kravitz 🎧 Apple Music / Spotify / YouTube Music 📝 Lyrics,0,0
at://did:plc:wjljc54nads6ix5tlp4swebe/app.bsky.feed.post/3mdrr2quyxl2u,2026-02-01T07:00:02.999876+00:00,"teckel Web3 API hourly update Eth price (USD): 2416.94 (-0.5% 1 hr, -10.1% 24 hr) Click for API details API keys via App: Apple App Store Google Play Store #teckel #eth",0,0
at://did:plc:25alqpi6ra2svoyghojxyuir/app.bsky.feed.post/3mdre6fanmc2l,2026-02-01T03:09:26.462Z,And then have Apple News call it a comeback. 🙄,0,3
at://did:plc:vletbkzwfadqozjrjuf66pqw/app.bsky.feed.post/3mdrdsuhvlk24,2026-02-01T03:02:59.774Z,I just wrote a @theactionnetwork.bsky.social letter: Tell Apple and Google: Remove Grok from App Stores. Write one here: actionnetwork.org/letters/tell...,1,3
at://did:plc:extqxtsoc4q4qnbmwizooppn/app.bsky.feed.post/3mdrdm6v2hh2k,2026-02-01T02:56:34.000Z,#NowPlaying 🕜 1:56 pm 🎵 Love Me Not 🧑‍🎤 Ravyn Lenae 💿 Bird's Eye 🎧 Apple Music / Spotify / YouTube Music 📝 Lyrics,0,0
at://did:plc:xoglp5pdbddtyi7vnzokltv7/app.bsky.feed.post/3mdro43psec24,2026-02-01T06:07:06.781Z,DARK MORBID (TIL DEATH DO US PART) on APPLE MUSIC. music.apple.com/us/album/dar...,0,0
at://did:plc:extqxtsoc4q4qnbmwizooppn/app.bsky.feed.post/3mdsdvq2cwy2d,2026-02-01T12:36:04.000Z,#NowPlaying 🕦 11:36 pm 🎵 NEW AGE 🧑‍🎤 Sleepazoid 🎧 Apple Music / Spotify / YouTube Music 📝 Lyrics,0,0
at://did:plc:2qse5btpyb44mhysbvko6j4p/app.bsky.feed.post/3mdsemwxrnc2z,2026-02-01T12:50:14.542Z,"Maybe you should consider watching news reels of real concentration camps in NAZI Germany we have arrived,ICE already quit taking people to the doctor or give meds out ,they get one meal a day ,an apple a bologna sandwich with one slice of bread that is it one guy lost fifteen pounds in twenty days",0,0
at://did:plc:e2pdzlrs3z23vjmizjuvk4vv/app.bsky.feed.post/3mdsf2w7fd22d,2026-02-01T12:58:03.509Z,Andrew Scheer’s built like a candy apple with 2 sticks. #canpoli #cdnpoli,0,0
at://did:plc:y4dcsnb6wqrvta5cyzpzmcfa/app.bsky.feed.post/3mdrbpqurws2c,2026-02-01T02:25:27.855Z,"I played Wizardry for the Apple II for the first time this month. 1981. Last night I installed Rogue and played *that* for the first time. 1980. I've been poking at Ultima 4. 1985. All of those games are *over double* the age of Morrowind, and they're *still* fun to play for new players *today*.",4,10
at://did:plc:rmfkpkb74f2n63ikkorglz5e/app.bsky.feed.post/3mdrm26fnwk25,2026-02-01T05:30:14.996Z,It’s been fine on desktop and Apple TV for me. Mobile’s always been a bit of a shit show.,0,0
at://did:plc:3lyznxzrddyvxmtyidg6ojsk/app.bsky.feed.post/3mdr5snrk5s2j,2026-02-01T01:15:30.300Z,"Ahahaha I wouldn’t use Linux for my daily driver either. I really like Apple stuff. I just rebuilt my old desktop because I don’t need Windows anymore, and even running “idiot-proof” Ubuntu it’s currently having issues. The latest kernel is not playing nice with the Nvidia drivers. No thank you.",0,2
at://did:plc:xmg2hakqrqicmylrem5e4t7i/app.bsky.feed.post/3mdrn7tttxc26,2026-02-01T05:51:18.962Z,why is the apple with a face in Metropolis (2001),0,0
at://did:plc:fgz64kxwqv57ejmk465iuqyw/app.bsky.feed.post/3mds6es3ow22v,2026-02-01T10:58:18.533Z,"Don’t forget to pre-save Arirang on Spotify, Apple and all music platforms. It’s free to do this and has a big impact. It helps artists show demand and increase their visibility on release day. It makes it more likely that the songs will be pushed into curated playlists. Let’s push for BTS 💜",2,2
at://did:plc:mhpd6kda2lrkbecap3ncmtcz/app.bsky.feed.post/3mdsq3fn7yk2m,2026-02-01T16:15:10.849Z,Some big changes are coming to Galaxy's Edge in Disneyland! How could this news impact Florida? Cassie Tucker from Marketing Happy Hour joins the show to process our feelings about this change. Apple: tinyurl.com/3brhx2yy Spotify: tinyurl.com/3zryje5c #Disney #StarWars,0,0
at://did:plc:gpsbv452ncyl7xe6g3yulkvn/app.bsky.feed.post/3mdspt6h2a22s,2026-02-01T16:10:34.868Z,"Apple, tree. www.theguardian.com/us-news/2025...",7,20
at://did:plc:kabp3awonwmauvvdxed5gmlu/app.bsky.feed.post/3mdszm34ewk2u,2026-02-01T19:05:33.915Z,i’ll be real the big thing i want right now is just for puzzle pop to be ported off of apple arcade. it’s the only game on there i’m interested in so it’s hard for me to justify paying a monthly sub for a single game.,0,5
at://did:plc:k4ve2amrop3ji2mouqg3jcap/app.bsky.feed.post/3mdsxgugb6k25,2026-02-01T18:26:51.635Z,That was so damn good.,0,4
at://did:plc:jgnauyexxyeoqvoeauwvojdw/app.bsky.feed.post/3mdsxtw6f442b,2026-02-01T18:34:09.384Z,⚡ Hackernews Top story: Apple: Our philosophy is to provide software for our machines free (1976),0,0
at://did:plc:brwww2is5xf7ufyjij2eecp7/app.bsky.feed.post/3mdsvirqxi22v,2026-02-01T17:52:08.471Z,Wondrous little gadget that looks like a smiley face that you pin to yourself that has high def cameras and uses AI that’s being pushed out by Apple and Google together. It will take pictures and video of every place and person you see. It will use facial recognition. DO NOT FUCKING BUY THIS.,27,68
at://did:plc:6b374aolufn6nmyaghdy5vov/app.bsky.feed.post/3mdtjqmqxgc2p,2026-02-01T23:54:26.498Z,jfc this is such a racket. here’s $8 kid. you’ve been made whole.,0,1
at://did:plc:34w6p2nygxpqkiqbkrnq56ip/app.bsky.feed.post/3mdt427g6cn22,2026-02-01T19:48:14.000Z,#NowPlaying 🕡 6:48 am 🎵 Soul Meets Body 🧑‍🎤 Death Cab For Cutie 💿 Plans 🎧 Apple Music / Spotify / YouTube Music 📝 Lyrics,0,0
at://did:plc:ilf7nq74d7wlzcvwmdpezcv3/app.bsky.feed.post/3mdt4z3ftlc2m,2026-02-01T20:06:31.653Z,"Yeah, it's a pretty cool platformer, especially considering it's from 1984 and what the Apple II had for hardware.",0,0
at://did:plc:3iv25vrb3c3qtwl3h5fnjr67/app.bsky.feed.post/3mdr2u2hfis2n,2026-02-01T00:22:35.920Z,Cucks don’t get this. Serving this is your life while alpha serves me. 👸🏼🤴🫰🏻 Send more always. #findom #fincuck $Aly123janel CA @payaly8 Venmo Apple Pay You owe us. Start with payments for dinner. $40 👏🏻👏🏻🫵🏻🔒,0,0
at://did:plc:m46dz3azywhamvrd6kuplk3m/app.bsky.feed.post/3mdr33iiwak26,2026-02-01T00:26:45.531Z,"I'm continue to stand with those expressing their justified outrage and first amendment rights. We need to not fund more training for ICE, but to dismantle them. They never seem to remember it's one bad apple SPOILS THE WHOLE BUNCH.",2,1
at://did:plc:extqxtsoc4q4qnbmwizooppn/app.bsky.feed.post/3mdtcqsc4k42r,2026-02-01T21:48:25.000Z,#NowPlaying 🕣 8:48 am 🎵 you're a star 🧑‍🎤 Fred again.. & Amyl and The Sniffers 🎧 Apple Music,0,0
at://did:plc:qyaovq6ygfbl7wo2viv2lu6n/app.bsky.feed.post/3mdtegvvo2s2o,2026-02-01T22:19:31.840Z,"Following up on this soon, but in the interim... I'm making three smaller cakes again this time. An order was placed for an ""apple pie filled"" King Cake, which is going to use some Trefoils in the filling as ""pie crust"" The other two will be what it says on the box - Thin Mint, and Adventurefuls",0,1
at://did:plc:epyb7ogojrgktecvvmgphwum/app.bsky.feed.post/3mdszioix2s2s,2026-02-01T19:03:40.029Z,If Apple wanted to juice sales it could bring back a line of phones with 3.5mm jacks and print money,0,0
at://did:plc:extqxtsoc4q4qnbmwizooppn/app.bsky.feed.post/3mdt7j47ut72y,2026-02-01T20:50:34.000Z,#NowPlaying 🕢 7:50 am 🎵 Tell Me Why 🧑‍🎤 Velvet Trip 💿 Glimmers Continued 🌱 Triple J Unearthed 🎧 Apple Music / Spotify / YouTube Music 📝 Lyrics,0,0
at://did:plc:wlb5rgvehyoz3yljdhdowayx/app.bsky.feed.post/3mdsodypqcs2u,2026-02-01T15:44:11.803Z,"Hey @support.bsky.team When I take a screen dump of a photo, I used to be able to transfer direct to your posts. Following Apple Upgrade I can no longer do this. Now I have to save to photos, then start a new post?",0,0
at://did:plc:34w6p2nygxpqkiqbkrnq56ip/app.bsky.feed.post/3mdt2jwxe7e2w,2026-02-01T19:21:03.000Z,#NowPlaying 🕕 6:21 am 🎵 California Soul (Diplo/Mad Decent Remix) 🧑‍🎤 Marlena Shaw 💿 Verve Remixed Volume 4 🎧 Apple Music 📝 Lyrics,0,0
at://did:plc:prdqnd447ab5y5cjfpm6nnz5/app.bsky.feed.post/3mdroe23xpk2r,2026-02-01T06:11:33.513Z,Curious if they’ll do the same thing again where it’s on Apple Arcade for awhile and then ported to other systems.,0,1
at://did:plc:34w6p2nygxpqkiqbkrnq56ip/app.bsky.feed.post/3mdro7ymrm72e,2026-02-01T06:08:22.000Z,#NowPlaying 🕔 5:08 pm 🎵 PEACEKEEPER 🧑‍🎤 Baker Boy 💿 DJANDJAY 🎧 Apple Music / Spotify / YouTube Music 📝 Lyrics,1,1
at://did:plc:52qmk3dhfrsmkytpdpcllv3u/app.bsky.feed.post/3mdrpwhlfrc2m,2026-02-01T06:39:45.378Z,hey apple! What?! *The best music you ever heared plays*,0,0
at://did:plc:3iv25vrb3c3qtwl3h5fnjr67/app.bsky.feed.post/3mdr2u2hfis2n,2026-02-01T00:22:35.920Z,Cucks don’t get this. Serving this is your life while alpha serves me. 👸🏼🤴🫰🏻 Send more always. #findom #fincuck $Aly123janel CA @payaly8 Venmo Apple Pay You owe us. Start with payments for dinner. $40 👏🏻👏🏻🫵🏻🔒,0,0
at://did:plc:m46dz3azywhamvrd6kuplk3m/app.bsky.feed.post/3mdr33iiwak26,2026-02-01T00:26:45.531Z,"I'm continue to stand with those expressing their justified outrage and first amendment rights. We need to not fund more training for ICE, but to dismantle them. They never seem to remember it's one bad apple SPOILS THE WHOLE BUNCH.",2,1
at://did:plc:iuzoriplc2blxdv2namkfbtm/app.bsky.feed.post/3mdr4se4mak23,2026-02-01T00:57:26.434Z,Sell off Apple and Microsft Stock...,0,1
at://did:plc:34w6p2nygxpqkiqbkrnq56ip/app.bsky.feed.post/3mdr54ujqjo2e,2026-02-01T01:02:37.000Z,#NowPlaying 🕛 12:02 pm 🎵 Starry Picking Night 🧑‍🎤 Clare Bowditch & The Feeding Set 💿 What Was Left 🎧 Apple Music / YouTube Music,0,0
at://did:plc:34w6p2nygxpqkiqbkrnq56ip/app.bsky.feed.post/3mdr6otwsat2l,2026-02-01T01:30:35.000Z,#NowPlaying 🕜 12:30 pm 🎵 Strange Questions 🧑‍🎤 Clare Bowditch & The Feeding Set 💿 What Was Left 🎧 Apple Music / YouTube Music,0,0
at://did:plc:u5xvg6bgu4t5qjdnidl6yc7l/app.bsky.feed.post/3mdrh7a34tc2t,2026-02-01T04:03:35.813Z,I didn't even know I wanted the Ability until Apple revealed it on their next eye phone,0,1
at://did:plc:ibkbpjz35e6jhmoicg5kgscl/app.bsky.feed.post/3mdrhk7a7qk2b,2026-02-01T04:09:44.024Z,oh damn the (apparently only model compatible with my ipad) apple pencil has gone down in price that much?,0,0
at://did:plc:cj4pyji75batt623ebsmqlls/app.bsky.feed.post/3mdsetrhd522s,2026-02-01T12:54:03.642Z,"Gala the Hound!! I love apple dog so much, great to see fanart of her 😊",0,2
at://did:plc:hhppmesri3tkymh4ryt3gwfv/app.bsky.feed.post/3mds7ngqpxk23,2026-02-01T11:21:02.382Z,***NEW EPISODE*** We break down the Mission Impossible franchise and rank them worst to best! Links below: Spotify: bit.ly/SMPSpotify Apple Podcasts: bit.ly/SMPApple YouTube: www.youtube.com/@thescreenma... Also on all other Podcast platforms!,0,0
at://did:plc:nqn5hbh7dqi6iacubmgfbgoy/app.bsky.feed.post/3mdsog4qz622d,2026-02-01T15:45:23.149Z,A weekend tradition 🥞 vegan oat pancakes with strawberry/blueberry sauce and coconut flakes ♥️ Pancake recipe: www.seiskamimura.com/home/apple-p... #veganfood #vegan #plantbased,1,20
