ID_Tweet,Fecha_UTC,Contenido_Texto,Retweets,Favoritos
at://did:plc:67pmln5vjuciyf6fgxbb7wzu/app.bsky.feed.post/3mldusp7opk2o,2026-05-08T13:51:24.558Z,"New Top Five Tech is out! Watch on Apple Podcasts or Spotify, listen anywhere, and sign up for the newsletter version every Friday 📰 This week features @fryrsquared.bsky.social @hankgreen.bsky.social @acquiredfm.bsky.social @ismh86.net and @adamlisagor.com podcasts.apple.com/us/podcast/t...",1,6
at://did:plc:hg2mvfochotdqj4s7d3raz3m/app.bsky.feed.post/3mlebekpeus2h,2026-05-08T17:36:08.705Z,🚨 NEW POD OUT 🚨 🎧 180 | Three Games to the Title - West Ham Next 🔴 Still riding the UCL high ⚪️ Focus snaps back to the league 🔴 3 wins = Champions ⚪️ West Ham preview & Hammers fan insight 👇 Listen here: 🍎 Apple tinyurl.com/TGPAPP1 🟢 Spotify tinyurl.com/TGPSP1 #arsenal #coyg #gunners #epl #whuars,2,3
at://did:plc:7i7d6tdvhda267fhadwjsqli/app.bsky.feed.post/3mldortkrbk2x,2026-05-08T12:03:33.103Z,This beautiful male Baltimore Oriole fits the #birdoftheday theme of #photogenicbirds. #BeautyInNature #birds fineartamerica.com/featured/bal...,6,33
at://did:plc:aqor3inkvazmcvon3dilxu46/app.bsky.feed.post/3mleah7seh22h,2026-05-08T17:19:33.416Z,"Mix 3tbsp soft brown sugar, 3tbsp water, 2tbsp cider vinegar, 1.5tbsp white miso Fry 2 seasoned pork chops in sunflower oil to golden & cooked, remove, wipe pan clean Fry 1 peeled, sliced Granny Smith apple in 10g butter, 3-4 min Add miso mix, reduce to 'saucy' Add cooked pork chops, warm, serve",0,6
at://did:web:fry69.dev/app.bsky.feed.post/3mldeojpb4k2l,2026-05-08T09:02:44.691Z,"If have access to a recent Apple Silicon system with at least 128GB RAM, I can highly recommend to try this DeepSeek Flash 4 model runner out. The description in the README is not lie: It absolutely feels like a frontier model and produces significant better results than e.g. Qwen 3.6 or Gemma 4",7,63
at://did:plc:s5y3aimo5hxqiqz2o6zslcyn/app.bsky.feed.post/3mle4doapfc2k,2026-05-08T16:06:10.162Z,Unbidden and probably unwelcome (sorry) I have a very simple slaw. Peel and grate three carrots and do the same for two Granny Smith’s. Slather on some white wine vinegar and sea salt and mix before apple turns brown. It’s extremely good!,0,4
at://did:plc:fhygqbgfuczt453edoc7efqb/app.bsky.feed.post/3mldaxqi26z2p,2026-05-08T07:56:18.676Z,you are the apple of my eye #joongdok #kimdokja #yoojoonghyuk #orv #omniscientreaderviewpoint,7,17
at://did:plc:htw4iaeofjq3pyx72txceiyz/app.bsky.feed.post/3mlcyaod7gk2d,2026-05-08T05:20:14.857Z,I finally made it to the big apple,0,102
at://did:plc:4mh7i5j6fyvwbzs3ftskbj64/app.bsky.feed.post/3mldt5ppans2c,2026-05-08T13:21:46.679Z,Me when I’m toasting a bagel,0,5
at://did:plc:tlltsh4aclzjsrvdqvkhi7m2/app.bsky.feed.post/3mle4245bc22u,2026-05-08T16:00:49.184Z,Not even slightly. We're talking about Apple here mainly.,0,1
at://did:plc:436e3rnaeryahfjtx3o6wtio/app.bsky.feed.post/3mldtajgaq223,2026-05-08T13:23:20.725Z,There's something about the timing of when I became aware of this album that makes me think of the employee breakroom that used to be under the Viking Voyager at Worlds of Fun in the mid 90s (complimentary) every time I hear any song from Throwing Copper.,0,10
at://did:plc:muhesxre7yfcuqi5ss2fskjc/app.bsky.feed.post/3mlef6zhtdc22,2026-05-08T18:44:37.828Z,"Every time I submit an app I have to answer these, and I have Questions. Is the third one just a trap door for idiots? In theory, Apple does not allow prolonged, graphic sadism.",0,10
at://did:plc:q5rffmzfa5va6lsekgkalzrv/app.bsky.feed.post/3mle6urtsyk24,2026-05-08T16:51:31.812Z,"""a side view of bitten apple with green leaf stem on a wooden table with an art mural of apple orchard across background"" - made with @NightCafeStudio creator.nightcafe.studio/creation/hWH... #aiart #nightcafe #digitalart creator.nightcafe.studio/creation/hWH...",0,3
at://did:plc:ziylwp65rqton4s5lth74rxr/app.bsky.feed.post/3mldpe7nfks2w,2026-05-08T12:13:49.759Z,"Enter the Woodland Realm has been out for one week! Thank you to everyone who has listened and supported in any and all ways! Apple Music users, thank you for a strong first week! 2,500 streams!",4,20
at://did:plc:vkrkhgjtqjm6uh725j7mfjjt/app.bsky.feed.post/3mldx4z23c22j,2026-05-08T14:32:57.889Z,*runs to Apple Music*,0,2
at://did:plc:subf65oaajfgga5cfkunenai/app.bsky.feed.post/3mlecmaeipk2z,2026-05-08T17:58:20.046Z,"My grip strength goes out from time to time. There are moments when I can’t cut my food up or I have dropped, breaking my apple pencil from it coming on suddenly. This has been my most productive year because I work to adapt. I want to create.",0,3
at://did:plc:54h2daa3xiajcygoz6s4c3tt/app.bsky.feed.post/3mlel3na5ik2u,2026-05-08T20:30:06.786Z,"Humanity has colonized the solar system, but only because the Belt- and those who live there- always provides… @ginikoch.bsky.social Amazon: www.amazon.com/dp/B0FH42WZFP B&N: www.barnesandnoble.com/w/the-belter... Apple: books.apple.com/us/book/the-... Kobo: www.kobo.com/se/en/ebook/...",1,2
at://did:plc:na25lmff4skzukkgb3ea72p7/app.bsky.feed.post/3mldvi3uduc2e,2026-05-08T14:03:22.422Z,"Revamping our website, and looking at this now... if someone said to us 5 years ago we'd be given *one* of those awards/titles, and get coverage in some of that media, we'd have signed in a second! It's been quite a journey so far.",0,3
at://did:plc:zllivtyoyqde3ugqvznbafn5/app.bsky.feed.post/3mlep525las2w,2026-05-08T21:42:28.853Z,To do Friday: 👗 Laundry 🎥 Cancel Streamyard ☎️ Call Costco To do Saturday: 🗑️ Trash 🚜 Farmer's market 🏦 Bank 🚙 Walmart & FedEx 🍁 Granola 🧆 Protein balls 🍋 Lemonade To do Sunday: 🪴 Construct planter 🍅 Shakshuka 🍎 Apple Cinnamon oatmeal 🔥 Roasted summer squash 🐓 Chicken salad,0,3
at://did:plc:aunpu65mdrhwfie7ynymlzeh/app.bsky.feed.post/3mld5uzx5qo2c,2026-05-08T07:01:06.600Z,"Watch the full episode of the Bulwark Podcast at The Bulwark and YouTube, or listen on Apple Podcasts, Spotify or wherever you get your podcasts: lnk.thebulwark.com/49COPa3?utm_...",4,27
at://did:plc:a6a4rmjgwi7fe2mjegsayylg/app.bsky.feed.post/3mle5upkm2c2m,2026-05-08T16:33:35.702Z,"both using Apple TV, so not sure if that was the common thread there",0,1
at://did:plc:nf2spzgcawdoaxoam43p77ww/app.bsky.feed.post/3mldg3bddh22n,2026-05-08T09:27:45.856Z,I bought this apple in Liverpool and took it home after the weekend. I took it to work everyday but forgot about it. Now I ate it in London. The tale of a well traveled apple. 😅,0,8
at://did:plc:uxtlyzf2cmuxj2mg5nqufg3d/app.bsky.feed.post/3mlejy2brcs2p,2026-05-08T20:10:12.512Z,"I have a secret indulgence involving Jasper Fforde novels, blackberry and apple pie with Cornish ice cream on top, snuggled down with clean pyjamas and a dressing gown still warm from the tumble dryer. And possibly a puppy.",0,2
at://did:plc:hzmfzxy6ob3mtovjkxurpuif/app.bsky.feed.post/3mlea272r6s2v,2026-05-08T17:12:27.214Z,Streaming-wise: Israeli thriller #Unconditional arrives on Apple TV+. Norwegian drama #Ammo drops on Channel 4 streaming #telly,1,1
at://did:plc:54h2daa3xiajcygoz6s4c3tt/app.bsky.feed.post/3mlekr5xzos2u,2026-05-08T20:24:15.242Z,"Watch fire fly as two sorcerers get into a fight over a djinn, who’s smarter than both of them combined. @jeanmarieward.bsky.social Amazon: www.amazon.com/Burning-Down... B&N: www.barnesandnoble.com/w/burning-do... Apple: books.apple.com/us/book/burn... Kobo: www.kobo.com/us/en/ebook/...",0,2
at://did:plc:hdteqknauip5kk5lhbmguhep/app.bsky.feed.post/3mle4due6bk2r,2026-05-08T16:06:16.565Z,"got a free trial of apple music with my ipad, ended up cancelling it today because it was days from renewing and actually costing me money. never got around to actually using it. oh well",0,4
at://did:plc:7tuu5sc7pqvjgy2xddkqiwmn/app.bsky.feed.post/3mldvdiacw22g,2026-05-08T14:00:47.665Z,slice of cheese on your apple pie < slice of cheese on your apple curry,0,1
at://did:plc:hvk547jjfnm4wxcafpkpw6kz/app.bsky.feed.post/3mleihhaylk2t,2026-05-08T19:43:01.928Z,What in the white people's food...,0,0
at://did:plc:kol7hi4iy7ynuoe2jmkrqzfn/app.bsky.feed.post/3mlcy7lbivk2g,2026-05-08T05:19:38.110Z,#AppleJack #MLPxHH #MLPxHB An Apple Float .u.,50,196
at://did:plc:bnokmh46ndqelhgwhbspsxnv/app.bsky.feed.post/3mldrkigdks2m,2026-05-08T12:53:07.775Z,"BEAST (2026) Streaming Now VOD/Digital – Sale/Rental (Apple, Amazon, Fandango at Home, etc.) #BeastMovie",0,2
at://did:plc:5ydaimsrmmp72krjgwoyrbzh/app.bsky.feed.post/3mldfwkvcmk2b,2026-05-08T09:25:08.115Z,ryne would love apple by charli xcx,0,6
at://did:plc:5iw4wynovjp54ah7krqqhsfo/app.bsky.feed.post/3mldvi3mczk2h,2026-05-08T14:03:22.199Z,The day Apple releases a emoji for a bag of chips not it just being a sticker is gonna change the game,0,2
at://did:plc:ethwjcyvydn7d3vupty37nrc/app.bsky.feed.post/3mleno4yiq22o,2026-05-08T21:16:14.776Z,"It definitely was part of a release, but I think it was box-only. It’s not on paid Apple Music like “official releases” are. Would make sense if the GD/Nugs streaming service had all of the limited edition extras/box releases. Makes me wonder about the Dave’s bonus discs too.",0,1
at://did:plc:m442finejn64oymkuwfd47ji/app.bsky.feed.post/3mlebfnai5s2h,2026-05-08T17:36:44.924Z,Maybe…Settings>Apple Intelligence & Siri>Voice Then pick an accent & gender that appeals to you (Mine is set to Australian Voice 1),0,1
at://did:plc:tpg3qzw3niphci6ne5wdprfr/app.bsky.feed.post/3mlcs4mrdfs2s,2026-05-08T03:30:36.566Z,"Yesterday’s watercolor lesson was an apple but I wasn’t happy with my results, so I obtained a reference Still not perfect but I think I did pretty well",5,124
at://did:plc:szqhu252ws45ohmusjfltkov/app.bsky.feed.post/3mldw3nftgk2o,2026-05-08T14:14:18.395Z,apple lover twin genuinely going insane,0,1
at://did:plc:6dqsvb33dukqd6s7djzavw3j/app.bsky.feed.post/3mle6p6mips2z,2026-05-08T16:48:23.907Z,"You can do an image-listening to the pod on #Youtube or you can listen to the pod on #Spotify or Apple Podcasts🩵 Whatever way you choose, please enjoy this week's episode: ☁️Put Shungite On It All☁️ youtube.com/watch?v=AU3s...",1,2
at://did:plc:4g22pr2j72tnfyjaf6bdj2jh/app.bsky.feed.post/3mldjcbee6223,2026-05-08T10:25:21.999Z,🔥NEW WAY TO DONATE🔥 🍏Apple Pay 🤖Google Pay 💳Credit card Now you can test this! This way take ~12% commission from donations. donatello.to/DrobotunV,7,10
at://did:plc:jgtc2hed6axlkts3oh22fp4r/app.bsky.feed.post/3mldu67vby22j,2026-05-08T13:39:57.401Z,あたらしいimacを購入しました。設定に手間取る。appleアカウント、何故か毎回うまくログインできずに苦戦している。,0,4
at://did:plc:hwfd3nmic3e4y4mz74pl6qfj/app.bsky.feed.post/3mlcifts72s2i,2026-05-08T00:36:48.509Z,"In 2000, Palm was worth more than Apple, Nvidia, Amazon & Starbucks combined.",25,114
at://did:plc:2si3soj5w3vadgb4w7giu4oi/app.bsky.feed.post/3mle43ez3us23,2026-05-08T16:01:32.039Z,"reading apple news like: - ""you can now talk to grok in your car 😆"" - ""apple will have to hike prices to manufacture more of its runaway success low-cost laptop because AI companies are taking all the chips""",0,3
at://did:plc:2ap5ay6k4msyyalnfochdfto/app.bsky.feed.post/3mle5ddaj2k2s,2026-05-08T16:23:52.362Z,🎙️ #NFFC face a big test as they look to bounce back from the pain of the Villa game. @mattdaviesff.bsky.social is joined by @mikeyclarke22.bsky.social and Reds legend Garry Birtles to preview the Newcastle game. 🍎 Apple podcasts: tinyurl.com/5ae4tx5h 📱 YouTube: tinyurl.com/2r7ennnf,1,5
at://did:plc:lgnf3qp7ym4y7c47gtxhxirf/app.bsky.feed.post/3mleaad7ues23,2026-05-08T17:15:52.818Z,"*New* #Collage for #Peace 👉🇺🇦🇵🇸🇮🇷👈 The apple trees does not need the fruit that it produces. Yet, it gives the entirety of its life over to producing it for those who do. And I often wonder what would happen if we were more like a tree. Craig D. Lounsbrough",0,2
at://did:plc:hybysygij3pgzlwj4aqxs4ef/app.bsky.feed.post/3mle4jmmzik2b,2026-05-08T16:09:29.794Z,"Did I mention that Stephan Jacob and I have a new podcast-episode? We talk about the DCP of course, but there´s also the subject ob Bananenweizen coming up. So listen in! On Spotify (open.spotify.com/show/5hX7qk1...), Apple (podcasts.apple.com/us/podcast/j...) and YouTube. youtu.be/fz6XFFsO9l0",0,2
at://did:plc:54h2daa3xiajcygoz6s4c3tt/app.bsky.feed.post/3mldsrhr7wk2u,2026-05-08T13:14:55.696Z,A risky gamble turns deadly when the galaxy’s most feared terrorist arrives to up the ante. @ginikoch.bsky.social Amazon: www.amazon.com/dp/B0F2974FPG B&N: www.barnesandnoble.com/w/three-card... Apple: books.apple.com/us/book/thre... Kobo: www.kobo.com/us/en/ebook/...,1,3
at://did:plc:73h36hf5azfsj2uohkxxxm22/app.bsky.feed.post/3mle3y5qfus24,2026-05-08T15:59:43.751Z,Lmfao that song came up on my Apple Music autoplay and I blackholed it from my memory 😂😭,0,1
at://did:plc:3cjdxth2gl5fh7jearuewu5u/app.bsky.feed.post/3mld7frrzfk2i,2026-05-08T07:28:22.466Z,Wanted to draw my persona again ^0^ -inspired by the apple man[i forgot the name XD] [ #artshare #artmoots #artsky #digitalart #illustration #furryart #ocart #art #drawing #oc #furry #persona #demon #demonoc ],1,33
at://did:plc:qpymhylagd2kom34rwcffugk/app.bsky.feed.post/3mlejqbzpe22y,2026-05-08T20:05:52.201Z,"i wish RCS was more widely adopted. Apple added support for it but barely any countries outside the US support it, and the only way to use it on Android is Google Messages, probably cause the most common one is Google's version (from what i've heard) unrelated to the current outage",0,3
at://did:plc:iqg2yiw23eoox7krkdbpucqo/app.bsky.feed.post/3mldyjaro522x,2026-05-08T14:57:42.397Z,Were you able to locate something? I have an Apple phone and run Safari,0,2
at://did:plc:o7oo4zhkpnszst3psyb3gjde/app.bsky.feed.post/3mldtj3tvgc2m,2026-05-08T13:28:08.518Z,"i get ""blacking out the friction"" by death cab in my head *all the time* so i went to pop it on apple music with my coffee if you had told me in 2001 that that band would be SO long lived and prolific, i woulda called you a damn liar",0,5
at://did:plc:vhtgu4qhc6gwbyzwkk2r4ok4/app.bsky.feed.post/3mldmdxoevc27,2026-05-08T11:20:00.178Z,ate some good dumples and continued watching Canadian zombie series From (Apple TV). Familiar set-up but a pretty good series thus far. Dumples excellent,0,3
at://did:plc:qldbkwfjpytkgb6qpswyeijn/app.bsky.feed.post/3mldlvy327k2o,2026-05-08T11:12:10.831Z,"#ArtistFave15 #MusicChallenge #MusicSky Artist: Blind Pilot 8 of 15 (unranked): ""White Apple"" youtu.be/LBRiaig2J3w?...",0,12
at://did:plc:oxzwtr2olpzk75d5ro572dxz/app.bsky.feed.post/3mldqbfgius2g,2026-05-08T12:30:08.904Z,A fountain Dt. Coke at breakfast because it means I'm on vacation. Fresh apple cider at an orchard on a fall day.,0,3
at://did:plc:rkq5wgc2p5fgtcyxm6hh7e6s/app.bsky.feed.post/3mlekhg2em222,2026-05-08T20:18:48.168Z,"My right wing Florida sister thought she should try it to treat her uterine cancer. Instead of the chemotherapy. I suggested she get a big tube of the apple flavored stuff and shoot it up there. As far as I know, she changed her mind. She started chemo this week. And won’t discuss it with me.",0,1
at://did:plc:aunpu65mdrhwfie7ynymlzeh/app.bsky.feed.post/3mlcx5rza2i2n,2026-05-08T05:00:44.054Z,"Watch the full episode of Bulwark Takes at The Bulwark and YouTube, or listen on Apple Podcasts, Spotify or wherever you get your podcasts: lnk.thebulwark.com/4tRCYNw?utm_...",3,33
at://did:plc:v4w3oaw2vol7lbppno5356lx/app.bsky.feed.post/3mlcw4tnb7c2t,2026-05-08T04:42:18.745Z,YAY !!! Today if #Flyday !!! And I edited all my pictures. The blossom is from an Elstar apple tree. #Macro #Insects #Nature #Photography #ECK,7,68
at://did:plc:7keeiuhmqfxim42c6tibwvzw/app.bsky.feed.post/3mlckqi3u5s2a,2026-05-08T01:18:32.823Z,keystone light's long-signaled bapple dupe arrives with an absolutely juiceless ai slop campaign,3,48
at://did:plc:paire2qhzl3ny7xeww772gqz/app.bsky.feed.post/3mleerpzadk2z,2026-05-08T18:37:11.711Z,"Reports about Apple and Intel making a chipmaking deal are trickling out now. I told you guys about this OVER A YEAR AGO. It isn't just starting now, it has been in the works for at least 14 months that I know of, possibly longer.",1,6
at://did:plc:oniwxkc3r3tpgfsf7fdviefd/app.bsky.feed.post/3mlcnyn7enk2y,2026-05-08T02:16:47.844Z,🔴 I'm live and stressed and stuff (its apple juice),0,23
at://did:plc:zmyojuqcrpeey3mu2thsgq5u/app.bsky.feed.post/3mldudnsxk225,2026-05-08T13:42:59.777Z,ITS LITERALLY AN APPLE KNIFE I DONT KNOW 😭😭😭😭,0,1
at://did:plc:chdqoryoemzyx7rqm36fbb36/app.bsky.feed.post/3mldjee5yhk2u,2026-05-08T10:26:32.047Z,"When I finally add Apple TV, I bet ""Ted Lasso"" will rope me in.",0,2
at://did:plc:zsyet622yg22uzy7br5zyltl/app.bsky.feed.post/3mlclmddqus24,2026-05-08T01:34:07.363Z,"Fat Horse No. 2 It’s the year of the horse and I’ve always been a horse girl at heart, so I’m finally taking advantage of the excuse to fill the world with fat little horses! These felted friends are about the size (and shape!) of an apple",217,556
at://did:plc:nxmjxl2wiyat43p3gikkt37w/app.bsky.feed.post/3mldntuf5wj2e,2026-05-08T11:46:46+00:00,"Financial analysts at Wedbush have consistently been bullish about Apple, but now has raised its target price by a whopping $50 to $400, making its greatest jump in at least the last five years.",0,4
at://did:plc:dl46hx5dz4f2rckjur7bdngj/app.bsky.feed.post/3mled2jjbsk2l,2026-05-08T18:06:19.401Z,Apple the Fruit. True. An approved antibiotic for the treatment of streptococcus infection is Amoxycillin. True. Magical Oysters. False. Research has indicated the existence of dark matter. True. Most people believe in a plane of existence beyond ours. True. Goldfish are land dwelling. False.,0,1
at://did:plc:4rclsh2ky5jthblpor3lap7e/app.bsky.feed.post/3mle3lx5trk2n,2026-05-08T15:52:54.199Z,"Ohhh… I don’t have Apple devices 😓 Except for an old iPad 1 that’s begging to be retired. I'll have to find an alternative, thanks! 😊🖤",0,2
at://did:plc:ukinlnsebtgrholzfkmqvfll/app.bsky.feed.post/3mld57skfvs2k,2026-05-08T06:49:14.450Z,Listening on apple music rn and yeah,1,3
at://did:plc:fgpczj6qqmrddlqxsnq7hwle/app.bsky.feed.post/3mldrdxjz4s25,2026-05-08T12:49:28.740Z,"During our trip, I decided to cash in on a small investment (which I did state I would make): Meet my new iPad Mini!",0,4
at://did:plc:6or7zhqqssmxoedqn7ykaus5/app.bsky.feed.post/3mlegu2dpz22z,2026-05-08T19:14:17.133Z,"(well plus you might know this but most apple trees are grafts, so that tree i have is cox grafted onto M.9 rootstock to dwarf it because i don't have room for full size fruit trees. so it's a clone of a 200ish year old top half grafted onto a clone of a 100ish year old bottom half",0,2
at://did:plc:ithdaiohqksjghrfa455mol4/app.bsky.feed.post/3mldtq5hsjs2o,2026-05-08T13:32:05.099Z,Havung an apple seed like pattern on the horns is such a cool detail,0,2
at://did:plc:5ifd5xeo5nfg3zdcjtbwvs4i/app.bsky.feed.post/3mle3erkw7k2p,2026-05-08T15:48:53.450Z,Went to update my apps and got hit in the forehead with this arresting image:,0,3
at://did:plc:pxwnibflohvprne5qrjthokl/app.bsky.feed.post/3mldu6rcver25,2026-05-08T13:40:15.563032+00:00,"Apple is fighting Canadian Bill C-22, fearing it could be forced to create ""backdoors"" into encrypted user data. The company states this would undermine user privacy and security, asserting it will ""never weaken encryption."" #Apple #Privacy #Encryption #Canada",0,1
at://did:plc:lp6n2gonsc5e5qo337vxzo2d/app.bsky.feed.post/3mldpulqyxs2o,2026-05-08T12:22:59.332Z,apple photos making my eyebrows disappear since the beginning of time,0,2
at://did:plc:54h2daa3xiajcygoz6s4c3tt/app.bsky.feed.post/3mldso7bums2u,2026-05-08T13:13:06.150Z,The long-awaited book 17 of the alien series by Gini Koch is available now! Get your copy today! @ginikoch.bsky.social Amazon: www.amazon.com/dp/B0G62KZGLC B&N: www.barnesandnoble.com/w/aliens-lik... Apple: books.apple.com/us/book/alie... Kobo: www.kobo.com/us/en/ebook/...,1,3
at://did:plc:suht32psdas3fbxwb6gzksyo/app.bsky.feed.post/3mlcqaeozpc2g,2026-05-08T02:56:54.827Z,#AnimalCrossing #FireEmblem #Nintendo PayPal Commission for @plantedwave5190.bsky.social He wants me to make Isabelle giving an apple to Byleth to celebrate Teacher Appreciation Week,14,32
at://did:plc:4yfp66aoi4odnwqexpymn3yj/app.bsky.feed.post/3mldrap5ois27,2026-05-08T12:47:39.281Z,"Skip MacDonald, ACE, Chris McCaleb, ACE, and Joey Liew join us to discuss their work on Apple TV drama, Pluribus. Wed 13 May 7.30pm BST The event is open to BFE members only. Social media sponsor: @envypost.bsky.social",1,2
at://did:plc:ebm4zblojs2vewc5455ntav2/app.bsky.feed.post/3mlckvqdv7s2w,2026-05-08T01:21:29.251Z,Just dropping in to say Widow’s Bay on Apple TV is so insanely good.,0,24
at://did:plc:a3i5mx544ry5kpdsxbfzfd6w/app.bsky.feed.post/3mlcttx3my22t,2026-05-08T04:01:32.888Z,#art #photography #minimalism #round,0,36
at://did:plc:iflloehmkkhj7sza2lkucjc3/app.bsky.feed.post/3mleckk3rjc2e,2026-05-08T17:57:23.137Z,Ok so my students asked me who are some of my favorite artists for music during our lunch period. Big question. They said when you play a playlist who comes up first I went to my Apple Music radio and *NSYNC’s POP came on. I said *NSYNC was my first concert Girl asked me “is that a band?”,0,3
at://did:plc:hszzpxqpvzpvbdufmpltkfsk/app.bsky.feed.post/3mle5yhgsau2l,2026-05-08T16:35:41.293Z,"Click below for the latest Red Gold & Bold Podcast. Jeffri Chadiha, Sam McDowell and I discuss the state of the Chiefs Offense. - Still need a WR? - No help for OL. - How to replace Kelce? - Mahomes w/out mobility. Apple tinyurl.com/y3k8axe4 YouTube tinyurl.com/2m7x5s44",0,1
at://did:plc:gpqzqh3rbamgt7obreo6msjc/app.bsky.feed.post/3mldvsksn7k2a,2026-05-08T14:09:13.678Z,These are going to be so expensive and probably provide almost no value to most people. This is going to be an apple vision level failure,0,1
at://did:plc:aunpu65mdrhwfie7ynymlzeh/app.bsky.feed.post/3mlcnwdx53o2n,2026-05-08T02:15:30.771Z,"Watch the full episode of the Bulwark Podcast at The Bulwark and YouTube, or listen on Apple Podcasts, Spotify or wherever you get your podcasts: lnk.thebulwark.com/49COPa3?utm_...",2,28
at://did:plc:aunpu65mdrhwfie7ynymlzeh/app.bsky.feed.post/3mlcrbmmomg2l,2026-05-08T03:15:30.186Z,"Watch the full episode of the Bulwark Podcast at The Bulwark and YouTube, or listen on Apple Podcasts, Spotify or wherever you get your podcasts: lnk.thebulwark.com/49COPa3?utm_...",3,22
at://did:plc:foaajws4zrnl3gwl55iaehlk/app.bsky.feed.post/3mlcllyaugk25,2026-05-08T01:33:55.736Z,"Just five companies - Alphabet, Nvidia, Amazon, Broadcom and Apple - have accounted for half of the S&P 500's growth since April. www.ft.com/content/7599...",10,35
at://did:plc:2jzjyiei2rgj5lqwrlpnmnih/app.bsky.feed.post/3mlcwfornt227,2026-05-08T04:47:15.627Z,Freezie pop AND an appy sauce? Nice.,0,7
at://did:plc:tsk74adl6zjrzxtq6tg27dai/app.bsky.feed.post/3mlcumnkz4s2w,2026-05-08T04:15:21.767Z,apple of my eye #art #illustration #rabbit #bunny,0,16
at://did:plc:5so446hnexauppfhylhmnb5q/app.bsky.feed.post/3mldghd2yjc2e,2026-05-08T09:34:30.337Z,Madame also wants it on record that she's angry about paper straws that turn mushy halfway through a carton of Peppa Pig apple juice but I've told her she's not using my precious Bluesky for that sort of nonsense so she'll just have to quietly sulk about it 🐷🍎,1,9
at://did:plc:n4qkdn2bdyec6dlkaljesib2/app.bsky.feed.post/3mlcpyidgr22d,2026-05-08T02:52:30.218Z,"Imagine an apple okay got it now, which one? what? hold on WHAT THE FUCK THERE'S AN ALIGNMENT CHART NOW?",1,15
at://did:plc:rincsl2xgoczsnwbyadizkri/app.bsky.feed.post/3mld2ccefvs2y,2026-05-08T05:56:56.914Z,"Listen... Sidon has two hands. TOOLS: Procreate, iPad Air 4, Apple pencil 2 #sidlink #sidlinkona #sidyona #sidon #kingsidon #princesidon #link #yona #loztotk #loz #lozlink #totk #legendofzelda #tearsofthekingdom #nintendo #zora #poly #digitalart #purplemagicn",1,27
at://did:plc:tpg3qzw3niphci6ne5wdprfr/app.bsky.feed.post/3mlcsenliu22n,2026-05-08T03:35:05.864Z,"It’s a Rockit apple. They’re about 1/3 to 1/2 the size of a usual grocery apple. Perfect snack size and, more importantly, beaut color",0,11
at://did:plc:5ur5lezh4jzzdcjboqc4gtcm/app.bsky.feed.post/3mle5wndkqk2n,2026-05-08T16:34:40.483Z,"My Mum’s Scottish (My Dad is German) but she learned directly from my Oma how to make sauerkraut. She used apple in it and caramelised onions, butter, etc. One of my favourite comfort foods. She’s roast some pork and we’d have fresh crackling, roast potatoes, buttered carrot. Thuh BEST.",0,4
at://did:plc:iolszkz7urx7worjt34sh5bz/app.bsky.feed.post/3mlcwpjiigc2u,2026-05-08T04:52:45.637Z,I've been in transit all day and am dead tired but I had a McDonald's apple pie so all is well,0,7
