ID_Tweet,Fecha_UTC,Contenido_Texto,Retweets,Favoritos
at://did:plc:kvv32x6xjqp2np7urdke77en/app.bsky.feed.post/3mlhhgljwl22p,2026-05-10T00:02:38.357Z,Do I dare cook a little of this lemon wine into the apple pie filling?? 👀 Has anybody ever done anything like that before? The filling is reeeally sweet rn cuz I'm using different apples than I'm used to and I wanna add a bit of zest/acidity to the flavor but I have no lemons😩,0,15
at://did:plc:tcckeqx5rjl7ebqfv23gwinq/app.bsky.feed.post/3mli3fw5kbq2h,2026-05-10T06:00:10.668041+00:00,🎯 Yesterday Accuracy: 100.0% #Apple AI Setup FLAT ⚪ (↔️ Range) AI Confidence: 80% Support: 291.97 Target: 296.47 Full data: https://www.modelmango.co #AI #Trading #FinTech,0,1
at://did:plc:oxt4f4yhhpagjsdbkilyqgom/app.bsky.feed.post/3mlhqcnouwk2c,2026-05-10T02:41:30.075Z,Cheeseburgers and apple pie. It'll change your life.,0,1
at://did:plc:b73nm35y3w6rsy2jluphzpwn/app.bsky.feed.post/3mlhxc2afac2i,2026-05-10T04:46:25.869Z,Landru! The Apple! Paradise Syndrome maybe? For the World is Hollow... yeah that's just off the top of my head #TOSSatNight,0,3
at://did:plc:2vlp53umktwulinv2z3g4app/app.bsky.feed.post/3mlhs3bx2wk2f,2026-05-10T03:13:10.345Z,"Le club joue à Hey, Soul Sister by Train. Je vais sortir pour trouver une très bonne Apple. Je suis transsexuel. Je reste ambivalent, mais positif, à propos de cette vie.",0,3
at://did:plc:ea2x22fzbzdzpanx543mve75/app.bsky.feed.post/3mlhrrhaadc2x,2026-05-10T03:07:40.361Z,I hate Google Maps. I also hate Goggle and Apple Maps try to replicate ways. Hard pass.,0,4
