ID_Tweet,Fecha_UTC,Contenido_Texto,Retweets,Favoritos
at://did:plc:kocsy6hlt3isic7oczzed2mg/app.bsky.feed.post/3mds5kkodgs2k,2026-02-01T10:43:38.344Z,Backyard birding. A rainbow lorikeet in one of my apple trees today. This is where my bird photography all started: Sitting in my backyard trying to get photos of the parrots that would visit. #birdsseenin2026,26,209
at://did:plc:dnasdrejui4cejydosm7beyg/app.bsky.feed.post/3mdthr45ht22q,2026-02-01T23:18:55.119Z,I need you to just picture the meat shakes this kitten had. This is Apple and she very very much enjoyed breakfast. I currently have a tshirt full of kittens because they got a bit cold despite their heat pad. (We went from 30C+ days to 16.9C outside),24,335
at://did:plc:6okanyel2nnben6zaitoat4b/app.bsky.feed.post/3mdr26sdbe22j,2026-02-01T00:10:42.761Z,But I'm also Tipsy enough to go make an apple pie right now,0,1
at://did:plc:yyhvgqzhezubt7ur2z6xv4th/app.bsky.feed.post/3mdratqv5qs2w,2026-02-01T02:09:48.340Z,"Apple TV HBO ChatGPT( took offer of $0 for 1 month ) - plus I’m using Claude more these days Amazon - I’d already signed up for a year, but won’t be buying anything online.",0,1
at://did:plc:o2xuk3kmy2xwif2j5p5fe4vr/app.bsky.feed.post/3mdrdhr5urc2r,2026-02-01T02:56:47.202Z,*some… I swear apple has made swipe to text worse…,0,2
at://did:plc:rxzk3xsi4qewnu7yrl6ugyrh/app.bsky.feed.post/3mdrrrq2vrc2b,2026-02-01T07:12:53.986Z,"Music apple.co/4aDHdpm Try Apple Music free for 1 month Offer valid for new Apple Music subscribers only. After the 1-month free trial, subscription automatically renews at the standard monthly rate unless cancelled before the trial ends. Terms & conditions apply. Ad.",0,0
at://did:plc:34w6p2nygxpqkiqbkrnq56ip/app.bsky.feed.post/3mdruuqsljd2l,2026-02-01T08:07:28.000Z,#NowPlaying 🕖 7:07 pm 🎵 Waiting So Long 🧑‍🎤 Daphni 💿 Butterfly 🎧 Apple Music / Spotify / YouTube Music 📝 Lyrics,0,0
at://did:plc:34w6p2nygxpqkiqbkrnq56ip/app.bsky.feed.post/3mdrluuhxzy2m,2026-02-01T05:26:20.000Z,#NowPlaying 🕓 4:26 pm 🎵 Straight Lines 🧑‍🎤 Silverchair 💿 Young Modern 🎧 Apple Music / YouTube Music 📝 Lyrics,0,0
at://did:plc:extqxtsoc4q4qnbmwizooppn/app.bsky.feed.post/3mdrqqhjywj2r,2026-02-01T06:53:48.000Z,#NowPlaying 🕠 5:53 pm 🎵 heavy 🧑‍🎤 Kee'ahn 🌱 Triple J Unearthed 🎧 Apple Music / Spotify / YouTube Music 📝 Lyrics,0,0
at://did:plc:wjljc54nads6ix5tlp4swebe/app.bsky.feed.post/3mdsf6hhnfn2u,2026-02-01T13:00:02.176214+00:00,"teckel Web3 API hourly update Eth price (USD): 2396.68 (-0.6% 1 hr, -8.9% 24 hr) Click for API details API keys via App: Apple App Store Google Play Store #teckel #eth",0,1
at://did:plc:extqxtsoc4q4qnbmwizooppn/app.bsky.feed.post/3mdsfg23ofr2d,2026-02-01T13:03:55.000Z,#NowPlaying 🕛 12:03 am 🎵 It's You 🧑‍🎤 Ninajirachi & daine 💿 I Love My Computer 🎧 Apple Music,0,2
at://did:plc:34w6p2nygxpqkiqbkrnq56ip/app.bsky.feed.post/3mdsgavit3i2l,2026-02-01T13:18:26.000Z,#NowPlaying 🕛 12:18 am 🎵 PRETTY GYAL 🧑‍🎤 COTERIE 🌱 Triple J Unearthed 🎧 Apple Music / Spotify / YouTube Music 📝 Lyrics,0,0
at://did:plc:xatdrfxd67dg6cyllq2kgwya/app.bsky.feed.post/3mdrrzh2evk2r,2026-02-01T07:17:12.967Z,I think we should send the guy running apple a bunch of knee pads. Hes kinda old to be down on his knees for long periods of time without support.,0,0
at://did:plc:extqxtsoc4q4qnbmwizooppn/app.bsky.feed.post/3mdsdc3pj7y23,2026-02-01T12:24:15.000Z,#NowPlaying 🕚 11:24 pm 🎵 Ultimatum 🧑‍🎤 Disclosure 🎧 Apple Music / Spotify / YouTube Music 📝 Lyrics,0,0
at://did:plc:34w6p2nygxpqkiqbkrnq56ip/app.bsky.feed.post/3mds7tb2y352c,2026-02-01T11:22:59.000Z,#NowPlaying 🕙 10:22 pm 🎵 Bachelorette 🧑‍🎤 Björk 💿 Homogenic 🎧 Apple Music / YouTube Music 📝 Lyrics,0,0
at://did:plc:hksj5icmr26mzagrebie7aa4/app.bsky.feed.post/3mdslkptd6s25,2026-02-01T14:54:16.143Z,Apple’s AI brain drain now includes senior Siri leadership. gadgetbond.com/apple-ai-tal...,0,0
at://did:plc:extqxtsoc4q4qnbmwizooppn/app.bsky.feed.post/3mdslxa2ggh24,2026-02-01T15:00:11.000Z,"#NowPlaying 🕑 2:00 am 🎵 Lover, where'd you go 🧑‍🎤 Olivia C. Dacal 💿 Lover Where'd You Go 🌱 Triple J Unearthed 🎧 Apple Music / Spotify / YouTube Music",0,0
at://did:plc:cvc7lpe3engc2dmeacktpo7l/app.bsky.feed.post/3mdspy7gtnk2l,2026-02-01T16:13:23.686Z,Shitty little mp3 player with Apple headphones 👨‍🍳 💋,0,0
at://did:plc:d3fggwqdkkpeopxlxmzwxyxx/app.bsky.feed.post/3mdszqbbslc2c,2026-02-01T19:07:54.602Z,"Looks like it could be legit. It's clearly a third party using the Bluesky API to scrape posts. However, the legality of it being forced opt-in is highly questionable? Q .ai is a legit Israeli based AI company (double ick) that was just bought by Apple on Thursday.",1,3
at://did:plc:er5s2gaa6iztnctvwgyquldf/app.bsky.feed.post/3mdsypbclak2g,2026-02-01T18:49:27.331Z,I thought Netflix good? Apple/Paramount/Amazon bad. Do you hear from the vet tomorrow?,0,1
at://did:plc:nli2auxnn54oyb7hfvv7sznd/app.bsky.feed.post/3mdsyz5ehrk2p,2026-02-01T18:54:58.743Z,Here’s the Apple Podcasts link: podcasts.apple.com/us/podcast/w...,2,5
at://did:plc:yfal2mjxtxw4fjhqybua2fic/app.bsky.feed.post/3mdsvnonrik2y,2026-02-01T17:54:52.994Z,I haven’t truly edited my photo library from a decade ago. I blame massive storage available through Google and Apple. Instead of being mindful I am hoarding data and paying to subsidize my laziness.,0,0
at://did:plc:qffi4qy2zpeis3kh6qxeanil/app.bsky.feed.post/3mdsx45r3gs22,2026-02-01T18:20:52.336Z,"Another sunday. nother grasp at comfort with dinner. I have made shepherd's pie and then there will be cherry apple crumble, and vanilla ice cream. NOTHING will hurt. For a bit.",0,15
at://did:plc:mf45dibdmd34l5hyztm4iqpi/app.bsky.feed.post/3mdswfwvoh22i,2026-02-01T18:08:26.949Z,"They*** omg, I hate the new Apple update",0,6
at://did:plc:zan5hhytewxuezp6ds3kojpb/app.bsky.feed.post/3mdt4ozot5k2j,2026-02-01T20:00:54.309Z,What is Apple Pen?,0,0
at://did:plc:wtyybqnu37akmtdgwgb3mk4k/app.bsky.feed.post/3mdtenvwifs26,2026-02-01T22:23:26.747Z,i'm distraught & i need the healing ichor that is the flight bottle of apple Jim Beam that's been sitting in the door of my refrigerator for like 3 years now,0,0
at://did:plc:qtq67rmp5xqnflsxok6d3iwr/app.bsky.feed.post/3mdteneqsks2d,2026-02-01T22:23:08.735Z,"Why do I keep reading here that Melania , the movie , keeps bring a flop at box offices while I’m now reading on Apple News that it exceeded first week expectations in grossing $7 million ! We need to know we can have the truth somewhere !!",0,0
at://did:plc:34w6p2nygxpqkiqbkrnq56ip/app.bsky.feed.post/3mdtcuesylj2w,2026-02-01T21:49:58.000Z,#NowPlaying 🕣 8:49 am 🎵 Marina Gasolina 🧑‍🎤 Bonde do Rolê 💿 With Lasers 🎧 Apple Music 📝 Lyrics,0,0
at://did:plc:5cwt6v4epindcllb457xlu5t/app.bsky.feed.post/3mdsxpxp7os2s,2026-02-01T18:31:57.071Z,Well there is only one left so the apple butter rubbed one one the left :),0,2
at://did:plc:2pq4zlma7ludtvigwquoigid/app.bsky.feed.post/3mdtgduckxc25,2026-02-01T22:53:36.985Z,"Until Apple gets busted selling sensor data à la Meta and Google, I’ll give them a little benefit of the doubt. But I’m with you - no Meta or Google apps on my phone in years.",0,1
at://did:plc:jxulr736q7pkcjo7tc2gnljw/app.bsky.feed.post/3mdt2ogvphc2z,2026-02-01T19:24:47.112Z,OMG im so sorry Hellpple that i forgot to post this prettiest lil angel!!! He's so cute in this apple apron 🥹💖 thank you so much again 😭🙏✨,0,20
at://did:plc:34w6p2nygxpqkiqbkrnq56ip/app.bsky.feed.post/3mdsmbwqm262l,2026-02-01T15:06:05.000Z,#NowPlaying 🕑 2:06 am 🎵 Walk The Line 🧑‍🎤 Cog 🎧 Apple Music / Spotify / YouTube Music 📝 Lyrics,0,0
at://did:plc:extqxtsoc4q4qnbmwizooppn/app.bsky.feed.post/3mdsezkgblg2g,2026-02-01T12:56:21.000Z,#NowPlaying 🕦 11:56 pm 🎵 Taxes 🧑‍🎤 Geese 💿 Getting Killed 🎧 Apple Music / Spotify / YouTube Music 📝 Lyrics,0,0
at://did:plc:patybl5b6gxx77yxwnyr72gn/app.bsky.feed.post/3mdrqkgkfi22h,2026-02-01T06:50:55.379Z,Beet and apple salad yeah!,0,1
at://did:plc:hxeto4lzq4jh2tnqzewb4sq5/app.bsky.feed.post/3mdrrbns3m22w,2026-02-01T07:03:54.726Z,"I cannot STAND corporate America. BCBS denied my knee replacement cause I am “too young”. I wasn’t doing my “job” after 15 years, iPhone won’t download the new update saying I have no room. @apple wants me to delete memories for an update, took away my Face ID, slowing down apps. My phone works",1,0
at://did:plc:5adibzrxrpdxvsxtiu2e2grb/app.bsky.feed.post/3mdrt5uzfzk2n,2026-02-01T07:37:35.572Z,"I saw this album on Apple Music and I literally went searching for your socials so I could find out if it was a bit or if your computer actually blew up Sorry to hear that it did, but super happy to hear that it’s back!! the album was fire btw 🙂‍↕️",0,2
at://did:plc:34w6p2nygxpqkiqbkrnq56ip/app.bsky.feed.post/3mdrvuvfrpx2l,2026-02-01T08:24:43.000Z,#NowPlaying 🕖 7:24 pm 🎵 Stay On Me 🧑‍🎤 Sophie Ellis-Bextor 💿 Perimenopop 🎧 Apple Music / Spotify / YouTube Music 📝 Lyrics,0,0
at://did:plc:capjxi245klixddez3ws3c7h/app.bsky.feed.post/3mdr3pinzok2l,2026-02-01T00:37:56.794Z,Thank you to everyone who keeps downloading my podcast episodes even though I'm not very good at remembering to promote each one of them. I publish a new one each Tuesday now. Apple Podcasts: apple.co/443Zdp9 Spotify: bit.ly/4r7sF6q Amazon: amzn.to/4nm0zD3,0,0
at://did:plc:udyn2dmw2qgvjelxvh7zmti2/app.bsky.feed.post/3mdrpflmhwr2s,2026-02-01T06:30:17+00:00,"Your iPhone can browse Safari at a smooth 120Hz, and this is the setting you need to change https://www.europesays.com/ie/314520/ Not too long ago, iPhones didn’t offer high refresh rate displays. Apple only switched to 120Hz screens with…",0,0
at://did:plc:s4xmseub4a4pwwetg2xxmcyy/app.bsky.feed.post/3mdrcngpymc2s,2026-02-01T02:42:03.840512+00:00,Apple-1 Computer Prototype Board #0 sold for $2.75M Discussion,0,1
at://did:plc:c2hq7dzgli6ebikwqsvsd4py/app.bsky.feed.post/3mdsqvp4rkb2x,2026-02-01T16:29:52.000Z,"REGIONAL FORECAST DISCUSSION BLACK SHEEP WEATHER - APPLE VALLEY, MN SAT JAN 31, 2026 - 9:45 AM Most of the region will see a total snow of 1-2"". We will get up into the mid-upper 20s today before dropping back down to near normal for Monday. #mnwx #wiwx #winter 1/3",0,1
at://did:plc:pjmjhtrckx26dlry2kvcznow/app.bsky.feed.post/3mdsv2t5lb225,2026-02-01T17:44:20.172Z,"Why aren’t app makers removing apps targeting protesters, citizens, voters, volunteers from being targeted by the government? Apple & Google removed ppl’s ability warn about 🧊 locations. 🧊 has a subscription to hack into our phones? Where are the protections for privacy now?",0,0
at://did:plc:djjkquvilpie6rkvhsmu2z7o/app.bsky.feed.post/3mdt4bakaok2e,2026-02-01T19:53:11.739Z,"I have a an old second-gen SE, which doesn’t have any Apple “intelligence” crap on it and I’m also running an ancient OSX because I refuse to update to the “liquid glass” horseshit.",0,3
at://did:plc:l5gupr4kifwasjek7vblnoy2/app.bsky.feed.post/3mdtftknhbc2e,2026-02-01T22:44:29Z,Apple I Advertisement (1976) http://apple1.chez.com/Apple1project/Gallery/Gallery.htm https://news.ycombinator.com/item?id=46847780,0,0
at://did:plc:zkzwkjsa4jolyt4f7oi7cvjv/app.bsky.feed.post/3mdtfzan3pk2k,2026-02-01T22:47:40.811Z,"Dropped Spotify premium, Netflix and a WhatsApp yesterday. No more Apple products either. Thx for getting this out there.",0,0
at://did:plc:osg2vzhifd2tjfsvfwua7scy/app.bsky.feed.post/3mdt3wnsgns2v,2026-02-01T19:47:16.540Z,"Not easily. Even if you could get an open source software stack running on it, you'd still have to rethink the epub typesetting engine. It's a research project. What hurts is that the companies that have resources to do it (Google, Amazon, Apple, etc) just don't give a damn.",0,0
at://did:plc:jsyvlelqdcugzjw3qhbrsu3x/app.bsky.feed.post/3mdsoexo4p22n,2026-02-01T15:44:44.256Z,Apple cinnamon oatmeal with walnuts and heavy cream ☺️🍜🍽️,2,43
at://did:plc:udyn2dmw2qgvjelxvh7zmti2/app.bsky.feed.post/3mdtbp564kk2p,2026-02-01T21:30:25+00:00,"“Sugar,” “Jury,” “Neighbors,” “Vladimir” Set Dates https://www.europesays.com/ie/315476/ Apple TV A number of TV series have set premiere dates for their new seasons. First, Apple TV…",0,0
at://did:plc:rxzk3xsi4qewnu7yrl6ugyrh/app.bsky.feed.post/3mdtfh6iozc2q,2026-02-01T22:37:34.590Z,Stardew Valley+ Build the farm of your dreams. Now officially on iPhone & iPad. Play on Apple Arcade apple.co/4pYYayS Ad.,0,0
at://did:plc:3iv25vrb3c3qtwl3h5fnjr67/app.bsky.feed.post/3mdr2h7xwk22n,2026-02-01T00:15:25.504Z,Send. 🫰🏻✨ $Aly123janel CA @payaly8 Venmo Apple Pay 🤌🏻 #findom #finsub #goddess,1,1
at://did:plc:ipd7k3fuszzrwym6nyj773n7/app.bsky.feed.post/3mdr2u4kxmc2o,2026-02-01T00:22:38.130Z,"Sorry about the middle age dude rants, but something else that irked me. I just saw an Adobe Illustrator commercial featuring a Gen AI tool. It sucks seeing Apple, a company whose products that artists use to create, promote Gen AI tools with their stuff.",0,2
at://did:plc:gqvg6umfyd6ljbhkg7tlm7zn/app.bsky.feed.post/3mdrmat4gdk26,2026-02-01T05:33:58.041Z,Spring dreams,0,5
at://did:plc:6oiz2i7bu2dxuc4mcojsyqpr/app.bsky.feed.post/3mdren65oh22b,2026-02-01T03:17:42.341Z,I only did ginger tea and lemon. Next week I should be doing the apple tea with the berries and stuff and I am not ready for that one I don’t think,0,0
at://did:plc:u7y7r64jzmdikif4onip3gnc/app.bsky.feed.post/3mdrfotllg22c,2026-02-01T03:36:32.113Z,"🎙NEW EPISODE STREAMING @ MIDNIGHT🎙 🖤""MESSAGE FROM THE DEAD""🖤 Tune in to our latest episode featuring Radio Shows: ✨️""THE HAUNTING HOUR"" ✨️""NIGHTFALL"" 📲LISTEN NOW ON: anchor.fm/terror-radio Spotify iheartradio Apple & Google Podcasts YouTube Etc. #Podcasts #otr #horrorradio",0,0
at://did:plc:e5sycehmo2p3ze6qvrrsurcc/app.bsky.feed.post/3mdrfzjth6g27,2026-02-01T03:42:30.574463Z,"No need for the screenshot, just wanted to make sure Apple didn’t cancel it. In that case try going to settings in Boost -> the button next to Premium at the bottom -> then in the paywall tap Restore Purchases at the bottom. It would be better to try it on the device you initially upgraded on.",0,2
at://did:plc:m5k5vbeywlsgkfb5fjdz346n/app.bsky.feed.post/3mdrxh5q3ss26,2026-02-01T08:54:21.654Z,100% The bad apple doesn't fall far from the tree and we have seen the danger of enablers like Rachel.,0,3
at://did:plc:extqxtsoc4q4qnbmwizooppn/app.bsky.feed.post/3mdrybsi6m424,2026-02-01T09:08:14.000Z,#NowPlaying 🕗 8:08 pm 🎵 You Could Have It 🧑‍🎤 Horse Vision 🎧 Apple Music / Spotify / YouTube Music 📝 Lyrics,0,0
at://did:plc:extqxtsoc4q4qnbmwizooppn/app.bsky.feed.post/3mds2xme4j723,2026-02-01T09:56:01.000Z,#NowPlaying 🕣 8:56 pm 🎵 1 Thing 🧑‍🎤 Amerie 💿 Touch 🎧 Apple Music / Spotify / YouTube Music 📝 Lyrics,0,0
at://did:plc:zhewelv4zeqcmwjqsr5fnpv4/app.bsky.feed.post/3mds3d2qcsk2w,2026-02-01T10:03:39.274Z,BUT HOW TO GET IT WITHOUT APPLE OR GOOGLE STORES They have the phones stitched up,0,1
at://did:plc:jf26a7dgps3fck4zc7anchdl/app.bsky.feed.post/3mds3jprnx72b,2026-02-01T10:07:22.571152+00:00,記事の要約: Appleは、フィットネスとウェルネスのためのサブスクリプションサービス「Apple Fitness+」を日本で開始しました。このサービスでは、トレーナー主導のワークアウトビデオを視聴でき、ピラティス、ヨガ、ダンス、筋力トレーニング、コアトレーニングを含む12種類のワークアウトやメディテーションが提供されます。ワークアウトの時間は5分から45分まで選べ、隙間時間に利用しやすい設計です。また、日本向けのコンテンツとして、YOASOBIをフィーチャーした「アーティストスポットライト」シリーズや、渡辺直美と山下智久が出演する「ウォーキングの時間」も用意されています。さらに、日本語の翻…,0,0
at://did:plc:zl5qgre7vv4tca6dl4xwthdq/app.bsky.feed.post/3mds7brpaws25,2026-02-01T11:14:31.210Z,"Windows 10 ceased support and they still find a way to get on my nerves in this regard. Every other device that allows updates gives you full control on when you update. Even Apple, that's why I've been able to avoid the shitty newer versions of iOS",0,0
at://did:plc:kvtrcsgerkh53zlbrql4z4yz/app.bsky.feed.post/3mdrwnqq43s23,2026-02-01T08:40:09.170Z,ilu u big pink apple fritter,0,2
at://did:plc:cqsnrvpvqz6frwux5hddw2i2/app.bsky.feed.post/3mdt7frvf522y,2026-02-01T20:49:25.372Z,"I'm able to respond to our TFA system using my apple watch, which is a pretty good workaround for the phone thing",0,1
at://did:plc:j2r4a57uvfs3oghcdhxobfd4/app.bsky.feed.post/3mdte4wve2c24,2026-02-01T22:13:57.334Z,(this is from Apple Maps),0,0
at://did:plc:34w6p2nygxpqkiqbkrnq56ip/app.bsky.feed.post/3mdte7azidb2w,2026-02-01T22:14:39.000Z,#NowPlaying 🕘 9:14 am 🎵 Yadingji 🧑‍🎤 Cooee 💿 Messengers 🎧 Apple Music / Spotify / YouTube Music 📝 Lyrics,0,0
at://did:plc:onsbyn4u2cms5yqxvpaqboge/app.bsky.feed.post/3mdruqygbfc2x,2026-02-01T08:06:10.417Z,"With thanks to Girl Scouts for the melody: 🎵Oh, an apple grown from seed Is not what orchards grow They graft their trees for fruit to be Like the ones that they grew for us previously To keep those qualities Gotta do it all again🎵",0,2
at://did:plc:uzowoxeacypufe6nfda7fcrw/app.bsky.feed.post/3mdr7xpblhc2i,2026-02-01T01:54:07.129Z,"Rick: trying to get you to watch this: Murdered at First Sight season 3, episode ""Love and Hate."" It's on Amazon Prime, Apple TV, Roku TV & online, & YouTube. I was called in Jan '25 by a London producer & went to Tucson in March for interviews. It's very well done. www.youtube.com/watch?v=GGW2...",0,1
at://did:plc:ethjq4rtmacktnvs2wu2iyvx/app.bsky.feed.post/3mdrkbnb2hc23,2026-02-01T04:58:37.978Z,"New ep dropped: @geektells.bsky.social and @jgamet.bsky.social talk about the AirTag refresh, and Apple buying the AI startup Q.ai. They also discuss Jeff’s recent audiology checkup and resources for people with hearing loss and tinnitus. contextmachine.io/airtags-2-ap...",1,2
at://did:plc:mqjjipzt6yiu57tc4nsprmtb/app.bsky.feed.post/3mdsv7hp4k223,2026-02-01T17:46:55.934Z,"See a drink, quote a drink!",0,0
at://did:plc:geoacjzr7slrff4wp5tgyzyt/app.bsky.feed.post/3mdsvgdklck2y,2026-02-01T17:50:46.475Z,A serious f*** you Apple for putting Melania ads all over Apple News. You f****** suck so bad!!,2,13
at://did:plc:hzs7k44mrrfmfbi6opv5u2cw/app.bsky.feed.post/3mdr62zrhy42s,2026-02-01T01:20:09+00:00,"The world’s first true insight into Lou Reed’s mind https://www.europesays.com/uk/734152/ (Credits: Far Out / Apple Films / Album Cover) Sat 31 January 2026 23:00, UK Everybody has to…",0,0
at://did:plc:7lla6bcekzrdg6q6rwjq2ied/app.bsky.feed.post/3mdsm5yb2t22b,2026-02-01T15:05:02.443Z,Let’s gooooooo. I think this apple is one of the better monsters all game #crt #dragonquest #dqv #ps2,2,8
at://did:plc:extqxtsoc4q4qnbmwizooppn/app.bsky.feed.post/3mdr3iv65m42c,2026-02-01T00:33:36.000Z,#NowPlaying 🕦 11:33 am 🎵 I Like It Like That 🧑‍🎤 Fcukers 🎧 Apple Music / Spotify / YouTube Music 📝 Lyrics,0,0
at://did:plc:yhanpabdafxvo4kfjyy66zin/app.bsky.feed.post/3mdsicnht4225,2026-02-01T13:56:04.008Z,Apple released Taylor’s first album.,0,1
at://did:plc:27vxde54kz3t5p7qes4b4346/app.bsky.feed.post/3mdrb7gtgnk2b,2026-02-01T02:16:20.455Z,APPLE CINNAMON well now I have a challenge,0,1
at://did:plc:qrgcdabpzmk4tun4hfo3b6sl/app.bsky.feed.post/3mdqznyb3vs2d,2026-02-01T00:01:18.549Z,Richard Marcinko’s son Matt Marcinko twitter account is interesting. Here he is describing watching his sister having sex and pushing his mother to the ground. The apple didn’t fall from the tree.,0,1
at://did:plc:o7h5luxtujwgu62w5am7j2tj/app.bsky.feed.post/3mdrpynckas2n,2026-02-01T06:40:58.488Z,TIDAL just did one thing Apple Music never could. Recommend an album I've never heard by an artist directly associated with bands I listen to. A deep cut from the Elephant 6 legend: Will Cullen Hart. It... was... released... posthumously... last... year. 😱 #indiemusic tidal.com/album/421688...,0,2
at://did:plc:extqxtsoc4q4qnbmwizooppn/app.bsky.feed.post/3mds24skhuz2h,2026-02-01T09:41:13.000Z,#NowPlaying 🕣 8:41 pm 🎵 Special 🧑‍🎤 dexter in the newsagent 💿 Time Flies 🎧 Apple Music / Spotify / YouTube Music,0,0
at://did:plc:xk7xlkovqukhhsqa2mf24bjb/app.bsky.feed.post/3mds62iqlws2b,2026-02-01T10:52:33.191Z,"Very interesting how Steve Reed is very concerned about Jimmy Lai, who seems to me to be a Trump supporting, far-right tabloid journalist, business tycoon. I’m not really a fan of how China / Hong Kong have locked him up. But I don’t think shutting down Apple Daily was a bad thing to protect truth.",0,1
at://did:plc:bajfv6ph33deewq424jg4xvk/app.bsky.feed.post/3mds7miqy2c2e,2026-02-01T11:20:30.921Z,"If there's a reason to watch Mayonaka Heart Tune, it's a modern character having properly ventilated hair. No thermal throttling going on here.",0,0
at://did:plc:yvy5ax23zpmoearxn6xsgqzf/app.bsky.feed.post/3mdstxbet6k2p,2026-02-01T17:24:27.131Z,"will have an emergency locked on hawks ASAP today to break down the vit krejci trade subscribe, tell your friends, etc. 🎧 Apple: apple.co/3xGpUhr 🎧 YouTube: bit.ly/36j8r5f 🎧 Spotify: spoti.fi/3xKdEwd",1,12
at://did:plc:jcyaq5uglg4v22hfa74sp4lx/app.bsky.feed.post/3mdswo5wp6c2m,2026-02-01T18:13:02.757Z,"My only real gripe with the second game is that they changed the army battle system into a weird stripped down version of Fire Emblem where your characters have way less movement, and there's a ""leave it to Apple button"" that you can just automate them all with and you win.",0,1
at://did:plc:acy4bywuzyjw2lro2veqmnfi/app.bsky.feed.post/3mdrdxhbqnc2q,2026-02-01T03:05:33.442Z,"In Other News: Paid for Being Jailed, Google’s $68M Settlement, CISA Chief’s ChatGPT Leak Other noteworthy stories that might have slipped under the radar: Apple updates platform security guide, LastPass detects new phishing wave, CISA withdraws from… Telegram AI Digest #aiconference #chatgpt #gpt",0,0
at://did:plc:extqxtsoc4q4qnbmwizooppn/app.bsky.feed.post/3mdsrgjh3n32h,2026-02-01T16:37:45.000Z,"#NowPlaying 🕞 3:37 am 🎵 Afraid, Unafraid 🧑‍🎤 Slumberjack 💿 Fracture 🎧 Apple Music / Spotify / YouTube Music 📝 Lyrics",0,0
at://did:plc:woek4pqdd4zucgow5n7v65xn/app.bsky.feed.post/3mdsrwc6bpk2v,2026-02-01T16:48:06.926Z,#themayaexperience #bvmobileapps #mobileapps #podcast #nocode #android #apple #dev #tech,0,0
at://did:plc:3dus6zmfqzuvlplcrm73p5jh/app.bsky.feed.post/3mdtfanxi2c2p,2026-02-01T22:33:55.922Z,"I would buy this if Apple would let me. Lol. No option to purchase when I open the page linked, even made sure I was signed in. Downloaded the Apple TV app on my phone and searched for it, no results. Oh well.",0,1
at://did:plc:zeytbxgl4t3fll3efksmbj7v/app.bsky.feed.post/3mdsbjgrmec2a,2026-02-01T11:54:35.676Z,"i just popped back on to say Shohreh Aghdashloo is welcome to read me bedtime stories any time. Or phone books, or the backs of cereal boxes, or all 930 pages of the Apple iOS & iPadOS Software License Agreement or the Oxford Unabridged English Dictionary or",4,17
at://did:plc:erhkpb67xnkafso47yorbpxj/app.bsky.feed.post/3mdsc5qi5ac2o,2026-02-01T12:05:56.933Z,"Apple Cider Vinegar makes me angry. Australia rarely has media like that to put our actors in, yet they gave the main roles to Americans. You’re never going to convince me there were no Australians up to the task. America just can’t let anyone else have anything. We don’t get our own stories.",0,0
at://did:plc:34w6p2nygxpqkiqbkrnq56ip/app.bsky.feed.post/3mdse4wtpmh2e,2026-02-01T12:39:07.000Z,#NowPlaying 🕦 11:39 pm 🎵 Zero 🧑‍🎤 Yeah Yeah Yeahs 💿 It's Blitz! 🎧 Apple Music / Spotify / YouTube Music 📝 Lyrics,0,0
at://did:plc:extqxtsoc4q4qnbmwizooppn/app.bsky.feed.post/3mdsemxkobc24,2026-02-01T12:49:45.000Z,#NowPlaying 🕦 11:49 pm 🎵 Prey4U 🧑‍🎤 BENEE 💿 Ur an Angel I’m Just Particles 🎧 Apple Music / Spotify / YouTube Music 📝 Lyrics,0,0
at://did:plc:msibbasr2pn5aaw6b447wda4/app.bsky.feed.post/3mdt5rmppya2v,2026-02-01T20:20:13+00:00,"Apple Watch Series 11 Hits $299 Low Price on Amazon, Get $100 Off Nearly Every Aluminum Model https://www.europesays.com/uk/735794/ Amazon this weekend has all-time low prices on the Apple Watch Series 11, with $100 discounts across numerous…",0,0
at://did:plc:woek4pqdd4zucgow5n7v65xn/app.bsky.feed.post/3mdsrwc6bpk2v,2026-02-01T16:48:06.926Z,#themayaexperience #bvmobileapps #mobileapps #podcast #nocode #android #apple #dev #tech,0,0
at://did:plc:mqjjipzt6yiu57tc4nsprmtb/app.bsky.feed.post/3mdsv7hp4k223,2026-02-01T17:46:55.934Z,"See a drink, quote a drink!",0,0
at://did:plc:msibbasr2pn5aaw6b447wda4/app.bsky.feed.post/3mdt5rmppya2v,2026-02-01T20:20:13+00:00,"Apple Watch Series 11 Hits $299 Low Price on Amazon, Get $100 Off Nearly Every Aluminum Model https://www.europesays.com/uk/735794/ Amazon this weekend has all-time low prices on the Apple Watch Series 11, with $100 discounts across numerous…",0,0
at://did:plc:geoacjzr7slrff4wp5tgyzyt/app.bsky.feed.post/3mdsvgdklck2y,2026-02-01T17:50:46.475Z,A serious f*** you Apple for putting Melania ads all over Apple News. You f****** suck so bad!!,2,13
at://did:plc:jcyaq5uglg4v22hfa74sp4lx/app.bsky.feed.post/3mdswo5wp6c2m,2026-02-01T18:13:02.757Z,"My only real gripe with the second game is that they changed the army battle system into a weird stripped down version of Fire Emblem where your characters have way less movement, and there's a ""leave it to Apple button"" that you can just automate them all with and you win.",0,1
