ID_Tweet,Fecha_UTC,Contenido_Texto,Retweets,Favoritos
at://did:plc:ajplv5tkey4uzfeoiwjfeycw/app.bsky.feed.post/3mczyvpusrs2m,2026-01-22T20:16:30.473Z,The craving for a Taco Bell caramel apple empanada is so aggressive rn and I’m so upset I can’t get them anymore,0,4
at://did:plc:trbbdrfpvxzwr6lpndqm5oyf/app.bsky.feed.post/3mczz4zntmkm2,2026-01-22T20:20:32.000Z,"Starship Records & Tapes is closing its doors for good. I used to go there fairly often when they had the blue and gold houses at 11th & Delaware, but I've rarely been to the location on Lewis—I no longer have any equipment for playing music (beyond Apple Music on my phone/computer), and a man […]",0,0
at://did:plc:jryrexsfclubwo36ppwtbnfz/app.bsky.feed.post/3md26yvp2j22d,2026-01-22T22:05:39.676Z,"Rayle, you say? Thanks for the heads up.",1,3
at://did:plc:4femb4l5cmgrmui2bsklscys/app.bsky.feed.post/3md2735yfu22o,2026-01-22T22:06:55.497Z,"I remember once I thought, it’s not going to snow m, this is panic mode and I’m not going to buy into it…..day 3 we had popcorn for dinner and an apple😂😂😂",0,0
at://did:plc:h6disr7eqpr3ws2eqsd7rnft/app.bsky.feed.post/3md275swjxi2s,2026-01-22T22:08:23.877413+00:00,"[Magalu] Apple iPhone 16e 512GB Preto 6,1"" 48MP iOS 5G -- AliExpress R$ 3.740,00 Cupom: IFP4U8NK ou MARCABR6 Compre aqui ⬇️⬇️",0,0
at://did:plc:75z4vy7v4t7xquvc65movso2/app.bsky.feed.post/3mcztexgfpc2o,2026-01-22T18:37:39.256Z,"i can connect my pro controller to my fucking Apple TV, and it just works!!",0,3
at://did:plc:2245x6sqmbiueuqzhjwllydb/app.bsky.feed.post/3mczmpyf7mj2b,2026-01-22T16:38:33.084258+00:00,Seu ouvido merece mais uma prestação. 🛒 Apple AirPods Pro 3 ​​​​​​​ ❌ De: R$ 2699.00 💵 𝐏𝐨𝐫: 𝐑$ 𝟐𝟐𝟗𝟗.𝟎𝟎 🔥 14% OFF! 🔗 https://tiny.one/bde4u6x3,0,0
at://did:plc:extqxtsoc4q4qnbmwizooppn/app.bsky.feed.post/3mczqrzmh7q2r,2026-01-22T17:50:27.000Z,#NowPlaying 🕟 4:50 am 🎵 What's Next 🧑‍🎤 Rum Jungle 🌱 Triple J Unearthed 🎧 Apple Music / Spotify / YouTube Music,0,0
at://did:plc:rlinscv24jv7r5cplvunubim/app.bsky.feed.post/3md27sq4jfc2c,2026-01-22T22:20:06.257Z,Apple doesn't fall far from the tree.,0,2
at://did:plc:b5mmbrrmls3hfnyspumpfznw/app.bsky.feed.post/3md2b3xlqx22b,2026-01-22T22:43:09.828Z,"Verizon, Apple, Microsoft this week.",0,0
