tweet_id,fecha_utc,contenido_texto,retweets,favoritos,fecha_limpia,puntuacion_sentimiento,sentimiento
at://did:plc:p65w2zebgm4262w2brtjqrzb/app.bsky.feed.post/3mnb3uvraos2y,2026-06-01 22:10:18.744000+00:00,An Apple Tall,34,195,2026-06-01,0.9998,positive
at://did:plc:yk7qcipba5ggw6ou4zss24fx/app.bsky.feed.post/3mnb5eq7t7k2t,2026-06-01 22:37:03.547000+00:00,"WIfe's entry for this weeks #OliveArtClub, apple painted in gouache. She's absurdly talented, if you ask me",3,70,2026-06-01,0.9972,positive
at://did:plc:l3nzokqarzrgqdct6ngli2ky/app.bsky.feed.post/3mnaq6rqi5k2d,2026-06-01 18:41:05.181000+00:00,yeah i made a bowler bag with the side profile of an apple!!!!!! 🍎 what of it!,41,296,2026-06-01,0.0923,negative
at://did:plc:qywnmz5w3zht6n6i324gjzdp/app.bsky.feed.post/3mnaqnbda2s2o,2026-06-01 18:49:11.296000+00:00,Apple juice,2,44,2026-06-01,0.9991,positive
at://did:plc:xjpi5wbgxxouy66ifiwmd5en/app.bsky.feed.post/3mnaqvw65g22q,2026-06-01 18:54:01.580000+00:00,"mina may be tiny, but she's got a big game! 🐭🍎 i'm about 10 hours in, and i feel like i've barely scratched the surface. this game is only 842 MB, but it's BIG! all the areas feel so well designed, and it really encourages and rewards you for exploring every nook & cranny 💎✨",715,3447,2026-06-01,0.9996,positive
at://did:plc:bli3fwdyytrmejda5qpawt3b/app.bsky.feed.post/3mnb3upnjyk2a,2026-06-01 22:10:12.354000+00:00,A24 PRESENTS,1,157,2026-06-01,0.9996,positive
at://did:plc:of56nmyuqzvjta7qlf7gwht6/app.bsky.feed.post/3mnaxl25tdk22,2026-06-01 20:53:12.862000+00:00,"Plums are really underrated, I’ll fuck with a plum. It’s sort of like an apple that doesn’t want you to have a good time.",1,101,2026-06-01,0.0001,negative
at://did:plc:nwz5degeylfhgqjsrs4desvt/app.bsky.feed.post/3mnayhmls5k2c,2026-06-01 21:09:11.714000+00:00,"Installation piece, temporary exhibition.",1,54,2026-06-01,0.9919,positive
at://did:plc:wcgzjl477psjrezngnmtywow/app.bsky.feed.post/3mnaulhauy222,2026-06-01 19:59:45.367000+00:00,Apple..... Tree.....,1,15,2026-06-01,0.8786,positive
at://did:plc:34z7teenjp727apl5mdzzbjf/app.bsky.feed.post/3mnbboqz46k2p,2026-06-01 23:54:14.905000+00:00,sharing an apple fritter with each of you :3,0,17,2026-06-01,0.9978,positive
at://did:plc:jwefiy6r4tom5n5rdabwkpuf/app.bsky.feed.post/3mnb2cguejs2f,2026-06-01 21:42:05.420000+00:00,still trips me up that there's a fully 3D Sonic game that came out only a few years ago that's almost completely original but it's locked behind Apple subscription hell,17,145,2026-06-01,0.0098,negative
at://did:plc:s2xkftzzepj5ztmngwgg2x4f/app.bsky.feed.post/3mnaqatfogk2j,2026-06-01 18:42:14.014000+00:00,I did a loosey goosey one,4,50,2026-06-01,0.2167,negative
at://did:plc:5udoh2yruu6u2njprrhkkr3y/app.bsky.feed.post/3mnbaxhot722f,2026-06-01 23:41:13.381000+00:00,apple,0,8,2026-06-01,0.9971,positive
at://did:plc:aunpu65mdrhwfie7ynymlzeh/app.bsky.feed.post/3mnbb7xuvg72d,2026-06-01 23:45:58.548000+00:00,"Watch the full episode of Bulwark Takes at The Bulwark and YouTube, or listen on Apple Podcasts, Spotify or wherever you get your podcasts:",1,44,2026-06-01,0.015,negative
at://did:plc:pxegdl4bueimessmke73ymrh/app.bsky.feed.post/3mnazyqaxyc22,2026-06-01 21:36:39.726000+00:00,Made some good ass apple fritters,0,12,2026-06-01,0.9997,positive
at://did:plc:4ckvmyifwnwsvw4weye45s2s/app.bsky.feed.post/3mnaiybbn4s23,2026-06-01 16:32:10.407000+00:00,I've been sharing my apple cores with the magpies the last few weeks and yesterday they left these for me. 💗,23,397,2026-06-01,0.0021,negative
at://did:plc:6xksbjutafzfg6qpxr2ruvxe/app.bsky.feed.post/3mnanasuh5225,2026-06-01 17:48:32.245000+00:00,"The apple. (Copic markers, Staedtler liners, white gel pen, and pastel pencils.) #OliveArtClub",2,41,2026-06-01,0.1616,negative
at://did:plc:tgm3isug3dbipufep4durid5/app.bsky.feed.post/3mnb6xaatmk2h,2026-06-01 23:05:18.094000+00:00,"We are open-sourcing (AGPLv3) and going live with our mobile app beta on June 15th. This beta is locked to Android users and Plutonium iOS users. We plan a full rollout in 1 month to Google Play, Apple App Store, F-Droid, and Obtanium after we knock out a few more bugs and features.",36,213,2026-06-01,0.0013,negative
at://did:plc:5hblrj2hwiog4fox7islneg4/app.bsky.feed.post/3mnadwkimks2r,2026-06-01 15:01:44.251000+00:00,"whenever i think ""i own enough t shirts already"" i see something like this",505,3583,2026-06-01,0.9968,positive
at://did:plc:kdkvmb7u5anlir5j25zq6dav/app.bsky.feed.post/3mnatdzd55s23,2026-06-01 19:37:42.109000+00:00,"It’s my birthday!! There’s not much particularly exciting about 31, but that isn’t gonna stop me from getting some apple pie tonight",4,50,2026-06-01,0.0074,negative
at://did:plc:aunpu65mdrhwfie7ynymlzeh/app.bsky.feed.post/3mnb7kbq2ad2o,2026-06-01 23:15:56.923000+00:00,"Watch the full episode of the Bulwark Podcast at The Bulwark and YouTube, or listen on Apple Podcasts, Spotify or wherever you get your podcasts:",3,29,2026-06-01,0.0143,negative
at://did:plc:neogli5rfbw3xogzgffl3z5l/app.bsky.feed.post/3mnb3hmsrd22c,2026-06-01 22:02:53.172000+00:00,"Thong Song just came on my curated essentials playlist, love when Apple Music gets it right",0,26,2026-06-01,0.8577,positive
at://did:plc:awhaebcd4mup4y7q27q7ioeu/app.bsky.feed.post/3mna56uuf3c23,2026-06-01 13:01:07.368000+00:00,King Apple! 👑🦭,10,45,2026-06-01,0.9982,positive
at://did:plc:grin4hc3ff6zxv7lzn7njdcr/app.bsky.feed.post/3mnauyxoshc2m,2026-06-01 20:07:18.806000+00:00,"Sitting down in front of coworkers, blushing as I open the lunch she packed for me: - Capri sun - Bluey snack container - Bluey branded apple slices - Second capri sun - Bluey fruit snacks",3,85,2026-06-01,0.9958,positive
at://did:plc:dqrcz4py2hrv4lzcs6ygoagj/app.bsky.feed.post/3mn7tjomvrc2b,2026-06-01 10:08:12.513000+00:00,me: are they synchronized yet? apple: mh? me: the passwords apple: what passwords me: I can see them on the other machine apple: yea? me: yea apple: why are you looking for them here then,3,87,2026-06-01,0.0011,negative
at://did:plc:wg2aje2ehktwtinvmpveisxb/app.bsky.feed.post/3mnanj3gbf22e,2026-06-01 17:53:09.654000+00:00,Looks like Tim Apple is also in the same boat. £6 on iBooks.,10,39,2026-06-01,0.0051,negative
at://did:plc:te7gxx3zow3kcjkmhb3w3p2h/app.bsky.feed.post/3mnao2zceqs2y,2026-06-01 18:03:11.410000+00:00,"#oliveartclub Tried a little bit more abstract approach, fun!",2,27,2026-06-01,0.8476,positive
at://did:plc:6ybjezkl7i52hvsdi7gsikq3/app.bsky.feed.post/3mnawjqmj3c2k,2026-06-01 20:34:35.561000+00:00,It's June 1st and I am having one of the most delightful days.i saw a cardinal! I saw four groundhogs! I had an apple maple bagel!,0,33,2026-06-01,0.9998,positive
at://did:plc:4hawmtgzjx3vclfyphbhfn7v/app.bsky.feed.post/3mnazk365ck22,2026-06-01 21:28:27.851000+00:00,Apple should let you import/export Shortcuts as json. Imagine what LLMs could do in minutes…,0,21,2026-06-01,0.001,negative
at://did:plc:ltxbfp6hnobmf5msndhx37e5/app.bsky.feed.post/3mnazku5ckc2s,2026-06-01 21:28:54.038000+00:00,happy pride month to me n apple specifically,2,11,2026-06-01,0.9999,positive
at://did:plc:v6xd7qcm4tsgb4ndo547vh4n/app.bsky.feed.post/3mnb5amg6ek2v,2026-06-01 22:34:45.363000+00:00,Really proud of today's NBA Finals Preview podcast. Think we struck the perfect balance between informative and fun. YouTube 📺: bit.ly/4u6uVf6 Apple 🍎: apple.co/3CUsJOD Spotify ✳️: bit.ly/44kso6Y,3,25,2026-06-01,0.999,positive
at://did:plc:4riz62b7uoenld33sz3itujn/app.bsky.feed.post/3mnb6ffwuls2w,2026-06-01 22:55:20.084000+00:00,question for people who can't see the apple: how do you beat it without porn access?? do you just think about boobs as a concept???? that sounds immensely unsatisfying. I would like to donate porn for people who can't see the apple. Rinnji hole for people who can't see the apple.,0,9,2026-06-01,0.0013,negative
at://did:plc:cs675sj2rlghz65p4hzii7b6/app.bsky.feed.post/3mnaqfrigcs2y,2026-06-01 18:44:59.808000+00:00,"It finally happened to me: Apple somehow managed to force an update to the ""liquid glass"" iOS onto my phone overnight, despite my best efforts. R.I.P. to a responsive interface and a lack of wasteful visual clutter",3,100,2026-06-01,0.001,negative
at://did:plc:yrt5gwlcn3kn4xgeoef4hbpy/app.bsky.feed.post/3mnarznqe2s2o,2026-06-01 19:14:00.704000+00:00,“Executives at indexes should go to jail” is going to be a second bite at the apple that we missed in 2009 when only one banker was criminally convicted.,5,45,2026-06-01,0.0014,negative
at://did:plc:lhron4cb5sm4gfgzzzm54r2y/app.bsky.feed.post/3mnaoadze6k2b,2026-06-01 18:06:10.422000+00:00,"howdy there, Apple Bumpkin! 🍎 #mlp",10,46,2026-06-01,0.0072,negative
at://did:plc:4mvxzjukalrcg754hpkb62i5/app.bsky.feed.post/3mnajqq3a222x,2026-06-01 16:45:51.224000+00:00,APPLE CAR !,0,9,2026-06-01,0.9995,positive
at://did:plc:6uzuwcxaif2utlzcbvzd4uet/app.bsky.feed.post/3mnawwq3x6k2k,2026-06-01 20:41:51.212000+00:00,"I did spend way too much time last week trying to approximate the flowers, but it was a disaster. Slightly happier with my approximation of the apple, though I'm still having issues with color blending and accuracy using the apps that came with my phone. But this is...OK? 😅",2,37,2026-06-01,0.0017,negative
at://did:plc:v4kpg55totpnmg3qm4auu7nw/app.bsky.feed.post/3mnb2wqvtyk26,2026-06-01 21:53:27.042000+00:00,"Very much enjoying Criminal Record on Apple TV. Peter Capaldi is especially brilliant as the saturnine, morally-ambiguous detective with his famous catchphrase ... ... 'You must go on. I can't go on. I'll go on.'",6,59,2026-06-01,0.9998,positive
at://did:plc:wxh3p65lkg4wrryu634k6dua/app.bsky.feed.post/3mnavy5vgjc2n,2026-06-01 20:24:45.503000+00:00,"Clematis Montana Wilsonii in bloom at the orchard entrance. It has wound through the apple tree, attracting the pollinators 🌱 #GardensHour",2,24,2026-06-01,0.998,positive
at://did:plc:knj5sw5al3sukl6vhkpi7637/app.bsky.feed.post/3mnauohk3mc2n,2026-06-01 20:01:26.333000+00:00,Apple AirPods Pro 3 (used- like new) is $151.24 on Amazon Resale (discount at checkout) amzn.to/4uKTuiY #ad,1,15,2026-06-01,0.0015,negative
at://did:plc:ebcja2mqsrbxbwmst2wx3uz7/app.bsky.feed.post/3mnaxetrvkc24,2026-06-01 20:49:44.854000+00:00,Pink lady apple old fashioned. Yes brother.,1,8,2026-06-01,0.9996,positive
at://did:plc:o5uyrhdx6sq5nktvqe3x66mt/app.bsky.feed.post/3mnb5wwwcpk2y,2026-06-01 22:47:14.574000+00:00,"Scene: The dog, begging for a bite of my apple, even though a slice of the exact same apple I am eating lies in her bowl, ignored",0,8,2026-06-01,0.0003,negative
at://did:plc:a45ckefm6b2f6hprykrca4lk/app.bsky.feed.post/3mnadiz36cc2k,2026-06-01 14:54:09.732000+00:00,Entering my blue period.,3,44,2026-06-01,0.9696,positive
at://did:plc:4mgejg6a7bzlfzypt6vdnzbu/app.bsky.feed.post/3mnahsrusm22e,2026-06-01 16:11:12.735000+00:00,Comms are officially back open! Please submit a response here > forms.gle/b1fdhrMM63xC... This closes on the 7th!,11,66,2026-06-01,0.0255,negative
at://did:plc:r6ikgb6a3bzbwm67e5feni3l/app.bsky.feed.post/3mnawxsazp22y,2026-06-01 20:42:27.045000+00:00,Good news I found an unredeemed apple gift card that has enough for me to get replacement,0,13,2026-06-01,0.0546,negative
at://did:plc:6tug5iys7tltqdu454u3kond/app.bsky.feed.post/3mnb2uzeou22h,2026-06-01 21:52:28.801000+00:00,in my humble objective opinion it sucks that the evil adrenochrome soros x thiel x netanyahu x obama x stephen miller psyop to defeat rainbow capitalism worked on so many people because aesthetically it slaps,8,40,2026-06-01,0.0024,negative
at://did:plc:5c23kkbtkdyezymg4hn5x5rr/app.bsky.feed.post/3mnanvfwvo22y,2026-06-01 18:00:03.344000+00:00,"NEW: Apple readies iOS 27 service that will let users split bills for dinners, events by taking a photo of a receipt and assigning items to friends. This will be part of Apple Wallet and Cash, taking on Venmo and Splitwise. www.bloomberg.com/news/article...",5,29,2026-06-01,0.0042,negative
at://did:plc:fe2uaxwtl2lzek7gkxfwq5lv/app.bsky.feed.post/3mna6ypsakc2u,2026-06-01 13:33:28.143000+00:00,"today is an international holiday because today, Tiny Bunny Praline turns TWO YEARS OLD!! she got two strawberries and a bundle of apple branches 🍓🌿",71,234,2026-06-01,0.999,positive
at://did:plc:izttpdp3l6vss5crelt5kcux/app.bsky.feed.post/3mn7mc45nnc2k,2026-06-01 07:58:42.066000+00:00,"It's hard for a country to claim to be independent while running on MMAGA (Meta, Microsoft, Apple, Google, Amazon). cybernews.com/tech/microso...",270,600,2026-06-01,0.0004,negative
at://did:plc:w6k5ff2uuowtlofdmmjwujcr/app.bsky.feed.post/3mn7yc65rj22k,2026-06-01 11:33:29.068000+00:00,Yesterday I had no internet for a few hours and ate an apple. It felt like an extremely minor insight into what it's like to live as a horse.,39,279,2026-06-01,0.0538,negative
at://did:plc:cbewphca6mfytml5ictx5oli/app.bsky.feed.post/3mnb2v5sosc2m,2026-06-01 21:52:33.459000+00:00,A.J. Brown was (finally) traded to New England. I have some thoughts. APPLE: podcasts.apple.com/us/podcast/a... SPOTIFY: open.spotify.com/episode/6GJX...,1,13,2026-06-01,0.0937,negative
at://did:plc:56e7yw4nkilbpsc5dzhq4xdf/app.bsky.feed.post/3mnb2qqtmck2f,2026-06-01 21:50:05.643000+00:00,"This is trump 101. Accuse the Libs of doing what this ding ding and his party do 24/7. Ain’t gonna work apple chewer. Oh, and fuck all the way off PP!",0,17,2026-06-01,0.0005,negative
at://did:plc:vlblikmsgpx2i7fvxinrsvzu/app.bsky.feed.post/3mnaevkdmys2y,2026-06-01 15:19:04.280000+00:00,"The same way a computer company can trademark ""Apple""",0,16,2026-06-01,0.0056,negative
at://did:plc:pdzqogq3v5ymr4fimcz3syrb/app.bsky.feed.post/3mnab4gsccs2u,2026-06-01 14:11:20.463000+00:00,"𝘞𝗂𝖭𝗲 ꔋ𝗂𝗽 𝗼𝗙 ꔋ𝗼𝖽𝖠𝘆 Full of the fresh aromas of nashi pear and Granny Smith apple. Fresh and refined, flavors of juicy green pear and apple, tannins that provide a refreshing acidity with a delicious mineral finish. Calabria Bélena Pinot Grigio - Wijnshop Tichelaar share.google/rIZWWWbcindy...",0,45,2026-06-01,0.9999,positive
at://did:plc:i74fzxomow6w5ndo6vht5sjq/app.bsky.feed.post/3mnbaaioevk2u,2026-06-01 23:28:22.659000+00:00,"In the late 70's horror movies were candy apple red. For a long time they were brown. Blue came in for a while in the early 2000's. Then green, when the whole ""metaphor for grief"" phase happened. But now they appear to be yellow! So that's something!",2,25,2026-06-01,0.039,negative
at://did:plc:2zmxikig2sj7gqaezl5gntae/app.bsky.feed.post/3mnb2vllbgk2b,2026-06-01 21:52:47.898000+00:00,Apple out here doxxing my phone number on stream from my own computer's settings page 🤦‍♂️,0,26,2026-06-01,0.0012,negative
at://did:plc:cgt7y53iumh5lxu4u6fxihuj/app.bsky.feed.post/3mna3uspg6s2x,2026-06-01 12:37:35.824000+00:00,"Guillermo del Toro raves that Apple TV+ horror-comedy WIDOW'S BAY ""may very well be the best streaming series in a long time"": bloody-disgusting.com/tv/3953982/w...",23,116,2026-06-01,0.9996,positive
at://did:plc:7exlcsle4mjfhu3wnhcgizz6/app.bsky.feed.post/3mna4lczjpc2t,2026-06-01 12:50:11.130000+00:00,"This fall, Nvidia will officially become a consumer PC chipmaker like Intel, AMD, Apple, and Qualcomm, putting a complete computing chip — not just graphics — into the very heart of laptops and mini-PCs. Read more from @seanhollister.bsky.social:",61,236,2026-06-01,0.9983,positive
at://did:plc:v6xd7qcm4tsgb4ndo547vh4n/app.bsky.feed.post/3mnatvdmrnk2a,2026-06-01 19:47:23.366000+00:00,The picks are in ... YouTube 📺: bit.ly/4u6uVf6 Apple 🍎: apple.co/3CUsJOD Spotify ✳️: bit.ly/44kso6Y,0,8,2026-06-01,0.0041,negative
at://did:plc:s5xvwzyhy352e3yguorxm53o/app.bsky.feed.post/3mnavf2idj22p,2026-06-01 20:14:04.395000+00:00,"Picked up my iPhone 12 mini to get it ready for whatever new iOS stuff comes out of WWDC next week. It's so dang light, why did Apple stop making mini phones??",3,28,2026-06-01,0.0015,negative
at://did:plc:kcj35i7f3dmexeai3lluktdl/app.bsky.feed.post/3mnb45j26gk2x,2026-06-01 22:15:07.417000+00:00,"declaring it hot horse summer and by that I mean it’s time to go back to gnawing on and snapping big carrots. teeth out, crunch crunch. if you never stopped, well, here’s an apple, chomp away.",3,22,2026-06-01,0.0058,negative
at://did:plc:ald66kfkgpyg3626ogdzzpjz/app.bsky.feed.post/3mnb3gby4xs27,2026-06-01 22:02:08.259000+00:00,"This episode ft. Curry Barker's #darkromance #horrorfilm, Obsession (2026). Hosted by @indiejeannie.com + @atmanrising.bsky.social, EVIL*ASTERISK #podcast is on YouTube, Spotify, Apple, Amazon, Audible + more! #indie #indiefilm #moviereview #filmreview #horror #indiemovie #horrormovie #currybarker",5,14,2026-06-01,0.0058,negative
at://did:plc:tne4x6uotoief6t5cildh75l/app.bsky.feed.post/3mnamtmdsy22i,2026-06-01 17:41:09.208000+00:00,"Very tired of my wireless earbuds falling out of my ear and hitting the ground. You know what would solve that, @Apple? WIRED EARBUDS!",2,20,2026-06-01,0.0005,negative
at://did:plc:lrphxvv25aibthe7xoc2eeyy/app.bsky.feed.post/3mnailrpa3k23,2026-06-01 16:25:11.419000+00:00,"Welp that's disappointing, only supports apple and Google sign in so not touching it.",0,13,2026-06-01,0.0003,negative
at://did:plc:kek7ex2hoxgqgdbkzha5i2sm/app.bsky.feed.post/3mnaaakybjc2u,2026-06-01 13:55:45.345000+00:00,despite the end of May I am still just one apple tall,0,21,2026-06-01,0.9953,positive
at://did:plc:y7lkklxd4hs7mne3zgwm25ft/app.bsky.feed.post/3mnahyoeuxs2i,2026-06-01 16:14:30.355000+00:00,on the plus side this might be the best apple juice i've ever had in my life???,1,19,2026-06-01,0.9998,positive
at://did:plc:xz3zie5fkrflkzs3alc3mkxf/app.bsky.feed.post/3mnakxxvhys2f,2026-06-01 17:07:48.055000+00:00,"And saved Apple. The record companies were so freaked out they handed Apple iTunes their digital music biz since if they gave it to Microsoft, their cd biz would have collapsed overnight.",0,13,2026-06-01,0.0005,negative
at://did:plc:ckd35qj4byk534wazc5t7fuo/app.bsky.feed.post/3mnbbnignik2r,2026-06-01 23:53:32.323343+00:00,🌊 NASDAQ AI Analysis: 🍎 Fresh Green Apple Crash Protection: 94.2% | Fractal Entropy Spike Detected Full Real-time Report: https://chaosguardian.com #NASDAQ #Stocks #AI #Trading #Finance #StockMarket #NASDAQ #KOSPI #AI,0,8,2026-06-01,0.0059,negative
at://did:plc:5qs6u23bx7zomza4nwakcgsj/app.bsky.feed.post/3mnb5izxcbk2s,2026-06-01 22:39:27.991000+00:00,"All the Adventures continues with the Apple II game The Coveted Mirror, a game with a confusing plot and far more emphasis on graphics than most entries for the Project. bluerenga.blog/2026/06/01/t...",2,15,2026-06-01,0.1415,negative
at://did:plc:6tqtgqcimdtnbkqnyssqqgu6/app.bsky.feed.post/3mnazsgkuqc27,2026-06-01 21:33:08.237000+00:00,"The Fey Duology, including dark fantasy novels Duainfey and Longeye, is now available for purchase in electronic format from! Amazon, Apple, Kobo, Smashwords, and Baen. Link to the Baen catalog page: www.baen.com/the-fey-duol... Go forth, Big Book, and Find Your Audience.",5,19,2026-06-01,0.9987,positive
at://did:plc:vf3wsfgaqudbjd5hm25w4pgv/app.bsky.feed.post/3mnayq7zq2c2s,2026-06-01 21:14:00.534000+00:00,The apple doesn’t fall far from the tree,1,5,2026-06-01,0.996,positive
at://did:plc:ivi23zcn3xw6kthcafykdlsf/app.bsky.feed.post/3mnb4cmx3ds2g,2026-06-01 22:17:59.283000+00:00,"When I say something critiquing nonblack people, & you hop out & say no not me, we'e all not like this! From my perspective, it's like ok goody two shoes. I guess you want me to put this apple you have on my desk. I already brought lunch from home though.",1,25,2026-06-01,0.9983,positive
at://did:plc:bnokmh46ndqelhgwhbspsxnv/app.bsky.feed.post/3mnagbhuirc2i,2026-06-01 15:43:38.079000+00:00,"BLUE HERON (2025) Streaming: June 23, 2026 VOD/Digital (Apple, Amazon, Fandango at Home, etc.) #BlueHeron whentostream.com/acclaimed-dr...",1,16,2026-06-01,0.9617,positive
at://did:plc:hdbjir5tbibek2vqm7bobl36/app.bsky.feed.post/3mnb2i2ptdk2q,2026-06-01 21:45:14.006000+00:00,this is still on repeat btw,0,4,2026-06-01,0.019,negative
at://did:plc:ndei3betdpxtopqqlqzztojo/app.bsky.feed.post/3mnalsiusik2h,2026-06-01 17:22:38.267000+00:00,It's the July People's Pop Poll!,4,36,2026-06-01,0.9923,positive
at://did:plc:c6z5p2z3cde6rqqmx6viuw2g/app.bsky.feed.post/3mnawmp55622o,2026-06-01 20:36:14.672000+00:00,i had to use apple pay at kaiser and it took me like 3 minutes to make it work bc i have never paid with apple pay irl before. i need cards please.,0,5,2026-06-01,0.0022,negative
at://did:plc:s45o2coi53wf55ufwd6r7i7j/app.bsky.feed.post/3mnagnxx6gc2w,2026-06-01 15:50:37.448000+00:00,this episode includes: - a story about alan punching a parakeet by accident - me briefly blacking out while yelling about apple tv's Sugar - a really satisfying conversation about The Suitcase,1,22,2026-06-01,0.9986,positive
at://did:plc:hqv3u55ks5fsczoo6ep3gsxq/app.bsky.feed.post/3mnacmz6ukk27,2026-06-01 14:38:30.379000+00:00,Genuine GM parts for your Genuine Apple Computer,0,7,2026-06-01,0.9997,positive
at://did:plc:f3aabvutzlhn42mamoncti25/app.bsky.feed.post/3mnb5yyvges2q,2026-06-01 22:48:23.750000+00:00,It's like if zucchini and an apple had baby. They don't get mushy when cooked.,0,3,2026-06-01,0.9505,positive
at://did:plc:aunpu65mdrhwfie7ynymlzeh/app.bsky.feed.post/3mnadp4v5zc2t,2026-06-01 14:57:34.859000+00:00,"Watch the full episode at The Bulwark and YouTube, or listen on Apple Podcasts, Spotify or wherever you get your podcasts: bit.ly/4vdQRWG",1,18,2026-06-01,0.0112,negative
at://did:plc:r3jwo43kbojzk2yhwqibvlca/app.bsky.feed.post/3mn7ux3ytoc2y,2026-06-01 10:33:36.483000+00:00,My crapapple.,3,68,2026-06-01,0.0002,negative
at://did:plc:ya7gfadgypyypiva5pboi6mi/app.bsky.feed.post/3mnaumo5tts2u,2026-06-01 20:00:26.163000+00:00,"I used to have a mock-tirade more or less like ""I would like to eat an apple but the farmer has it behind a paywall,"" because people understand that other forms of labor deserve compensation, but not journalism. (On the other hand, I write for the Guardian, which has no paywall.)",2,25,2026-06-01,0.0012,negative
at://did:plc:omkb4ov5w2bintbbbb47lile/app.bsky.feed.post/3mnajndnev225,2026-06-01 16:43:57.533000+00:00,"This is awesome and Apple is going to hate it. I have replaced an iPhone battery. It took me nearly an hour: specialized tooling to get the bloody thing open, very steady hands, and a great deal of cursing.",9,32,2026-06-01,0.0011,negative
at://did:plc:rw3g4gmfpoezr3xjmh2irrqp/app.bsky.feed.post/3mnaclirii22g,2026-06-01 14:37:39.606000+00:00,"OUT EARLY!! Our new track ""The World"" is streaming NOW on Bandcamp, Apple Music, YouTube, and more! This song is about the world, the whole world.",6,21,2026-06-01,0.9957,positive
at://did:plc:6qjxhdfcv73jie7n4436ef7z/app.bsky.feed.post/3mnapyaielx26,2026-06-01 18:37:21.491000+00:00,"Functions 32: A Magic Mouse on wheels Discussing Google I/O, Ferrari Luce, WWDC and Mac delves deeper into Apple ecosystem. www.patreon.com/posts/1593914...",0,8,2026-06-01,0.9913,positive
at://did:plc:4lz5bq2jmsb23ew6ux23nnjp/app.bsky.feed.post/3mn74l2odbs2s,2026-06-01 03:17:22.635000+00:00,"damn, that's the second kirk where they are looking for an adam's apple",32,168,2026-06-01,0.0015,negative
at://did:plc:anxti3fo2e5srishuff3exkc/app.bsky.feed.post/3mnb32fefyk2f,2026-06-01 21:55:29.154000+00:00,Just got an email congratulating me for turning on Gemini on my Apple device - a thing I neither desired nor turned on. So now I’m off to [redacted] a Google [redacted] until he [redacted].,1,13,2026-06-01,0.0002,negative
at://did:plc:vlblikmsgpx2i7fvxinrsvzu/app.bsky.feed.post/3mnah6p77xs2y,2026-06-01 15:59:58.852000+00:00,"It's a trademark, if I filed an ""Apple"" trademark to sell computers, I would be sued in a similar manner",0,15,2026-06-01,0.0011,negative
at://did:plc:tsix4scvgfvre3vr62xyj4v2/app.bsky.feed.post/3mnb74j7tzt2c,2026-06-01 23:08:05.726000+00:00,Monobank accepts 🍏Apple Pay & 🍀Google Pay send.monobank.ua/jar/7uwhtDGmiD *spotfund spot.fund/rlnzphsc DonorBox donorbox.org/light-will-p... 🧩Bitcoin bc1qwcmc2nqz4jnfyeuwx03vn3y8u2lh8zfz4nxkgd 👕TeamYuri Merch bonfire.com/store/teamyu... All ways to help listed here 👉 chornomorets.notepin.co,4,6,2026-06-01,0.0032,negative
at://did:plc:xnscbn5t2xgyflh3ojsvflro/app.bsky.feed.post/3mnawfjqvhs24,2026-06-01 20:32:14.148000+00:00,Ngl I hope that to make up for it Radioapple will end up beautiful/wholesome as hell by season 5 cuz Lucifer deserves to be profoundly and devotedly loved by someone 😭 in Criminal by Fiona Apple I still believe 🙂‍↕️,0,14,2026-06-01,0.9996,positive
at://did:plc:ucaezectmpny7l42baeyooxi/app.bsky.feed.post/3mn7trtoj722k,2026-06-01 10:12:46.245000+00:00,@apple give swift static linking......,0,10,2026-06-01,0.0162,negative
at://did:plc:qdt4u6yiixwgpv2obyijdvse/app.bsky.feed.post/3mnay2y7t2c2o,2026-06-01 21:02:07.701000+00:00,Got an ad for Apple Watch’s “cycle tracking” feature. Wonder if that’s targeted~,0,3,2026-06-01,0.0068,negative
at://did:plc:bnokmh46ndqelhgwhbspsxnv/app.bsky.feed.post/3mna7y3km4c2i,2026-06-01 13:51:00.732000+00:00,"IS GOD IS (2026) Streaming: June 2, 2026 VOD/Digital (Apple, Amazon, Fandango at Home, etc.) #IsGodIs whentostream.com/revenge-thri...",3,17,2026-06-01,0.0106,negative
at://did:plc:vsyk52ixdmsthhkhphkwjqmz/app.bsky.feed.post/3mnb5ocfjlc2p,2026-06-01 22:42:21.666000+00:00,"(1/2) ""A secret government agency creates Mac, an intensley psychic woman with the ability to alter time itself. Weirdo goddess Eris teases Mac from a distance as she finds herself ready to throw one hell of a n apple.""",0,7,2026-06-01,0.9872,positive
at://did:plc:jpibuzy3ccomly7fllguubse/app.bsky.feed.post/3mnb4ow62mk2f,2026-06-01 22:24:51.600000+00:00,While we’re freaking out over TayStory… didn’t Taylor have a tumblr post where she wrote “lov(h)er” or am I crazy? Because this is in the Apple Music Pride category,0,8,2026-06-01,0.018,negative
