tweet_id,fecha_utc,contenido_texto,retweets,favoritos,fecha_limpia,puntuacion_sentimiento,sentimiento
at://did:plc:2k26rh7qzdxhds3tmx7fdcxu/app.bsky.feed.post/3mms5gmhvxk2p,2026-05-26 23:28:10.671000+00:00,apple twinks in YOUR areas?!?!? click now to chat with our delicious fruity fruit boys we promise it's not a scam,1,124,2026-05-26,0.9977,positive
at://did:plc:hmjkyrt6pge5mi6z6phkzqwm/app.bsky.feed.post/3mms3nf5yak2z,2026-05-26 22:56:10.400000+00:00,blehhh #oc #art,36,396,2026-05-26,0.0046,negative
at://did:plc:sf565rmwryazfxvls3xfh3mu/app.bsky.feed.post/3mmrubgd6ms24,2026-05-26 20:44:12.772000+00:00,"Happy birthday, My Sour Apple. #harlequin #TFC #jester #thefreakcircus #art #comic",11,84,2026-05-26,0.9916,positive
at://did:plc:3ak6f6h3f4f5hw2fv32wupdg/app.bsky.feed.post/3mms22thnrs26,2026-05-26 22:27:54.114000+00:00,Soon.,3,62,2026-05-26,0.9987,positive
at://did:plc:j6ssy657ii62h3i5r4zga76c/app.bsky.feed.post/3mms27paoc224,2026-05-26 22:30:37.386000+00:00,The big apple,0,12,2026-05-26,0.9995,positive
at://did:plc:s6yp6jam5og3tftozaw7pjth/app.bsky.feed.post/3mmriomjohc2m,2026-05-26 17:16:50.586000+00:00,I am not buying a fucking apple watch to track my steps. Jesus Murphy.,0,91,2026-05-26,0.0004,negative
at://did:plc:dirjzfgzglbr6ycbb7mffjfy/app.bsky.feed.post/3mms75klkkk2s,2026-05-26 23:58:54.186000+00:00,"Dropped by a ""department store"" to buy a toaster? Were you also looking for some Crystal Pepsi, a Sports Walkman, and an Apple IIc?",0,22,2026-05-26,0.0003,negative
at://did:plc:w6adnkpcgqb67lqi5nxcy7l5/app.bsky.feed.post/3mmrn33uxo22v,2026-05-26 18:35:24.300000+00:00,“We’ve seen the pictures on your phone” You mean these??? Ever since Apple moved the camera button I’ve been taking mad pictures of what looks to be my butt,7,197,2026-05-26,0.0007,negative
at://did:plc:tz4wzl2yjgd3xfr6b63ksjnw/app.bsky.feed.post/3mmrjtd7z3c2n,2026-05-26 17:37:22.344000+00:00,"everyone killing their desktop apps (mostly apple music, which is unusable). phone touch buttons that don't work",0,101,2026-05-26,0.0001,negative
at://did:plc:cwzjesjifumxsnkme2pk3plc/app.bsky.feed.post/3mms2a2chlc22,2026-05-26 22:30:49.051000+00:00,got some old film from 2018 developed and it came in today :p,3,19,2026-05-26,0.9549,positive
at://did:plc:w5dk6pygx5sdrslc5vo56h75/app.bsky.feed.post/3mmreiyle5c2y,2026-05-26 16:02:06.930000+00:00,"Apple has open-sourced corecrypto, the foundational cryptographic library in Apple operating systems security.apple.com/blog/formal-... github.com/apple/corecr...",12,25,2026-05-26,0.9808,positive
at://did:plc:aunpu65mdrhwfie7ynymlzeh/app.bsky.feed.post/3mms2w2xlv42t,2026-05-26 22:43:07.678000+00:00,"Watch the full episode of the Bulwark Podcast at The Bulwark and YouTube, or listen on Apple Podcasts, Spotify or wherever you get your podcasts:",6,27,2026-05-26,0.0143,negative
at://did:plc:q2pghw577kjyrv7bsqef4voa/app.bsky.feed.post/3mmryzkalnk2a,2026-05-26 22:09:17.146000+00:00,A defense of the USB placement on the Apple magic mouse since everyone jokes about it I hate that I have to make this.,3,28,2026-05-26,0.0009,negative
at://did:plc:wyoactb6aac5mwvlzjlohmpe/app.bsky.feed.post/3mmrvfchyok2p,2026-05-26 21:04:16.699000+00:00,"Apple leaves no doubt about the risk of Bill C-22 : ""as drafted, this bill allows the Government of Canada to force companies to break encryption by inserting backdoors into their products, something Apple will never do.""",6,21,2026-05-26,0.0559,negative
at://did:plc:ty2kxmxjmtealqi2kc7f4pww/app.bsky.feed.post/3mms2gn35ns2r,2026-05-26 22:34:30.076000+00:00,"Apple really set the stage for ""AI"" when they borked Save As…in macOS.",0,12,2026-05-26,0.9311,positive
at://did:plc:e6ntzm7g6mpsym5s42rrmwie/app.bsky.feed.post/3mms3i2hv522i,2026-05-26 22:53:11.420000+00:00,it does genuinely kill me how it starts eating an Apple in the middle of having a panic attack,3,15,2026-05-26,0.8729,positive
at://did:plc:b4eicqrguc4by4jxy5bns54h/app.bsky.feed.post/3mmrto5m27k22,2026-05-26 20:33:26.091000+00:00,My morning was spent at the Apple store upgrading my iPad. The store employees wore green long-sleeved uniforms with a white Apple logo. #AlphabetChallenge #WeekUforUniform #ECK #green,0,14,2026-05-26,0.0017,negative
at://did:plc:7zfp3tykhpnwia5oyhttrmds/app.bsky.feed.post/3mms26xodmk27,2026-05-26 22:30:12.755000+00:00,MUSIC VIDEO “Be With Me Tonight” {2005-Solo Piano & Vocal } -ALBUM (2021) “Interlude Songs Of The Almost Naked Kind” Song #3 -Nicholas Jack Marino-at-Apple-Pandora-Amazon-Spotify-YouTube Music-All Others -YouTubeVideos www.youtube.com/watch?v=p4_e...,0,35,2026-05-26,0.0121,negative
at://did:plc:o5fnqafgvsocld6jetjju6nu/app.bsky.feed.post/3mms3pwpwsc2g,2026-05-26 22:57:35.902000+00:00,Ballpark #25. Go Reds.,1,9,2026-05-26,0.8979,positive
at://did:plc:hisqswiqf2t7oygtzzftjtzv/app.bsky.feed.post/3mmrztwvbmk24,2026-05-26 22:24:02.835000+00:00,REMINDER: DON'T FORGET TO SUPPORT US!! C(at)apple is still a young concept we hope to expand on (among other ideas! But we're really vibing this one a lot.) #mod #Mario64coop #n64,8,27,2026-05-26,0.984,positive
at://did:plc:an2e3qjrwpfizkms3k2li23v/app.bsky.feed.post/3mmrumexigk2u,2026-05-26 20:50:20.443000+00:00,"remember when you guys used to spend all your time ripping off Apple UI decisions? Can you get back to that? even by stealing the design of the original iphone keyboard from 2007, I'm sure it'd do better than this thing",1,54,2026-05-26,0.0006,negative
at://did:plc:bnokmh46ndqelhgwhbspsxnv/app.bsky.feed.post/3mmrwshjqz22l,2026-05-26 21:29:31.946000+00:00,"ERUPCJA (2025) Streaming: June 2, 2026 VOD/Digital (Apple, Amazon, Fandango at Home, etc.) #Erupcja whentostream.com/erupcja-gets...",0,13,2026-05-26,0.0054,negative
at://did:plc:obxijwetkiyszit3akbzp2kg/app.bsky.feed.post/3mmrwbjfrbc22,2026-05-26 21:20:03.490000+00:00,podcasts.apple.com/au/podcast/t... If Iran had returned Australians to us tortured and sexually assaulted there would be international outrage. But it was the state of Israel that did it and so the media and political caravan moves on. The latest “Truth Lies & Media” has dropped!⚡️ Apple&Spotify,35,60,2026-05-26,0.0004,negative
at://did:plc:7qz2dtwezgjivd3jipbj7s4p/app.bsky.feed.post/3mms2argn4s2r,2026-05-26 22:31:13.314000+00:00,Does he know hes one apple tall,0,6,2026-05-26,0.8677,positive
at://did:plc:lqvsqsm4bjxqeue3bulyhvwl/app.bsky.feed.post/3mmryeck2322v,2026-05-26 21:57:24.436000+00:00,"Caramel Apple Pie has just stolen tiramisu's crown. So far, that's the best of the bunch. It has chunks of apple in it, which is nice.",0,6,2026-05-26,0.9998,positive
at://did:plc:6ef3aqehy5yatvmythdnk45v/app.bsky.feed.post/3mmrkzk3f6k2f,2026-05-26 17:58:44.603000+00:00,"I do appreciate that Apple Music, while unusable, does manage to launch on my desktop automatically at the most confusing and unhelpful times. It's a three-dimensional approach to uselessness that really speaks to an artisanal commitment to the CRAFT of sucking",3,123,2026-05-26,0.1121,negative
at://did:plc:wf4t7xfzvgoa3ruuxuya6x5o/app.bsky.feed.post/3mmry3racvm2m,2026-05-26 21:52:37.812000+00:00,someone should do a study of the high line and figure out why it has the highest concentration of apple airpods max headphones anywhere on earth,0,15,2026-05-26,0.0026,negative
at://did:plc:dx4zyej2oxalmtcvfphuiilt/app.bsky.feed.post/3mmrlbuvtnk2l,2026-05-26 18:03:24.390000+00:00,Also on Apple Podcast & Spotify podcasts.apple.com/gb/podcast/v...,1,17,2026-05-26,0.0455,negative
at://did:plc:p6rte3d6t6yq5mns3oqxgiya/app.bsky.feed.post/3mmrsh72rxp22,2026-05-26 20:11:39.067000+00:00,Vallyries Courtside Report is now on Apple Podcasts! podcasts.apple.com/us/podcast/v...,2,17,2026-05-26,0.0775,negative
at://did:plc:wjvc76fsrmfqqtx5vuia7lrf/app.bsky.feed.post/3mmrxj5nsps2x,2026-05-26 21:42:13.348000+00:00,2/ Did not Google: “How long digital detox to get attention span back?” “How fast to feel comfortable digital detox” “How to make chili” Did Google: “Chihuahua Desert Research Institute hiking fee Apple Pay” Did not Google: “How to stop regretting things” “Myers-Briggs personality test free”,1,41,2026-05-26,0.0005,negative
at://did:plc:sx3eayoile47ihewwq45lrt7/app.bsky.feed.post/3mms2hif5gk24,2026-05-26 22:34:58.698000+00:00,Tree hugger; guilty as charged!,0,8,2026-05-26,0.0117,negative
at://did:plc:blu6g22k7gi22svvpjkysudt/app.bsky.feed.post/3mmrrhqiuf22t,2026-05-26 19:54:03.546000+00:00,apple was worried for blade lmao 😭 I think he consents its okayyyy,0,14,2026-05-26,0.0144,negative
at://did:plc:oo27i2igv5f6km4v7fg4olpj/app.bsky.feed.post/3mmraxl37tk2z,2026-05-26 14:58:41.092000+00:00,You gave us a very generous amount of time tbh heck it also @chiitan.love,164,479,2026-05-26,0.9998,positive
at://did:plc:dyurdpynhpt6l2jn3cm3twus/app.bsky.feed.post/3mmrtx7kgg22q,2026-05-26 20:38:30.129000+00:00,Wait until you find out they have those contracts for every other mobile phone you can buy in the US and you’re still better off with Apple,0,16,2026-05-26,0.0008,negative
at://did:plc:fthvwutui67adqfqy3kpnxkr/app.bsky.feed.post/3mmrks6orac2m,2026-05-26 17:54:37.773000+00:00,I still listen to CDs I bought in elementary school. I didn’t have to wait for Apple the tech company to negotiate with Apple the Beatles label to do so. I paid for it once and still get to enjoy it. Same with paper books. There’s no licensing and hoping the artist stays with a platform,9,33,2026-05-26,0.0127,negative
at://did:plc:ptbgkhbickbp455hjbng45ws/app.bsky.feed.post/3mmrz4qemsc2k,2026-05-26 22:11:04.246000+00:00,"I'm 3 years older than your dad, and though I used to be the person my friends called for computer help, tech complexity keeps 📈 while my brain is gradually 📉, and the lines crossed years ago. Every time Apple pushes a new iOS update everything looks different and is in a different place and I'm ???",0,42,2026-05-26,0.0292,negative
at://did:plc:ctphcgyhnllfluywokibtrgb/app.bsky.feed.post/3mmrxidijqs2d,2026-05-26 21:41:45.911000+00:00,hm don't remember this one,4,24,2026-05-26,0.0009,negative
at://did:plc:c7uvpcb6oyalmqwzwbbyniug/app.bsky.feed.post/3mmr6ikqi7k2c,2026-05-26 14:14:29.967000+00:00,she call me apple the way I be in cider,2,25,2026-05-26,0.9856,positive
at://did:plc:yoqmwkanwrwjbivmiub3hgjr/app.bsky.feed.post/3mmrp4j5enc2s,2026-05-26 19:11:59.250000+00:00,"The article you posted says the contract is with a company called Sumuri, not with Apple: “The agency awarded a $211,618 contract to the Delaware-based Sumuri, federal records posted on Wednesday show.”",0,24,2026-05-26,0.0026,negative
at://did:plc:2hwwem55ce6djnk6bn62cstr/app.bsky.feed.post/3mmrf4oe7qk2w,2026-05-26 16:13:07.294000+00:00,what a weird translation decision,3,40,2026-05-26,0.0011,negative
at://did:plc:wcl5xm7mqdy2zmz2ktapgn7w/app.bsky.feed.post/3mmre43teuk2p,2026-05-26 15:54:51.508000+00:00,"Trump toured a Thermo Fisher facility. Same day — he bought Thermo Fisher stock. He pushed Apple. Same day — he bought Apple stock. He called Micron ""hot"" on Fox News. Next day — he bought Micron stock. He told a crowd to ""buy a Dell computer."" Then he bought millions in Dell stock.",16,26,2026-05-26,0.0128,negative
at://did:plc:2ptqgg335yb5negavlhu6g6s/app.bsky.feed.post/3mmrswgij4c2n,2026-05-26 20:20:10.109000+00:00,"For those keeping track, that puts me at at least 13 edible species in my yard: - apple - red raspberry - golden raspberry* - black currant* - red currant - saskatoon* - haskap* - strawberry* - fiddlehead - kiwi* - birch - gooseberry* - watermelon berry (*planted by me)",0,38,2026-05-26,0.9985,positive
at://did:plc:7exlcsle4mjfhu3wnhcgizz6/app.bsky.feed.post/3mmr6upxbwc2v,2026-05-26 14:21:18.086000+00:00,"Apple may have decided designing its own car wasn’t worth the effort, but Apple’s former lead designer clearly seems to have never fully abandoned the idea. Read more from @andyjayhawk.bsky.social:",7,80,2026-05-26,0.9965,positive
at://did:plc:3ophpu6bi2jz6vyjblskq44w/app.bsky.feed.post/3mmraq73ubs2b,2026-05-26 14:54:33.675000+00:00,"""Work From Home? That's what you thought the company's WFH program was about? No no, Work From Highchair! We're out of desks, but daycare is empty, so we're making the most of it! Cry if you need anything. Lunch is at 11:45, I hope Apple Banana Medley sounds good, 'cause that's what you're having!""",27,223,2026-05-26,0.9189,positive
at://did:plc:3cwppmq66sgpklkz7qfahyky/app.bsky.feed.post/3mmraqig75s2c,2026-05-26 14:54:43.437000+00:00,Been baking again....I present to you...spiced apple caramel cookie slices,0,17,2026-05-26,0.9987,positive
at://did:plc:ehmkruqiniunazquhf3njjun/app.bsky.feed.post/3mmrk72jzfc2q,2026-05-26 17:43:55.889000+00:00,even Linux users use it! it was so popular that they ported it! Apple are fucking fools,0,14,2026-05-26,0.0029,negative
at://did:plc:53c6iilzqmigkgryx3bsbye3/app.bsky.feed.post/3mmr6p2t6dk2j,2026-05-26 14:18:08.159000+00:00,Now spinning in the home office - Apple Music’s Tears for Fears Essentials playlist.,0,16,2026-05-26,0.9967,positive
at://did:plc:4ooas7yfsdjtydczhlrtcwr5/app.bsky.feed.post/3mmr477ynsk2h,2026-05-26 13:33:29.225000+00:00,"New playlist SIRE RECORDS HISTORY 1976-1993, a loose chronology of Seymour Stein and Richard Gottehrer's highly influential label during its peak era 🟡 Spotify: open.spotify.com/playlist/4rs... 🟡 Apple: music.apple.com/us/playlist/... 🟡 YouTube: www.youtube.com/playlist?lis...",18,107,2026-05-26,0.0303,negative
at://did:plc:btphg2p4mnnjkz66it73t7if/app.bsky.feed.post/3mms66mam7c24,2026-05-26 23:41:35.737000+00:00,"If you've got a meeting, people will ask you less questions if you're eating a raw onion like an apple.",0,7,2026-05-26,0.0024,negative
at://did:plc:feuxfxzf4sdnnapvxvv4x3li/app.bsky.feed.post/3mmrxje64qc2f,2026-05-26 21:42:20.174000+00:00,Why am I hearing about ads for Apple Maps? Why does a map need ads in the first place??,0,4,2026-05-26,0.0003,negative
at://did:plc:sx3eayoile47ihewwq45lrt7/app.bsky.feed.post/3mmrmmdtcsk22,2026-05-26 18:27:09.314000+00:00,Today’s deck plein air (from photo taken earlier) painted to music by @raffic.bsky.social 🎶💕,1,11,2026-05-26,0.0139,negative
at://did:plc:pswuq3wt7a6cddmhzwu47h3w/app.bsky.feed.post/3mms5mbnfik2h,2026-05-26 23:31:20.642000+00:00,Apple Pie and Dill have the potential to be good but the rocket pop can only be of the underworld,0,3,2026-05-26,0.0214,negative
at://did:plc:bdwl3qewl7qim375mxvd5edg/app.bsky.feed.post/3mmrfkg7uxk2h,2026-05-26 16:20:47.301000+00:00,"I wish Apple Health's ""State of Mind"" would be able to answer this question itself based context clues it has access to.",0,18,2026-05-26,0.0032,negative
at://did:plc:nle5dyyousj3tz7marhlrhxe/app.bsky.feed.post/3mmqx7bxojk2z,2026-05-26 12:04:02.582000+00:00,This is a general way to turn off apple intelligence BUT it seems youll still have to go to each app in settings to turn off apple Intelligence & siri so its not allowed to “learn” from the apps you are using www.trustedreviews.com/how-to/how-t...,32,38,2026-05-26,0.0011,negative
at://did:plc:jvma5mntqzaptazcoh3343ps/app.bsky.feed.post/3mmrt626n5k23,2026-05-26 20:24:25.638000+00:00,"I am sick at the thought of corporations without even the pretense of morals. great hardware, Apple. Rubbish contract here. You should refuse all access.",0,7,2026-05-26,0.0001,negative
at://did:plc:ugkxlur5rhkh7jm4b43tp7zt/app.bsky.feed.post/3mmryvre2ok2w,2026-05-26 22:07:10.391000+00:00,"𝗠𝗢𝗡𝗗𝗔𝗬 (𝗛𝗼𝗹𝗶𝗱𝗮𝘆) 𝗥𝗨𝗡 1️⃣2️⃣ Fantastic morning run, Portals, Roxy Beach and Palma Nova … twelve kilometres completed. #12k #run #running #apple #marksandspencer #nike #nikerunning #runsky #thisis53 #consistency #endurance #inspiration #motivation #motivational #holiday #mallorca #spain",1,10,2026-05-26,0.0917,negative
at://did:plc:5djw6wywnxuqmfobsobh7flu/app.bsky.feed.post/3mmrt7vczs226,2026-05-26 20:25:27.648000+00:00,"""Basically all"" is doing a lot of lifting here. There are NEW records I have on Bandcamp that aren't on Spotify/Tidal/Apple, to say nothing of old ones.",0,8,2026-05-26,0.9983,positive
at://did:plc:yijualzbabwc2wfshmeq5tmy/app.bsky.feed.post/3mmqylke5dk25,2026-05-26 12:28:47.769000+00:00,Apple Justice #fanart #apollojustice,0,10,2026-05-26,0.0405,negative
at://did:plc:s5c7bzfahvdk765yr7snvtdy/app.bsky.feed.post/3mmrnbtfg6s2r,2026-05-26 18:39:10.288000+00:00,"As someone who has an Apple Music sub and buys vinyls, it’s nice to have access but there’s FUN to the friction for some things. I think that’s cool and good.",1,10,2026-05-26,0.9999,positive
at://did:plc:lepezdg32dpnefx5nt3fbwb4/app.bsky.feed.post/3mmrg2336o227,2026-05-26 16:29:33.701000+00:00,"John's Life Springs: Near deluge most of yesterday, clouds broke late filled skies with sun touched clouds, clear clean scents in the air. Morn', sultry, with a cool gentle breeze for body/soul. Active woodlands, and Apple trees. 54ºF headed to 69. Ya'll be careful out there!",4,39,2026-05-26,0.9995,positive
at://did:plc:syxpm2z3ewhok7ail2tmdnvj/app.bsky.feed.post/3mmrz3yekoc2s,2026-05-26 22:10:39.034000+00:00,Sweet #WangXian dreams 🥰💙❤️ #TheUntamed/ #CQL #陈情令 #ChénQíngLìng #cdrama #XiaoZhan肖战 #WangYibo王一博 #mdzs #mxtx,5,16,2026-05-26,0.9841,positive
at://did:plc:zo5775wogjbncnjvwupzbkiq/app.bsky.feed.post/3mms3mhvmes2f,2026-05-26 22:55:39.719000+00:00,"Read the article. Apple did not contract, it's a 3d party. Jeez.",0,3,2026-05-26,0.0024,negative
at://did:plc:djob7qp3nefs2b6uuoymeale/app.bsky.feed.post/3mmrwqnbvhc2h,2026-05-26 21:28:30.871000+00:00,"Bonus episode RE-VAMPED WITH JULIET LANDAU Podcast: Part 1 of my hang with JAKE WEST / Jake West (writer, director, producer and editor of the vampire film, RAZOR BLADE SMILE) Spotify: open.spotify.com/episode/1ACf... Apple: podcasts.apple.com/.../bonus.......",2,10,2026-05-26,0.1293,negative
at://did:plc:lrtntxm734iwhqn3ahhr3jky/app.bsky.feed.post/3mmrv6ws2hk2c,2026-05-26 21:00:43.119000+00:00,"I mean, not for nothing but re: cords, they’ve changed as many times as Android. (Mini-USB, micro-USB & USB-C for Android, 30-Pin, Lightning & USB-C for iOS). Frankly what’s more frustrating is that Apple stuck with Lightning as long as they did.",0,33,2026-05-26,0.0004,negative
at://did:plc:tzz4m2gia4ixfk3zuvxqrgdo/app.bsky.feed.post/3mmrlss4pqs2j,2026-05-26 18:12:51.893000+00:00,Reposting my bangers,2,8,2026-05-26,0.0005,negative
at://did:plc:tgeswv5aqgaf4neqvr6e3nbm/app.bsky.feed.post/3mmri4kzvw22p,2026-05-26 17:06:45.040000+00:00,"Come for the discussion of deep themes, technical wizardry and a scene by scene breakdown, stay for dreams Rotta meeting Mon Mothma. Listen here on Apple Podcasts or anywhere podcasts are. podcasts.apple.com/us/podcast/b...",1,16,2026-05-26,0.0497,negative
at://did:plc:aunpu65mdrhwfie7ynymlzeh/app.bsky.feed.post/3mmrqymggif26,2026-05-26 19:45:35.632000+00:00,"Watch the full episode of Bulwark Takes at The Bulwark and YouTube, or listen on Apple Podcasts, Spotify or wherever you get your podcasts: bit.ly/3S1Vdle?utm_...",3,13,2026-05-26,0.0043,negative
at://did:plc:fduicbuuo5z6bf34wmva2scx/app.bsky.feed.post/3mmrlar6du22k,2026-05-26 18:02:46.917000+00:00,15 species recorded on the Merlin app in exactly 10 minutes! Not bad while laying down on a lounger under the apple tree outside my studio.,2,61,2026-05-26,0.9489,positive
at://did:plc:xqkiycxt66ufxqftban3zup7/app.bsky.feed.post/3mmruu7vhg22c,2026-05-26 20:54:43.569000+00:00,I know what I listen to is all over the place but it is incredible how many misses there are on my Apple “new music” playlist and on the discovery station. They really can’t figure it out.,0,7,2026-05-26,0.003,negative
at://did:plc:6wkmlbv4opeuwppxi73ozhna/app.bsky.feed.post/3mmr3ses4ks2z,2026-05-26 13:26:18.047000+00:00,"Political consultants are complaining that non-religious voters cost more to reach b/c they expect more from candidates. Meanwhile, religious voters can be won over with “God and apple pie.” Good riddance to one of politics’ laziest shortcuts. www.friendlyatheist.com/p/the-rising...",21,68,2026-05-26,0.0031,negative
at://did:plc:chzceywfzga42xdfuvjig6xt/app.bsky.feed.post/3mmrm2xt3ak27,2026-05-26 18:17:26.307000+00:00,"Eating what I feel like is the perfect old school bagged lunch: PB&J, green apple and a bag of BBQ chips.",0,6,2026-05-26,0.9998,positive
at://did:plc:usosteutgh73pj7vr6coj4ne/app.bsky.feed.post/3mmrs6spwuc24,2026-05-26 20:06:57.629000+00:00,"Hi! Recently been having some weird heart stuff, nothing serious, it's just giving me anxiety. I added an apple watch to my thrown. No pressure at all to contribute to the crowd fund, but if you are willing, I would really appreciate it throne.com/hotpinkbunny #throne",4,14,2026-05-26,0.9876,positive
at://did:plc:ovqwsunojph2ic3etzlyczmj/app.bsky.feed.post/3mmqterw7l22g,2026-05-26 10:55:32.097000+00:00,"#AIgenerated #Electric #Car The Apple iCar (It's actually an electric Ferrari designed by Jony Ive. The original is black and blue. I just changed it to ""Apple aluminum finishes"".",2,14,2026-05-26,0.0033,negative
at://did:plc:bpxhvm3pyx2tk2cmpsavuoxi/app.bsky.feed.post/3mms75ecwn22i,2026-05-26 23:58:47.610000+00:00,"Good Evening #FiresideFriends and guests, tonight we share in a little larceny of the past at the Fireside Lounge Speakeasy, enjoy a drink, dance with an amazing guy or dame, and enjoy the food and fun of the moment with us! 🎶 suno.com/s/iFPqJzFCMP... 🎶",14,55,2026-05-26,0.9999,positive
at://did:plc:2orsuabrdskjpuglpru77po2/app.bsky.feed.post/3mmr4srmsdk23,2026-05-26 13:44:25.247000+00:00,"and if you think this is just a politics thing go check out all the apple product keynotes, the google/microsoft/meta announcements, the announcements from the big video game companies, or movie industry roll outs at cinemacon/cannes.",9,43,2026-05-26,0.003,negative
at://did:plc:5psz5hrdipj4psiplmhjmwlu/app.bsky.feed.post/3mmramekwkk25,2026-05-26 14:52:25.194000+00:00,"My son turned five months, so we've started feeding him soft stuff like baby oatmeal and puréed apple. I was feeding him with a spoon this morning and said, ""Open the pod bay door HAL,"" and he laughed. So that was fun.",1,35,2026-05-26,0.9998,positive
at://did:plc:hpcac4p2qev3okr4ofzr7tdb/app.bsky.feed.post/3mmr6gnrnhc2u,2026-05-26 14:13:26.041000+00:00,tekken 8's next guest character being apple fritter aficionado yujiro hanma might be my favourite game related announcement this year you CANNOT make this up,1,17,2026-05-26,0.0019,negative
at://did:plc:wcl5xm7mqdy2zmz2ktapgn7w/app.bsky.feed.post/3mmre43tdvc2p,2026-05-26 15:54:51.507000+00:00,"The Stock Scandal Trump filed mandatory ethics disclosures for Q1 2026. 3,700+ stock trades worth up to $750 million in 90 days. The companies? Nvidia, Apple, Microsoft, Amazon, Goldman Sachs. Their CEOs rode Air Force One with Trump the week before disclosures dropped.",32,36,2026-05-26,0.0061,negative
at://did:plc:2tyaqupr6jt5kitmr5ylxk5y/app.bsky.feed.post/3mmr7nurqis2y,2026-05-26 14:35:22.007000+00:00,Watching the Top Chef Appalachian episode and nervous sweating that someone is going to say “apple-ay-shun”,0,19,2026-05-26,0.0032,negative
at://did:plc:wie6s34baaupvunlv6dfxxqx/app.bsky.feed.post/3mmraikmhnk2i,2026-05-26 14:50:17.317000+00:00,"just deleted 500 songs from my 2000+ song playlist. i'm tired of the apple music algorithm giving me the same songs over and over again. goodbye steal my sunshine. see ya, kashmir. it's been swell",0,22,2026-05-26,0.0014,negative
at://did:plc:kb5xchj47v5ignc3hfmhm7me/app.bsky.feed.post/3mmrwukxcys26,2026-05-26 21:30:40.048000+00:00,"Which streaming service will you grace with Find Your Words? Check it out on Spotify, Apple Music, and many more! 💙 Spotify: open.spotify.com/album/3vZ1n1... Apple Music: music.apple.com/us/album/fin...",0,3,2026-05-26,0.7747,positive
at://did:plc:t3qi45gk4dwlhiixjpe2wsdd/app.bsky.feed.post/3mmrchqzmnq2j,2026-05-26 15:25:37.883743+00:00,"Tahoe what are we doin, how is system data itself taking up so much storage space that I have *negative* 127 GB of storage left, does that mean I owe Apple storage",2,38,2026-05-26,0.0002,negative
at://did:plc:6e7oylholkxmoqgrjkinfee4/app.bsky.feed.post/3mmrhvqkchs22,2026-05-26 17:02:55.940000+00:00,Maximum pleasure guaranteed on Apple TV kinda got me gagged and I’m only one episode into it,0,5,2026-05-26,0.0008,negative
at://did:plc:a5mwrq6xee2xljoa6nbc3a4l/app.bsky.feed.post/3mmritdcd4s2g,2026-05-26 17:19:28.679000+00:00,Remember when McDonalds apple pies used to be $1 for two pies? I remember.,0,5,2026-05-26,0.0063,negative
at://did:plc:mfs6r66r6ydf6udl6shbsq37/app.bsky.feed.post/3mmrh6lzrfs24,2026-05-26 16:49:59.450000+00:00,"The older Apple & Cinnamon commercials & promos featured a HANDSOME villainous scaly called “Sprinkelgator”. One of the flipbook prizes featured a wonderfully fattening defeat for him that I know lots of you will LOVE 💚 I know @furryfootage.bsky.social shared it some time ago, but I cant find it—",0,20,2026-05-26,0.0702,negative
at://did:plc:cr54zul7mvzfrc5bzt6i4ndz/app.bsky.feed.post/3mmroysbj2s2q,2026-05-26 19:09:54.549000+00:00,This reminds me that I need recommendations for a smart watch that isn't the Pixel Watch and isn't the Galaxy Watch and isn't the Apple Watch and,3,6,2026-05-26,0.0018,negative
at://did:plc:v2f7ps5p7yd3b45wd4qaarwr/app.bsky.feed.post/3mmrenng7bk2c,2026-05-26 16:04:42.996000+00:00,"I saw someone speculate that so many of the concepts from the defunct Apple EV were reused here that it's more Apple than Ferrari and honestly, I'd believe it",0,6,2026-05-26,0.006,negative
at://did:plc:oh3f3xatdfgyinnpfai5npzp/app.bsky.feed.post/3mmrk42xgfc2d,2026-05-26 17:42:15.665000+00:00,"Verifying I’m human to a robot is the worst. Also, having to confirm my ad preferences in an app and “None” isn’t an option, and needing to register for an account (or with Apple/Google/Facebook) just to look at a website.",0,17,2026-05-26,0.0001,negative
