ID_Tweet,Fecha_UTC,Contenido_Texto,Retweets,Favoritos
at://did:plc:7wcaju5ipski4agmptzaqbo2/app.bsky.feed.post/3mog5or2hss23,2026-06-16T15:51:10.302Z,"One Bad Apple Pay, by The Ozmonds #PaymentsInASongOrMovie",1,4
at://did:plc:mht5ub4ykjuoxpux77hikixt/app.bsky.feed.post/3moghecz5yg2w,2026-06-16T18:44:17.294Z,Apple may mark the iPhone's 20th anniversary with a foldable iPhone and AirPods featuring cameras. #Apple #iPhoneFold #AirPods #TechNews #Innovation #Wearables thedailytechfeed.com/apples-20th-...,0,1
at://did:plc:jeoih6uqptvhir5xpzzcvef5/app.bsky.feed.post/3moex6z6mas2y,2026-06-16T04:22:19.767Z,"I switched to Linux full time a decade ago and even though at this point the choice is really that vs Apple, there's still part of me that feels like I'm doing it to spite Microsoft",0,14
at://did:plc:kpwpdak2ntgqpnjh3mako2mi/app.bsky.feed.post/3mogj3jfhkf2b,2026-06-16T19:15:09+00:00,"Bubble Bobble was released on this day 40 years ago 🏢 Taito 📅 16/06/1986 🖥 3DS, Amiga, Amstrad CPC, Android, Apple II, Arcade, Atari ST, BBC Microcomputer System, Commodore 64, DOS...",1,5
at://did:plc:67eww33ogydahcu6dlhbhxpj/app.bsky.feed.post/3mogdnqv6ek2h,2026-06-16T17:37:59.026Z,"I recently dumped a no-longer-useful Google TV streamer for...a Roku. But I too refuse to give Fox my money or attention. So the other options are widespread; you can go corporate with an Apple TV device, or Chinese with any one of hundreds of android-powered TV boxes that will access anything.",0,4
at://did:plc:56e7yw4nkilbpsc5dzhq4xdf/app.bsky.feed.post/3mog2o4r5xc2s,2026-06-16T14:57:07.801Z,"Hal is a miscreant of epic proportions and doesn’t wanna upset the apple cart. When this shit show is over, they’re all gonna have a come to god moment and admit he lost in 2020 and that they never liked him. 😆",1,7
